ID,Comentario_Original,Clasificacion_ISO_25010_2023
201,hay dificultades para ingresar.,not_applicable
202,"Recientemente hay muchos problemas de logueo, no se puede ingresar a la cuenta en momentos urgentes.",not_applicable
203,Pésimo no se puede entrar al aplicativo tampoco se puede usar plin,not_applicable
204,Se cuelga todos los días,not_applicable
205,"porfavor arreglen los problemas que tiene el aplicativo, no está funcionando bien",not_applicable
206,"La última actualización es pésima demora en cargar o simplemente no ingresa a la cuenta, deberían independizar plin del BBVA como lo hace el BCP",not_applicable
207,"se cuelga demasiado, muchos pasos para poder ingresar. tienen que mejorar mucho esta app",not_applicable
208,"sinceramente cada vez peor el servicio. cuando más se le necesita, en mantenimiento, en mantenimiento. sinceramente le pongo cero, de las peores app's de banca móvil.",not_applicable
209,"Pésimo servicio, últimamente se cuelga y demora en cargar.",not_applicable
210,para fallando,not_applicable
211,Muy chevere pero se cae a cada rato sin mencionar que es lento.,not_applicable
212,No me permite ingresar a la app con mis credenciales e intentado por 3 dias seguidos 🤦‍♀️.,not_applicable
213,"app demasiado lenta, demasiados errores, el plin no funciona, se cae la aplicacion muy seguido, y se tiene que esperar un largo tiempo.",not_applicable
214,"hola, Buenos días estoy tratando de plinear o yapear pero me sale error, hasta cuándo será así está app que mala experiencia",not_applicable
215,"Cada día peor esta aplicación, te pide token a cada rato, es super molesto estar ingresando a activar con dni y foto. Además que se cuelga en plena transferencia, ni que decir q ahora te descuentan cada 3 pagos o retiros. BASURA DE APP REALMENTE",authenticity
216,"pésima, una basura está aplicación...para llorar",not_applicable
217,mal muchas fallas no me deja ingresar y más,not_applicable
218,pésimo el aplicativo no pasa nada muy lento se descuelga,not_applicable
219,"Luego de usarla y ""cerrarla"", tengo que ir a aplicaciones y forzar el cierre de la app porque de lo contrario si intento volver a ingresar se queda congelada. Muchas veces hay problemas para entrar en la aplicación. Bastante mediocre.",not_applicable
220,"No puedo ingresar a la app en reiteradas ocasiones, esto es el un desastre, por favor mejoren",not_applicable
221,"otra vez no permite ingresar al aplicativo y son dos veces esta semana que presenta este error, uno ya no puede disponer de su dinero de manera inmediata a traves de plin!! deberian separar el plin del aplicativo igual como es con el bcp",not_applicable
222,hoy 17/7/25 no puedo entrar a la app aparece error,not_applicable
223,se cae cada rato.,not_applicable
224,muy mal no deja ingresar después de la actualización.,not_applicable
225,"07/2025: se ha caido la app no permite iniciar sesion para hacer operaciones, llamo a asistencia telefonica del banco y la contestadora automaticamente me dice que no hay sistema y que haga mis operaciones en otro momento. nadie contesta esto tiene varios dias, no recomiendo el uso de esta app",not_applicable
226,una porquería de app se cuelga se cierra no deja enviar depósitos a contactos y las actualizaciones empeoraron todo pensando muy en serio en cambiarme de banca por culpa de una app que en vez de simplificar todo retrasa las operaciones,not_applicable
227,buena app,not_applicable
228,no es seguro 🔐 y encima te cobra mantenimiento una porquería total,not_applicable
229,Ya apliquen la nueva interfaz que existe en otros países. Ya esta se siente obsoleta,not_applicable
230,"al inicio funcionaba bien pero ahora tengo que activar el token diario, no se cual sea el motivo pero es incomodo",authenticity
231,esta horrible la aplicación no se puede plinear ni nada,not_applicable
232,buena,not_applicable
233,"UNA PORQUERÍA, NO PUEDO ACEDER A TOQUEN NI PLIN,PORQUERIA DE APLICACION",authenticity
234,"La aplicación siempre se cuelga o falla desde el día uno que me la instalé. Me pide que active mi token digital a cada rato. Y cusndo lo quiero activar tengo que hacer como 5 intentos porque antes que procese se cierra la app. Pésimo, igual al momento de usar el Plin.",authenticity
235,No me deja afiliar mi cuenta a pesar de introducir los datos que me solicita,authenticity
236,Una basofia la apo,not_applicable
237,"Pésima, está la aplicación, se satura a cada rato.. estoy intentando plinear varios días y no reconoce los contactos se queda en blanco... y nadie da solución, otros días eh tenido que reiniciar el teléfono para poder ingresar...",not_applicable
238,Una porquería sistema arcaico e ineficiente,not_applicable
239,"La peor aplicación y el peor banco. Siempre para caída la app, cuando funciona se duplican las transacciones, cuando quieres realizar un PLIN sale error servicio no disponible inténtalo luego. Quieres realizar transferencias a las 10 pm no puedes porque esta en mantenimiento, que estupidez de banco.",integrity
240,no debe cobrar mantenimiento,not_applicable
241,Sería excelente si no se cayera plin,not_applicable
242,"naa que mal aplicativo, no deja ni afiliarse.",authenticity
243,"Mejoren el tema de ""AGREGAR SERVICIO A PAGAR"" por favor, q se guarde el # de suministro del cliente como sucede en BCP al pagar luz, agua, etc, En app BBVA solo queda grabada la búsqueda de la entidad, luego tengo que buscar mi factura fisica y poner mi # de suministro, y en BCP no es asi, alli pagas un servicio presionas ""GUARDAR EN FAVORITOS"" y se graba la entidad y tu número de suministro, que pasaría si no se mi # de suministro? o si no lo tengo a la mano? por favor facilitenos las cosas.",not_applicable
244,Pasadas las 12 de la noche no funciona y te mete en apuros.,not_applicable
245,"solucionen su App, está demasiado lenta, no puedo ingresar y ya son más de 2 meses con ese mismo problema.",not_applicable
246,Mal servicio con este token digital aplicación más complicada a cada rato actualización por dios,authenticity
247,Demasiado demora en ingresar mucho las veces más rebota el ingreso también no me deja hacer transferencias ni plinear y menos yapear,not_applicable
248,"malísimo tiene problemas para pagar los servicios ,",not_applicable
249,"Tuve que RESTABLECER LA APP para que recién funcione la ACTIVACION DEL TOKEN ni APAGAR SE PODIA, decia SOLO EL TITULAR DE LA TARJETA, que soy yo. :|",authenticity
250,está aplicación es malísima hace perder más tiempo se cuelga demasiado por favor sres arreglen eso,not_applicable
251,"pésima app, me hizo pagar 2 veces una cuenta porque se colgó el plin, hice una transferencia de 30 soles y solo me reflejo 19 me fui a quejar y me dicen que no se puede verificar el monto ya que hice más transferencias y lo peor de todo es que se demora un huevo en entrar a la app, siendo una banca internacional solo sirve por las huevas, me hace perder más dinero que guardar enserio espero que puedas dar solución a esto porque si no me cambio",integrity
252,hasta cuando van arreglar esta aplicación reinicié 20 veces al día para que habrá es un desastre estar asi,not_applicable
253,"Hoy intenté entrar y mostró error dentro de la aplicación, tenía que pagar algo y me falló por enésima vez ésta condenada aplicación.",not_applicable
254,hay días que no abre app,not_applicable
255,"La app tiene muchas fallas , no me permite entrar , se queda cargando , cuando quiero ver datos de tarjeta sale error , salgo , vuelvo a entrar y ya no ingresa.",not_applicable
256,no funciona el app,not_applicable
257,está fallando la aplicación,not_applicable
258,"se está volviendo pésimo, no deja entrar, y fastidia mucho cuando quieres hacer una transferencia, o plinear, no deja. no se por que tiene tantas estrellas si la mayoría tiene solo 1 estrella.",not_applicable
259,últimamente se cuelga a cada rato. no ingresa no permite terminar de realizar las operaciones se queda cargando fatal.,not_applicable
260,"me voy a cambiar de banco porque su sistema es pésimo, se cuelga a cada rato, sale error, en este momento no es posible intentar más tarde, desde las 8am son las 2 pm y no puedo utilizar mi dinero desde el app, a cada rato pide activar el token perdida de tiempo con este banco",authenticity
261,mal servicio ni siquiera permite entrar,not_applicable
262,pésimo lo de plin ayer hize 3 movimientos con destino yape y ninguno llegó a su destino hasta el día de hoy .. alguna solución con la devolución del dinero?,integrity
263,"últimamente falla mucho la app, no se que pasa que se cierra o no deja ingresar",not_applicable
264,"no puedo pagar mi tarjeta por la aplicación, todo el tiempo es un problema",not_applicable
265,"me sale a cada momento error para poder ingresar al app. La he desinstalado y ahora me sale una versión que me parece demasiado básica en imágenes y quiero acceder con mis datos , coloco todo y no se pinta el botón que me permite continuar... qué incomodidad!! y no me digan que me tengo que acercar a una agencia porque no tengo tiempo",not_applicable
266,"tiene demasiado fallos, es lento, tiene muchas caídas del servicio y siempre muestra el saldo y eso es peligroso. no da la opcion de poder filtrar si uno quiere o no ver el monto de la cuenta.",confidentiality
267,"Acabo de plinear 10 soles y no me figura el comprobante, solo me descuentan ¿y? ¿como voy a dar cuenta? ¿Es error del sistema? Me aparece error a cada rato.",non_repudiation
268,"por favor solucionar el incidente, desde las 7am he intentado acceder y no me permite.",not_applicable
269,Podrían arreglar por favor .... No funciona nada... Ni plin ni transferencias ni nada..... Se cuelga o sale error error error....,not_applicable
270,no me deja entrar,not_applicable
271,la nueva actualización no sirve no se puede iniciar sesión horrible experiencia de usuario,not_applicable
272,a cada rato se cuelga y no puedo ingresar,not_applicable
273,pésimo el día de hoy no abre para nada no sé si mi cuenta está o mo,not_applicable
274,la app empieza a fallar cuando más la necesitaba,not_applicable
275,"no me deja iniciar sesión, arreglen eso por favor...",not_applicable
276,"mala app, me cambiaré de banco no me deja entrar a la banca móvil",not_applicable
277,es una porquería esta app cuando da la gana abre y hay días cuando más necesitas se cierra es una tontería estás app,not_applicable
278,pésimo la verdad cualquier que pago que hague se lagea,not_applicable
279,"Este app una porquería, me convenció hoy 170725 no puedo enviar un Plin ni transferir a otra cuenta con SUMA URGENCIA. Mientras que mi Yape y mi BN funcionan sin inconvenientes. no recomiendo esta m.",not_applicable
280,tengo que reiniciar mi teléfono para poder hacer plin,not_applicable
281,no abre,not_applicable
282,es una real porquería,not_applicable
283,muy lento en una ocasión deposite 2 veces por causa que es muy lento,integrity
284,"Banco asqueroso, no llega el dinero que le yapeo a otras personas y ni siquiera me deja iniciar sesión. Ese 4.7 de calificación deben de haberlo colocado sus bots y propios trabajadores",integrity
285,"Porque se les ocurre ponerse mantenimiento en PLENO DÍAAA, se para colgando y no da el plin EN EL PEOR MOMENTO",not_applicable
286,esta Fallando la Aplicacion... 😡,not_applicable
287,no me permite ingresar a la app,not_applicable
288,no me deja abrir la app y quiero ver mi saldo,not_applicable
289,En los momentos que mas lo necesito se bloquea sin ninguna razón. e tenido que devolver varias compras o perder mi tiempo buscando que me presten dinero asta que ya se pueda ingresar...,not_applicable
290,aveces se complica abrir .. teniendo internet no se puede,not_applicable
291,"Esta app es una basura, muchas veces al momento de ingresar al aplicativo se vuelve lenta o simplemente no ingresa repitiendo que vuelva a ingresar nuevamente.",not_applicable
292,No permite el iniciar sesión.,not_applicable
293,adivinen de nuevo se cayó la app,not_applicable
294,horrible está aplicación.,not_applicable
295,no puedo ingresar a la aplicación esperó que lo solucione lo más pronto posible.,not_applicable
296,"no puedo abrir la aplicación, hay algun problema?",not_applicable
297,no puedo entrar ah mi apps me sale error,not_applicable
298,app con problemas,not_applicable
299,La peor aplicación para pagar mucho carga y en sima eata fuera del sistema no se puede pagar,not_applicable
300,"Actualmente y en muchas ocasiones, el aplicativo se reinicia como si fuera un aplicativo desactualizado, no permite hacer Plin ni transferencia por que pide activar token, cuando ya ha estado activo.",authenticity
