ID,Comentario_Original,Clasificacion_ISO_25010_2023
1501,"Terrible est치 actualizacion del APP, empezando por la interfaz, que es dif칤cil de buscar para hacer las operaciones que com칰nmente hacia , adem치s de s칰per lento..( no es mi internet, porq. Todas las otras apps ingresan r치pidamente) , cada vez que utilizo esta APP pienso en cambiar de banco ( si a칰n, no lo hago es por necesidad de utilizar la cuenta de ahorros)",not_applicable
1502,"Mal칤sima, desde esta nueva versi칩n no ha hecho nada m치s que empeorar y empeorar, es una tortuga, es puro lag y tiempos de espera. En qu칠 estaban pensando? La versi칩n antigua era la mejor aplicaci칩n de banca y ahora es un desastre, p칠sima. No hay justificaci칩n, deben volver a la versi칩n anterior. Me indicaron que la actualizara, lo hice, igual, incluso la desinstal칠 y la volv칤 a instalar y sigue peor, ni siquiera abre se queda en el logo, simplemente no sirve, no se puede hacer nada con ella.",not_applicable
1503,"Hace 3 d칤as que la aplicaci칩n no se ""ejecuta"", y solo se aprecia las introducci칩n de la app ""bbva"". Intente reiniciar el tel칠fono, borrar datos, borrar cache, desinstalar la app, volver a instalar, y nada, absolutamente nada.... no es el caso de BBVA Wallet, ni lukita. Soluciones? (Telefono: Samsung A10)",not_applicable
1504,"Instal칠 est치 actualizaci칩n y es p칠sima. Ingreso mi clave internet y la APP se congela. Despu칠s de unos 15 segundos ce cierra sola. Muy mal. Desde que cambi칩 la interfaz, se puso muy lenta y salia errores en algunas operaciones, pero esta actualizaci칩n est치 mucho peor.",not_applicable
1505,"Desde hace tiempo viene fallando. Es impropia de ser una App de un banco que se respete. P칠sima, llena de propaganda de pr칠stamos y seguros, SUPER LENTA, se bloquea la pantalla antes de que inicie la aplicaci칩n, toma m치s de 60 segundos, imposible si necesitamos r치pidamente hacer un pago. La huella digital para acceso solo permite un dedo, si te olvidaste de que mano o que dedo usaste, encima de la demora en iniciar la app, vas a estar probando con cada dedo...",authenticity
1506,"Hola BBVA siempre apoyo el cambio y el dise침o me parece muy bueno, el problema es que hemos estado acostumbrado a la versi칩n anterior , de echo nos cuesta por ahora adaptarnos , reci칠n lo estoy probando entendemos que todo cambio cuesta pero quiz치s lo pudieron haber echo de manera gradual y no tan radical. Bueno esperemos adaptarnos a este nuevo dise침o.",not_applicable
1507,"Cada d칤a de mal en peor, eliminaron la opci칩n de enviar de Plin a Yape por numero, ahora hay que escanear, y lo otro, es m치s lenta y hace doble operaci칩n, que pasa sres, soluciones por favor, esta nueva actualizaci칩n en deficiente, y hay horas en que la aplicaci칩n ni abre y me deja en blanco, que paso sres, necesitamos soluciones. Gracias",non_repudiation
1508,"Buenas noches, la actualizaci칩n del BBVA es un desastre la app no abre al menos que este conectada a una wifi, antes pod칤a entrar usando mis datos moviles, es una complicaci칩n ya que 2 veces he pasado verg칲enza al momento de querer hacer un plin, que he tenido que llamar para que me yapeen y pagar x yape muy lamentable lo que est치 sucediendo con esta app y no solo yo ya he visto caso con mis compa침eros que les pasa lo mismo. 游녩",not_applicable
1509,"Ahora demora demasiado en cargar y casi siempre me sale error. Cambia la apariencia pero no hay mejoras en el sistema, no me permite hacer pagos ni gestionar como antes lo hac칤a, es m치s era m치s intuitivo que ahora. Lance una nueva actualizaci칩n o retornen a la previa.",not_applicable
1510,"Tan bonita y funcional que estaba la aplicaci칩n. Debo admitir que visualmente se ve mejor, pero no sirve de nada si va a ser tan lenta. Estamos en toda la 칠poca de la rapidez y creo que no tuvieron en cuenta ese aspecto. Funciona tan mal y tan lento que en realidad dan ganas de ir al banco.",not_applicable
1511,"Una decepci칩n total est치 nueva actualizaci칩n, quiero hacer transferencias, Plin y otras operaciones y ni bien se ingresa al aplicativo sale la poci칩n de reconocimiento facial y huella digital y la cual al quer칠r configurar solo sale error, de nada sirve tener la aplicaci칩n porque no se puede realizar ninguna operaci칩n porque se bloquea con la opcion de huella digital",authenticity
1512,"Realmente decepcionante, cada vez q se actualiza el app se desactiva el token digital, igualmente despu칠s de cada cierto se desactiva el token digital y hay q volver activarlo, con 칠sta ultima actualizaci칩n no deja activar el token digital, entro despu칠s de aprox. 14 d칤as para hacer una operaci칩n urgente y me encuentro con el token Digital desactivado. Entonces entro a la opci칩n para activar el token digital, marco la opci칩n he le칤do los t칠rminos y condiciones y le doy a activar, se queda pensando el app, el app se queda colgado en esa ventana, empiezan a llegar una enormidad de mensajes SMS con el c칩digo de validaci칩n, de dos n칰meros diferentes, y la app se pone en blanco y sale el mensaje ""se ha producido un error, No es posible realizar la operaci칩n en estos momentos. Int칠ntalo mas tarde desde la secci칩n de configuraci칩n"" . En el d칤a de hoy llev칩 mas de dos horas intentando activar el token digital sin 칠xito muy frustrante. De que sirve una actualizaci칩n ""est칠ticamente m치s bonita"" si funcionalmente es una basura, no puedo realizar ninguna operaci칩n por la app de banca m칩vil ni por la banca por internet, xq todo depende del TOKEN digital, el cu치l no se puede ACTIVAR. DENLE SOLUCI칍N.",authenticity
1513,"Demasiada publicidad..Es una muy mala aplicaci칩n, las operaciones frecuentes tienen un monto viejo, no permite visualizar antes de aceptar, si se est치 de acuerdo o no, por suerte a quien transfer칤, me hizo la devoluci칩n, de paso cobran comisi칩n siendo el mismo banco, no es f치cil conseguir las cosas, vuelva a la anterior esta es un asco, recuerden que hay adultos mayores que la usan, por no poder ir a oficina.",not_applicable
1514,"Para operaciones de transferencia funciona bien. Noto que si te conectas a una red WiFi es muy probable que te salga el mensaje de error del token igual que si usas el plin con WiFi no puedes hacer pagos, ser치 por seguridad? Si usas el internet del celular puedes operar la app con normalidad pero el plin si es un desastre una eternidad para cargar la agenda para seleccionar para ingresar el importe todo demora en exceso y parecer como si no hubiera apretado nada, deben mejorar el Plin por favor!",authenticity
1515,"En verdad que es una lastima que hayan arruinado al app con su actualizaci칩n. Y estaba a punto de aceptar su invitaci칩n de cambiar mi cuenta sueldo a este banco, menos mal me di cuenta de los errores que tiene antes. Recomiendo regresar a su interfaz anterior si no desean perder m치s usuarios digitalizados.",not_applicable
1516,"muy lento el app le falta fluidez, ya hice lo q m indicaron de borrar cache varias veces pero igual es lento.... Expl칤came como mostrarte con una captura la fluidez del app? Y no entiendo porque pedirme datos si es su aplicativo el lento, cuando ten칤an la versi칩n antigua la m치s simple y pr치ctica su fluidez era excelente mejor que otros bancos pero ahora no....",not_applicable
1517,"De verdad es de lo peor que he visto comparado con otros app de los bancos, hasta el momento nadie se pronuncia ni se dignan en dar soluci칩n, piden que envien correo y es un saludo a la bandera ya que nadie responde, hasta la fecha no se puede ingresar al app del bbva. Respondan a las quejas o la gente terminar치 optando por otro banco que de m치s facilidades.",not_applicable
1518,"P칠sima actualizaci칩n antes se manejaba todo bien, ahora tiene fallos en el momento de pagar y no te llegan las notificaciones por correo de los pagos realizados, muy mal, ser치 motivo de probar otro banco en el que puedas realizar los pagos sin problemas y con las notificaciones respectivas, realice lo solicitado y ahora no reconoce mi huella digital y tengo que escribir los d칤gitos de los token y al ingresar tambien antes reconoc칤a la huella ahora no funciona, no puedo hacer pagos",authenticity
1519,"Pesima app la anterior con sus fallas era mejor, es demasiado lenta, demora en cargar, cambias a otra pantalla y luego regresas y la app se cuelga, hay q salir y volver a entrar, es desesperante. Tengo buen internet y un celuar de buena gama, asi que el problema es la app. Ojal치 tomen en cuenta a sus clientes y mejoren esos temas. Gracias!",not_applicable
1520,"El d칤a de hoy la aplicaci칩n se coron칩; un fiasco. Para nada permit칤a ingresar. Cuando intento ingresar autom치ticamente me bota y aparece un mensaje ""la aplicaci칩n sigue fallando"". Un desastre. Tantos recursos y no pueden proporcionarnos una aplicaci칩n a la altura.",not_applicable
1521,"Demasiado lento a pesar de que mi equipo es gama alta y sus funciones son m치s confusas, sino veo lado por lado no encontrar칤a las opciones, si para nosotros los j칩venes lo vemos dif칤cil imag칤nense para un cliente no digital, se pierde. Estaba mejor la versi칩n anterior, m치s sencilla y r치pida.",not_applicable
1522,"La 칰ltima actualizaci칩n es p칠sima Hola bbva ! La app es super lenta, cero interactiva , mas compmicada que la anterior. La app antes de la actualizaci칩n era una de las mejores (si es que no era la mejor ) del mercado. Rapida, din치mica y amigable. No habr칤a forma de regresar ?",not_applicable
1523,"Tristemente esta app no merece ni una estrella, la app sol칤a diferenciarse de los dem치s bancos por ser simple u eficaz al usar pero hoy me decepciono por completo me demore 20 minutos en hacer dos transacciones y descubrir como funcionaba todo. Un total fraude para algo que me tomaba 1 minuto sin la actualizaci칩n. Consideren volver a lo b치sico y m치s pr치ctico.",not_applicable
1524,"P칠sima actualizaci칩n no puedo hacer pagos de servicio y me muestra un error que dice que existe c칩digos vac칤os en el c칩digo generado, que es propio del token. Ya hice la llamada a banca telef칩nica y envi칠 el correo donde muestro la captura de pantalla. Ojal치 se tomen la molestia de abrir y solucionar el problema. Si quieren m치s detalles pues indiquenos que debemos hacer para que se solucione.// ENVI칄 EL CORREO HOY POR LA MA칌ANA Y YA LO VOLV칈 A ENVIAR CON LA INFORMACION SOLICITADA.",authenticity
1525,"La versi칩n amterior era m치s interactiva y precisa. Esta nueva versi칩n confunde y las opciones est치n muy dispersas cuando piede estar en un solo lado, como en la anterior versi칩n. Se ve 2 veces mi cuebta de ahorro y confunde al no ver los monto retenidos como en la anterior versi칩n.",not_applicable
1526,"P칠sima app. Cero funcionalidad. La pantalla se bloquea, no responde al clic al momento de hacer transferencias. Hice una transferencia pero al ver que no respond칤a la pantalla cancel칠 la operaci칩n. Horas m치s tarde veo que la operaci칩n fue procesada. Hoy intent칠 hacer una transferencia con un monto mayor y me pas칩 lo mismo. Ahora temo que ese monto se procese m치s tarde cuando decid칤 nuevamente suspender debido a que no pod칤a hacer clic al siguiente paso.",non_repudiation
1527,"Estoy muy enojada nuevamente con ustedes, he desinstalado e instalado la app, no s칠 cuantas veces, sin embargo el problema persiste y no puedo iniciar sesi칩n, tan es as칤 que envi칠 2 capturas al correo del programador, sin embargo no obtengo respuesta alguna..... Por favor solucionen el problema a la brevedad posible...... Gracias",not_applicable
1528,"Cuando descargue la aplicaci칩n BBVA, todo iba bien, pero hace unos meses est치 p칠simo el servicio del aplicativo, intento plinear y me sale error activa tu token digital y est치 activado, luego intento ver si est치 activado el token digital no me sale la opci칩n, y estoy en ese plan hasta que se le da la gana y se configura. Llamo a la central BBVA y me dicen que es por motivos de seguritad y tantas mentiras, espero BBVA con las ganancias que genera, haga algo por sus clientes.",authenticity
1529,"C칩mo se logra que las cantidades de una o m치s de una cuenta de un usuario no se muestren al usar la app? As칤 como en Banca por Internet, hay una opci칩n para mostrar y ocultar la informaci칩n, al ocultar salen asteriscos. Cuando uno la usa fuera de casa la informaci칩n est치 a la vista, incluso est치n las c치maras de seguridad. Favor de crear esa opci칩n en esta app, y de mejorar el pago con QR de Plin, antes se pagaba con normalidad y ahora se ve una pantalla azul.",confidentiality
1530,"Porque cambiaron la aplicaci칩n!!!! Esta actualizaci칩n es p칠sima no se puede visualizar bien los movimientos, entre otras fallas m치s; regresen la aplicaci칩n ha como estaba, era muy f치cil de usar, entendible y practico para realizar varias operaciones.",not_applicable
1531,"Semana atr치s, la aplicaci칩n funcionaba perfectamente ahora cuando ingreso se queda pantalla en blanco y no carga nada, tengo que volvie abrir o reiniciar mi laptop para poder ver mis cuentas. Por favor solucionar esos inconvenientes que a nosotros como clientes nos hace perder tiempo y paciencia.",not_applicable
1532,"Por una parte buena y por otra lamentable, quiero hacer el pago de mi tarjeta y nunca termina de cargar para empezar a pagar, por mas que reinicie la app para el pago nunca termina de cargar y es una gran incomodidad, espero puedan arreglar ese error para no tener que ir hasta un agente a pagar la tarjeta de uno mismo.",not_applicable
1533,"Me pregunto en qu칠 momento decidieron actualizar la aplicacion sin tomar en cuenta a los clientes que ya est치bamos acostumbrados a un tipo de aplicativo f치cil sencillo de realizar transacciones y poder activar y desactivar opciones de comprar o pagos. No entiendo porque lo ponen tan complicado, podr칤an volverlo a la actualizaci칩n anterior porfavor. As칤 no nos complican la vida. Todo estaba bien. Hasta esta maldita actualizaci칩n que nada de familizacion tiene con la otra , es totalmente otro.",not_applicable
1534,"Su App tiene demasiadas cosas que uno ya no sabe ni donde ver, ni donde ir. Parece un puesto de peri칩dico lleno de varios peri칩dicos colgados que no sabes ni donde mirar, cuando lo 칰nico que quieres hacer es pagar o ver tus movimientos. Esas ventanas emergentes, publicidades deber칤an ser opcionales de mirar.",not_applicable
1535,"Muy lenta ,para hacer un plin el lector del c칩digo QR nunca enfoca , adem치s es azul y topa con cualquier cosa , cuando busca el contacto en la agenda se cuelga y se cierra , pens칠 que era x el tel칠fono pero tengo otro y es igual , muy lenta , deber칤a separar el plin de las otras operaciones y opciones del banco ,gracias",not_applicable
1536,"Me parece una app p칠sima, si alguien tiene la opci칩n de no actualizar , no lo haga, la anterior APP era muy simple y rapida de usar , se realizaban las transacciones con facilidad como pagos, ahora ni lukita funciona, solo provoca cerrar el APP, voy a tener que cerrar mi cuenta si este problema persiste porque te dificulta completamente , la 칰ltima transacci칩n ser치 transferencia a otro banco. Cambien a la APP anterior a la brevedad por favor.",not_applicable
1537,"La actualizaci칩n de dise침o que han hecho esta poco entendible y no es intuitiva para ayudarte a hacer la operaci칩n que deseas. La aplicaci칩n adem치s a pesar ser simple de vista, consume mucho recursos del celular al usar animaciones y el uso de color central opaca la funci칩n de una buena visi칩n. Este formato solo esta hecho para que un celular de gama media a alta pueda usarlo sin hacer que colapse la app. Sugerencia: vuelvan a un formato que sea para todo smartphone y que sea mas amigable",not_applicable
1538,"He usado la versi칩n anterior de esta aplicaci칩n y era muy buena. Est치 versi칩n actual, es poco intuitiva y, por eso, no es f치cil usarla. Desde mi punto de vista, ser칤a mejor volver a la INTERFAZ de la versi칩n anterior, corrigiendo posibles errores que trataron subsanar.",not_applicable
1539,"Desde la ultima actualizacion no se puede ingresar adecuadamente a la aplicacion. A parte de eso, la interfaz es menos amigable que la anterior version... es un problema no poder entrar a mi aplicacion para poder hacer mis movimientos, se queda en blanco y nuca llega a ingresar... muy mala actualizacion, espero lo solucionen pronto...",not_applicable
1540,"La app funciona, pero debes de tener un procesador gama alta para que vaya un tanto fluido, yo tengo uno, pero a pesar de tenerlo, hay crasheos constantes! Deber칤an de hacerle un Downgrade a la app, a donde estaba antes de ponerla m치s pesada y poco funcional Recuerdo que antes era r치pida, f치cil de usar y segura, cosa que todos quieren Recuerden no todos tienen celulares con procesdores gama alta, para soportar su contenido tan pesado y extravagante Downgrade urgente",not_applicable
1541,"La app ha cambiedo, aun no es tan ergonomica como deberia pero va mejor, solo que es lenta, parece pesada. El lector QR es fatal, todo se ve azul semitransparente y no deja poner decimales, siempre es mejor pedir el numero del bodeguero para pagar, parece que solo la hacen para Samsung q ya no son los mejores",not_applicable
1542,"La anterior versi칩n era mucho m치s fluida y sobre todo estable ya se en el envio y recibo de dinero por Plin, en cambio est치 actualizacion te mando obligatoriamente a lunita que creo ya teniendo Plin est치 de m치s lukita y segundo tiene muchos fallos en tema de estabilidad y fluidez se traba mucho :( , espero y lo puedan solucionar muy pronto ya que se hace complicado hacer alguna 칩peracion desde la app.",not_applicable
1543,"Es preocupante lo mala que es la app. Todo es mal. Muy bonita pero mala para la r치pida transacci칩n y actualizar los movimientos. Ser칤a algo tonto decir que hay gente que se pase a otro banco solo por el app, pero este es el caso. Nada amigable y tiene 7 d칤as de retraso. Si manejas dinero seguido, este ahora es un mal banco.",integrity
1544,"Muy mala aplicaci칩n. Deja en las operaciones frecuentes el 칰ltimo monto ttansferido a la cuenta y la pr칩xima vez que quieres hacer transferencia en autom치tico avanza con ese monto, se presta para confusiones y malas transferencias. Un problema para poder transferir no te deja tienes que intentar mil veces cerrando y abriendo la aplicaci칩n.Cuando quieres guardar alguna cuenta a operaciones frecuentes no lo hace. No es amigable. P칠sima la actualizaci칩n de la app.",not_applicable
1545,"La que 칰ltima actualizaci칩n es una porquer칤a, limpie cache como me indicaron. Y ahora no puedo hacer nada porque me pide activar huella digital e intento activarla pero me dice ""ha ocurrido un error"" en vez de realizar mejoras esta app est치 muy mala. Prefiero la anterior versi칩n que era mucho m치s r치pida. Ahora no puedo realizar ninguna operaci칩n",authenticity
1546,"Mal칤sima la aplicaci칩n. Si a los estudiantes de Ingenier칤a de Sistemas se les quiere ense침ar qu칠 es lo que no deben de desarrollar como apps, esta aplicaci칩n ser칤a uno de los mejores ejemplos. Mala funcionalidad, cero intuitiva, escasa optimizaci칩n del dise침o, nula usabilidad, mal rendimiento, llena de fallos y m치s. Si hubiera la alternativa de poner cero estrellas, ser칤a mi opci칩n id칩nea.",not_applicable
1547,"Desde que abr칤 mi cuenta en BBVA siempre me gust칩 la aplicaci칩n m칩vil, era muy pr치ctico y la interfaz amigable, era f치cil de ubicar todas las opciones, sin embargo con la nueva actualizaci칩n ya no es as칤. Si bien es cierto est칠ticamente se puede ser mejor en competencia con los otros bancos, pero le quit칩 la simplicidad de hacer transacci칩n en pocos pasos, que es lo que se necesita. Agradecer칤a si le hacen algunas mejoras a su aplicaci칩n haci칠ndola m치s simple al usuario.",not_applicable
1548,"Esta p칠sima esta app. Se cuelga demasiado. Por cada operaci칩n que se realiza se cuelga Y los saldos reales no aparecen. Se tiene que cerrar y volver abrir la aplicaci칩n, para visualizar los saldos. Prefiero mil veces la app anterior. Esta nueva versi칩n s칩lo confunde. Quer칤a hacer transferencia entre mis cuentas soles y se mando a la de d칩lares. Me hizo perder por tipo de cambio. No puedo ver mas detalle de la transferencia a terceros o inter bancarios. Salen muchos anuncios. CAMBIEN URGENTE!",integrity
1549,"Cuando quiero plinear a un contacto es una tortuga y se cuelga, tengo que entrar a plinear a otros n칰meros y digitar manualmente el n칰mero de mi contacto... Yape se lo lleva de encuentro, es mucho m치s 치gil... El resto de funciones de la app si me funcionan bien, pero a la parte de plin le falta mucho",not_applicable
1550,"La aplicaci칩n es p칠sima cuando la descargue por primera vez funcion칩 bien hasta el momento que agregue la huella, y cuando lleg칩 la actualizaci칩n fue peor ahora no me deja apagar la huella entro con la contrase침a y enseguida me pide que agregue la huella y siempre dice ocurri칩 un problema y no me deja hacer nada. No la recomiendo",authenticity
1551,"La versi칩n anterior era mucho mejor.. es esta versi칩n al realizar un dep칩sito, los saldos no se actualizan inmediatamente, al prender la tarjeta continua figurando como apagada..se tiene que cerrar y entrar nuevamente para que se actualice... no entiendo por qu칠 repiten arriba y abajo las cuentas que uno posee... en resumen nada amigable pero estoy obligada a usarlo.",integrity
1552,"La verdad es un ploblema cada vez que ingreso a esta app, no puedo realizar nada al instante sale que tengo que descargar token digital, me pide que espere que me llegar치 un SMS con una clave para ingresar lo cual nunca llega. Siempre es lo mismo. Que solucionen esto pero ya. Por que e actualizado varias veces pero siempre es lo mismo.",authenticity
1553,"Por mucho, much칤simo, es la peor app de banco que he usado, desde hace m치s de un a침os que la uso, ha presentado mucho errores al cargar, muchas veces no funciona el plin, se cuelga, es terrible, realmente TERRIBLE! Porque ""no ven"" en solucionar todos esos problemas???? Yo ya la vi hace tiempo!",not_applicable
1554,"Estimados definitivamente la versi칩n anterior estaba mucho mejor, ahora tengo problemas, cuando quiero hacer transferencias me indica q hay problemas q lo haga m치s tarde, el detalle es q este problema sigue mostrandose todo el mes de octubre as칤 mismo, su opci칩n de lukita de igual manera presenta errores, no permite ingresar y solo muestra mensaje intentelo m치s tarde, ahora al pasar por diferentes opciones demora mucho en hacer la selecci칩n se queda cargando a pesar q el cel es de alta gama.",not_applicable
1555,"Donde est치 plin ;( quiero hacer transferencia y no encuentro plin ;( normal me funciona la aplicaci칩n con huella etc pero es mejor q est칠n los dos el token y la huella para mayor seguridad ... Aparte el dise침o de la app est치 que me marea peor q el aplicativo de bcp, antes era sencillo y f치cil... Y mucha propaganda de pr칠stamos etc me estresan! ;( Si est치 buena la idea de su actualizaci칩n pero un poco piensen en q los clientes puedan entender la aplicaci칩n, no complicarla.",not_applicable
1556,"Horrible tu nueva actualizaci칩n. Lenta y con falta de informaci칩n. No encuentro como antes (que era m치s f치cil) el n칰mero de cuenta y c칩digo Interbancario. No me parece nada segura, da miedo equivocarse y que desaparezca el dinero. Ahora es puro color y menos informaci칩n. 쮻칩nde encuentro el c칩digo interbancario y c칩mo puedo compartir la informaci칩n de mis n칰meros de cuentas?",not_applicable
1557,"P칠sima App, solo funciona en las dos ultimas versiones de Android, quien pone en linea una App donde no puede cubrir la media de equipos en el mercado, cuando la versi칩n anterior funcionaba perfectamente. Es slogan de la nueva app dice Ahora es mucho mas Facil, yo siento que es una desgracia, por que perjudican a los usuarios.",not_applicable
1558,"La 칰ltima actualizaci칩n est치 generando bastantes problemas al abrir la app carga pantalla azul y se reinicia el celular. El problema es la nueva interfaz es muy pesada para un celular de gama alta probablemente no tenga problemas pero para otros equipos generar치 que se reinicie el equipo, como ya muchos usuarios lo reportaron, sugiero que se retorne a la anterior versi칩n o se haga cambios a esta 칰ltima que sea m치s ligera los usuarios queremos un app sencilla y ligera.",not_applicable
1559,"Le pondr칤a 0 estrellas. Cuando inicias sesi칩n aparece todas las opciones muy juntas y no deja seleccionar, quiero hacer una transferencia y se pone pantalla en blanco, quiero activar mi token digital y tambien la pantalla en blanco 춰Esta aplicaci칩n no me deja hacer nada! Espero que lo solucionen y no lo dejen en el aire.",authenticity
1560,"P칠sima app , a칰n tengo problemas para activar el token digital, el banco me indica que debo de esperar hasta 5 d칤as para que solucionen el problema. Mi n칰mero de celular no puede recibir mensajes de este banco, no lo bloquee, no encuentran soluci칩n, todo un caso. Decepcionada totalmente y veo que no soy la 칰nica.",authenticity
1561,"Le doy dos estrellas por que la funci칩n de mostrar y ocultar saldo prefiero que sea manual y no por detecci칩n de camara de una o m치s de 2 personas, tambien es muy lenta para hacer plin y tampoco me gusta que muestre el saldo en cada movimiento que se hace al plinear. en varias oportunidades que intentaba ver mis movimientos del d칤a al momento de actualizar me sal칤a error de movimiento y me botaba de la funci칩n.",confidentiality
