1562,"Realmente deja mucho que desear hay ocasiones que ni siquiera es capaz de escanear su propio c칩digo Qr de parte de ser muy lento la aplicaci칩n hay partes donde no puedes retroceder y tienes que volver a iniciar sesi칩n, hasta su opci칩n de galer칤a es lenta para escanear el Qr... Y a veces ni funciona con el escaneo, a comparaci칩n del Yape que escanea con rapidez el escaneo de su Qr",not_applicable
1563,"Sinceramente al cambiar el equipo cel piden nuevamente afiliarse a la app y es mucho m치s complicado ya que lo cambian constantemente la forma y como afiliarse y activar la app . Se supone que es para facilitar las operaciones que uno desea hacer pero realmente deja mucho que desear, si hubiera una urgencia no sirve.",not_applicable
1564,"No puedo ingresar con mi contrase침a de banca por internet, me dicen que tengo que cambiar la contrase침a y aun asi me dicen que hay problemas, que intente luego ya lo intente 14 veces y nada. Esta app siempre tiene problemas, deber칤an solucionar, porque se supone que para facilitar tramites, se me hace mas f치cil ir a un cajero. Cuantas veces m치s tengo que actualizar esta app?",not_applicable
1565,"QUE DESASTRE!!! Se침ores de BBVA PER칔, a esto llaman actualizaci칩n? 92mb en vez de tener alguno 칰til, es algo que ni ayuda en nada, en vez de facilitar han empeorado el aplicativo!!! Si no logran mejorar eso, me retiro con mis 3 cuentas de ahorro... Porque la verdad no ser칤an ya de ninguna agilidad o ayuda.",not_applicable
1566,Tengo dos inconvenientes desde hace unos d칤as atr치s... La primera es que..algunas veces quiero yapear o plinear... Hago todos los pasos..y a las finales se traba..ya no me da la opci칩n de confirmar generando una duda de que se si env칤o el dinero o no... Y la segunda es que. Desde ayer ya no me deja yapear desde mi cuenta...antes si lo hac칤a con normalidad. Sea yape o plin..Pero ahora no me da la opci칩n de yapear...solo plinear ..espero que lo arreglen pronto..debido a que muchos usamos ambas.,non_repudiation
1567,"P칠sima! Desde hace algunos meses no abre la aplicaci칩n y cuando lo hace se demora mil a침os para acceder, terrible! Lo peor es que el token digital s칩lo lo obtienes al ingresar a trav칠s de app, si falla (como de costumbre) y necesitas realizar una operaci칩n de urgencia .... olv칤date!!!!!",authenticity
1568,"No se que pasa con el aplicativo antes funcionaba muy bien, ahora cada vez que entro me sale la publicidad de tipo de cambio, la cual no se puede salir de esa p치gina, y hay que estar reinstalando a cada rato, arreglen este inconveniente que es de muchos porfavor!!!!",not_applicable
1569,"La actualizaci칩n me ha hecho borrar varias de mis aplicaciones porque dice que no hay espacio, para que finalmente me diga que hay error y que no se puede. Entonces si no lo puedo actualizar 쯣orque no me deja ingresar a la aplicaci칩n anterior?. Simplemente no tengo acceso a mi cuenta. No me parece justo para los usuarios y solo porque un d칤a se les ocurri칩 actualizar la app. Necesito una soluci칩n.",not_applicable
1570,"Buenas noches, descargue la app hace 3 dias, al principio ingresaba normal pero ahora no puedo, me piden activar token digital, que tambien lo realice y sale una ventana que dice que por seguridad me llamaran a las 8:00 am para finalizar la operacion, ya paseron 3 dias y hasta ahora ninguna llamada, desintale y sigue igual.",authenticity
1571,"C칩mo hago para regresar a una versi칩n anterior? Ya no puedo cambiar de soles a d칩lares porque en la lista de cuentas en soles no me aparece la cuenta de la que quiero sacar los soles. Me aparecen 3 cuentas que son las que no quiero usar y hay una pesta침a con las opci칩n ""mostrar todas"" pero hago click en dicha opci칩n y ni as칤 aparecen todas las cuentas. De verdad si hubiera le칤do los comentarios sobre esta actualizaci칩n me hubiera quedado en la versi칩n anterior.",not_applicable
1572,"Hasta un hace unos d칤as la app me funcionaba de maravilla, ahora que hice una actualizaci칩n pr치cticamente ya no me sirve para nada. Lo he reinstalado y lo 칰nico que me carga es el logo con su efecto, yo me pregunto 쯣orque hacen una actualizaci칩n si no han echo las pruebas de rigor que corresponden? Su QA tiene que ser m치s eficiente creo yo, capacitelo en todo caso.",not_applicable
1573,"En varias ocasiones quiero aser un plin, y llega asta el punto de enviar el tomen digital y se sale al inicio, con un aviso de que intente m치s tarde, lo vuelvo a intentar m치s tarde varias veces y nada. Luego de mucho rrato entro a la app y resulta que el plin que intent칠 aser se hab칤a hecho 3 veces o asta 2 veces y nisiquiera puedes reclamar a la persona que hiciste porque en movimientos sale vomp retenci칩n no sale ni el nombre de la persona asta 1 d칤a despu칠s asta eso ya la persona se perdi칩..",non_repudiation
1574,"Se침ores BBVA CONTINENTAL su app no actualiza, estoy todo el d칤a intentando y nada, perjudicandome porque no puedo realizar operaciones, por favor hagan algo de inmediato, porque esto no es primera vez, meses atr치s pas칩 igual, da terror cuando hay una actualizaci칩n. As칤 van a perder muchos clientes, empezando por mi, la competencia es m치s eficiente definitivamente, espero una inmediata soluci칩n o muchos comentaremos a todos nuestros familiares, amigos y clientes,lo deficiente que es este banco.",not_applicable
1575,"Buenas Noches, siempre he manejado el app con mucha comodidad, sin embargo hace unos d칤as no me dej칩 ingresar ya que me ped칤a actualizaci칩n, acept칠 la actualizaci칩n pero nunca terminaba de actualizarse segu칤a cargando a veces durante horas y no terminaba, lo cancel칠 xq necesitaba usar el app aunque sea sin la actualizaci칩n y segu칤a sin darme acceso. He eliminado el app para volver a instalarla y ahora resulta que no puedo instalarla porque nunca termina de descargarse, alguna soluci칩n?",not_applicable
1576,"Uso 칠sta app hace a침os, hace unos meses es un martirio poder usarla En repetidas ocasiones me pide activar el Token cuando ya est치, cuando quiero realizar un Plin me sale un mensaje de Int칠ntelo luego, aparte de lo lenta que est치, de lo peor. Pens칠 que era mi celular, pero ya veo que no soy la 칰nica con ese problema. Tendr칠 que cambiar de banco.",authenticity
1577,"Reestableci mi m칩vil y al momento de ingresar no puedo activar la clave token. Tengo que llamar nuevamente a la banca por tel칠fono para q solucionen eso, no es la primera vez que pasa eso. Adem치s demasiado tr치mite para activar compras por Internet, ya q tengo q enviar correos y m치s cosas. Me arrepiento de tener cuenta sueldo en esta banco. 游땜游땜游땜",authenticity
1578,"Desde el viernes pasado no me dejaba entrar seg칰n por un error que intentar치 luego. La p치gina tampoco me permit칤a ingresar. Hoy me doy con que seg칰n hay una actualizaci칩n, le doy a actualizar y me aparece como que ya estaba actualizado, pero al intentar abrirla vuelve a pedir actualizaci칩n... 쯈u칠 est치 pasando?",not_applicable
1579,"Buenas Noches, lamento informarles que su intento por mejorar su aplicaci칩n a fallado, he aqu칤 algunas de las fallas: - Es lenta - No permite entrar sin antes malograr el h칤gado de uno - Se congela y se cierra autom치ticamente - Hace el proceso complicado - La versi칩n antiguas era m치s eficiente Eso es todo, espero que puedan arreglar el problema. Que tenga una buena noche,Gracias.",not_applicable
1580,"Que p칠sima actualizaci칩n, menos mal que no uso este banco para mis operaciones y pagos frecuentes y solo la uso para que me depositen dinero. Se demora demasiado en ingresar a lo que quiero ver qu칠 son mis cuentas pero si me hacen interminables preguntas para ingresar. Al final me qued칠 esperando 5 minutos para ver mis cuentas y nunca pude ingresar. Bien hecho BBVA, sigan as칤 de eficientes que cada vez m치s desaniman a sus clientes a usar sus servicios.",not_applicable
1581,La App est치 p칠sima Si No fuera porque la Empresa donde laboro est치 asociada al banco cambiar칤a de Banco. Porque justo cuando necesito hacer una transacci칩n importante sale error. Ya estoy pensando cambiarme de banco. Luego de un tiempo No se porqu칠 a칰n sigo en esta App pero solo quiero acotar que tenia activada la biom칠trica para acceso a la App y de la nada se desactiv칩. Ahora me pide contrase침a la estoy colocando y me sale que la aplicaci칩n no se puede ejecutar y que intente m치s tarde. P칠simo.,authenticity
1582,"La app solo sirve para ver saldo y transferencias, el uso del chat dentro de la app no lo considera como tiempo de uso, como tampoco considera los reclamos; he intentado registrar una solicitud por ambos medios y la app se cerr칩 por tiempo de inactividad, no permitiendo registrar mi solicitud. Una real p칠rdida de tiempo. Incre칤ble que una entidad tan grande no testee sus productos.",not_applicable
1583,"Tengo mas de 4 d칤as que no puedo ingresar al app, desinstale y volvi a instalar, intente ingresar desde mi otro celular y nada. Contacte a soporte t칠cnico y me dieron un correo para que envi칠 el error y hasta ahora sigo esperando la respuesta. En lugar de mejorar empeoran la experiencia del cliente.",not_applicable
1584,"Desde que bbva continental cambi칩 a bbva todo ha ido mal, desde la atenci칩n hasta el app. Sol칤a tener todas mis cuenta ac치 pero desde que pas칩 todo esto, olvidenlo! Ya comenc칠 anular mis tarjetas. Por m치s que dicen que env칤es un correo no ayudan en nada porque hasta ahora sigo esperando que mi App funcione y lamentablemente sus cajeros no hacen todas las funciones y por tel칠fono son unos inutiles, ni que decir de la atenci칩n presencial.",not_applicable
1585,"Me bloquearon las cuentas sin justificaci칩n y ahora no puedo usar mi aplicaci칩n. Existe un p칠simo servicio telef칩nico, el viernes tenia el n칰mero 46 en el orden de atenci칩n. L칩gicamente no me atendieron. Deja mucho que desear la atenci칩n del banco, deber칤an reestructurar sus medios de atenci칩n al cliente. Me han hecho perder mucho tiempo, el mismo que requiero para mi trabajo.",not_applicable
1586,"Este banco no tiene criterio, crea otra aplicaci칩n para dar el CCV din치mico cuando lo puede hacer desde la principal por otro lado para el token digital falla a cada momento para afiliar los equipos p칠simo servicio. Llamas por tel칠fono no te dan respuesta un boot de FB tienen m치s interacci칩n para resolver problemas. Su salida es acerquece a plataforma como si sobrar치 el tiempo. P칠simo servicio. -1 si pudiera calificar.",authenticity
1587,"La peor basura que puede existir, genera doble cobro al momento de realizar una operaci칩n para que cuando uno se queje en la banca m칩vil digan, vamos a realizar un reclamo y dentro de un mes tendr치 una respuesta. Le pondr칤a menos cinco estrellas a esta basura de app. Lo peor es que se responden, se les env칤a el correo y ni lo revisan, encima de ser una basura de app no responden los mensajes que ellos mismos piden se les env칤e.",integrity
1588,"Ya ha pasado varias veces pero desde hace m치s de tres horas no puedo ingresar a la app, la desinstale y volv칤 a instalar y nada, ahora ni el token digital tengo... Es una verdadera molestia, al punto de ya estar pensando en cancelar mi cuenta con el banco. Le pongo 1 estrella porque si no lo hago no puedo comentar.",authenticity
1589,"M치s de una semana sin poder usar la aplicaci칩n, toda operaci칩n que requiera el token digital no se puede realizar aunque s칤 tengo activo el token. Me comunique v칤a telef칩nica y su soluci칩n no sirvi칩, solo dicen que espere que termine la actualizaci칩n, pero m치s de una semana? Terrible sistema",authenticity
1590,"Intento pagar mi tarjeta, se queda cargando indefinidamente. Intento abrir una cuenta de ahorros, sale error todas las veces. Para que me dicen que puedo hacer todas mis operaciones desde el app si hasta ahora no he podido hacer ninguna? Tengo que ir presencialmente a un banco por cosas tan simples. Solo hacen perder el tiempo",not_applicable
1591,"Hola, les he escrito por correo y nada. Que pasa con la aplicaci칩n, manejo todo desde mi tel칠fono, 쯣or qu칠 se queda colgada al iniciar el proceso de iniciar sesi칩n en la app? Todo ven칤a muy bien, ahora desde hace 1 y semana y un poco m치s empezaron los problemas, 쯖칩mo podemos resolver? 춰Gracias!",not_applicable
1592,"El plin de esta aplicaci칩n es una porquer칤a, ya es la segunda vez que compro algo y no se completa el pantallazo de realizado si no que se queda como si no se hubiera mandado el dinero lo peor es que me descuenta el dinero y ni me env칤a un correo de confirmaci칩n, sinceramente es la 칰ltima vez que uso vuestro apartado de billeters digital porquer칤a de aplicacion solo para guardar dinero sirves",non_repudiation
1593,"Dicen que ahora hay que usar esta App de manera obligatoria pero veo en los comentarios que es p칠sima y que no funciona para variar blokearon mi ingreso desde la p치gina web, no reconoce mi contrase침a, este banco es p칠simo y si llamas al n칰mero no hay opci칩n para que te gu칤en en la soluci칩n del problema todas las opciones s칩lo son de ventas o cr칠ditos, para venderte un producto son los n칰mero uno pero para atender un problema o un reclamo no est치n, tira de sin verg칲enzas y estafadores.",not_applicable
1594,"Estoy intentando m치s de una semana volver a activar el tocken porque cambien de n칰mero, ya hice el cambio en cajero e intento activar en la aplicaci칩n pero me mandan el c칩digo, lo ingreso y nada, vuelvo a intentar y sale que no pueden atender la operaci칩n. Ya desinstale y volv칤 a instalar, reinicie el tel칠fono y nada.",authenticity
1595,"Me sale error a cada moment. Cada vez que quiero hacer algo no me permite me pide que ingrese como nuevo y la verdad es igual en la p치gina, me sale como error . Es m치s desde que tengo ese problema eh sufrido 2 intentos de robo por compra por Internet ya no hay confianza con su aplicaci칩n. Ni con su sistema est치 vulnerado.",not_applicable
1596,"Muy mala app, me robaron el dinero sin necesidad de poner mi contrase침a, eso de tener la clave token sin necesidad de usar la contrase침a es muy peligrosa , deber칤an actualizar esta aplicaci칩n ya que muchas personas corren el riesgo de que les vac칤en la tarjeta s칩lo abriendo la aplicaci칩n , es una informaci칩n muy privada y no deber칤a estar tan expuesta, por favor actualizarla Ya , acaso es un plan de ustedes para que la gente pague un seguro mensual? Pfff p칠simo, piensen m치s en sus clientes .",confidentiality
1597,"P칠sima la manera de como esta funcionando la u칰ltima actualizaci칩n. Nunca he tenido problemas pero esta ultima actualizacion ha empeorado todo. Solo aparece el logo, inreso pero no puedo realizar ninguna operaci칩n y cuando les he escrito al correo si bien han respondido, no han solucionado nada. Dijeron que se comunicarian conmigo dentro de 24 horas para activar el token por sms, pero ya pas칩 una semana y nada de solucionar. Muy mal de verdad, lo mismo que acabo de escribir lo envi칠 por correo.",authenticity
1598,"Regresen la aplicaci칩n a como estaba antes! Mas se cilla, f치cil de usar, se pod칤an poner varios usuarios para tenerlos siempre disponibles. Su dise침ador es un incompetente, despidan lo, y tambi칠n al equipo de soporte de la aplicacion, ya que esta aplicaci칩n que han hecho es totalmente horrible. Me cambiare de banco ya que no se puede utilizar la aplicacion como antes y no se dignan a hacer nada, y solo responder a los usuarios C칩 respuestas gen칠ricas como siempre.",not_applicable
1599,"Mal칤simo estoy ya ha 2 d칤as despu칠s de haber actualizado, veo los comentarios y s칩lo saben decir lo"" lamentamos"" pero veo que son d칤as atr치s los comentarios y nada de solucionar hasta ahora,que fastidio,antes era el mejor app de bancos,r치pido y 치gil, ahora parece app de las cavernas,no se que esperan para dar soluci칩n inmediata,si tienen gente inepta incapaz de solucionar algo autom치ticamente,pues vuelvan a poner la versi칩n anterior o contraten a otra persona capaz!",not_applicable
1600,"Despu칠s de casi un a침o del cambio ... Muy mal Siguen problemas de ""cuentas"" relacionadas a los favoritos. No se pueden manejar diferentes identidades (es una app personal, y nada m치s?) Y toooodooo lo que puse en comentarios del a침o pasado, siguen igual. - 1 estrella deber칤a poderse poner.",not_applicable
