id,comentario,etiqueta
1601,"La nueva app es una tontera, se para cerrando siempre hay problemas, indican que est谩n trabajando en eso, pero si esperan que la gente no acuda a los bancos, lo m铆nimo es que solucionen de inmediato los inconvenientes, adem谩s la nueva actualizaci贸n es m谩s compleja que la anterior.",not_applicable
1602,"sta app sigue siendo una reverenda porquer铆a, lo han actualizado y tiene muchas fallas, desde hace varios d铆as no pude ingresar porque ten铆a problemas, el d铆a de hoy ingreso y cuando quiero pagar mis cr茅ditos y tarjeta, me sale un mensaje de que revise mi Wifi o plan de datos, como si no hubiera conexi贸n, pero es falso, porque con mi Wifi y plan de datos puedo ver videos en Youtube y navegar sin problemas. Lo repito: BASURA DE APP BCP...!!!, por eso mi banca m贸vil principal es de otra entidad.",not_applicable
1603,La App al actualizar a su 煤ltima versi贸n ya no me permiti贸 ingresar..me mostraba un c贸digo de error..ya ten铆a una sesi贸n iniciada anteriormente. Borr茅 los datos de la App desde ajustes y me sali贸 una nueva interfaz d贸nde debo configurar nuevamente mis datos ..pero la momento de enviar el correo para validar con un c贸digo 茅ste nunca llega..lo he intentado varias veces y el c贸digo no llega a mi correo. Podr铆an resolver ese problema por favor?,authenticity
1604,"Ha pasado mucho tiempo y hasta ahora no activan la opci贸n de ingreso con tarjeta de cr茅dito, son el 煤nico banco con el que tengo un servicio y no puedo usar la app. No tengo Credim谩s, cuando activar谩n la opci贸n para poder ingresar a la App con tarjetas de cr茅dito y realizar operaciones como lo hacen otros bancos",not_applicable
1605,La verdad una porquer铆a est谩 nueva actualizaci贸n no s茅 si alguien m谩s tenga el problema que usando mis datos (ENTEL) no puedo ingresar a la app pero mediante wifi o internet compartido mediante otro dispositivo entra f谩cil en estas 茅pocas d贸nde se necesita m谩s de la aplicaci贸n actualizan para mal con la antigua app todo funcionaba bien inclusive quitaron algunos filtros de verdad una reverenda porquer铆a recuerden se帽ores del bcp las actualizaci贸n son para mejorar no todo lo contrario,not_applicable
1606,"Desde que cambiaron el entorno de la aplicaci贸n, todo fue de mal a peor. No se puede hacer nada sin que salga el error de la aplicaci贸n y no te deja hacer nada y tienes que volver a ingresar pero cuando ingresas sigue con error. Muy mala aplicaci贸n.",not_applicable
1607,"La porquer铆a m谩s grande, no permite definir las pregunta de seguridad para ingresar, dice que no puede hacer transferencias porque la hora no es la de Internetaunque si lo este, no permite hacer ninguna operacion, luego de reinstalar la aplicaci贸n se pierde el token, su departamento de sistemas son un grupo de animales que nisiquiera pueden hacer bien un an谩lisis y un dise帽o nisiquiera tienen claro los procesos, no se que clase de profesionales tengan pero a la vista se ve que son de p茅simas uni",authenticity
1608,"Buenas tardes, lamentablemente la app es pesima ya que llevo toda la semana intentando conectarme pero no ingresa, se queda en obteniendo sesi贸n de usuario y da vueltas y vueltas y no ingresa y arroja el mensaje "" Uy parece que ocurri贸 un probelam"" reinentar, estamos trabajando . Toda la semana lo mismo, pueden arreglar este tema es bastante fastidioso e incomodo, ya que no se puede hacer nada.",not_applicable
1609,"La actualizaci贸n es muy mal铆simaaaa, pesadaa.. lenta... apenas abro la app, el tiempo se agota !!! y aparece la palabra error continuamente...  Por m谩s intentos que hago por ingresar... No sirveee... 火火火 ""Para mejor versi贸n prefer铆a la anterior....!!"" Espero la mejoren cuanto antes... Ya que urge en estos tiempos.... Gracias.",not_applicable
1610,"P茅sima la actualizaci贸n, no me deja hacer ning煤n pago, tampoco deja verificar el tokwn digital para hacer cualquier transferencia sale error. Mejoren en esos puntos, no deja hacer los pagos no ninguna operaci贸n, cuando quiero cambiar al token digital siempre sale error",authenticity
1611,"Un desastre, trate de volver ingresar a la aplicaci贸n despues de un tiempo, y cada vez que ingresaba mi clave se cerraba la aplicaci贸n, desinstale la aplicaci贸n y volv铆 a instalar, me pidi贸 volver a afiliar, el c贸digo de verificaci贸n tarda aproximadamente 10 minutos en llegar, cuando la sesi贸n ya hab铆a expirado, en conclusi贸n una aplicaci贸n que no ayuda en nada, y una p茅rdida de tiempo.",authenticity
1612,"Cada vez que se actualiza est谩 peor el App, antes funcionaba correctamente. En ves que mejorar est谩n empeorando. Sale error a cada rato  que quiero hacer un movimiento, demoro m谩s de 30 minutos en hacer un movimiento antes lo hacia en segundos.○○.",not_applicable
1613,"Pesima!! Desde la actualizacion de la app no puedo realizar ninguna operacion ya que piden toquen digital como si no tuviera cuando ya lo habia realizado antes!! No ire a exponerme con esta pandemia al banco a solicitarla otra vez, demasiado ineficiente, y cada vez que quiero llamar al banco no puedo!! Este problema es desde la semana pasada y hasta ahora no le dan solucion!!. Sean mas eficientes porfavor!",authenticity
1614,"La peor actualizaci贸n en la historia de las apps, una porquer铆a. Nada intuitivo, se demora en cargar, genera constantemente errores, acabo de cambiar de banco dado que me demoro demasiado (aveces sin completarlas) en hacer operaciones diarias que antes me tomaban 2min.",not_applicable
1615,"Lo mismo de siempre error en la sincronizaci贸n del token digital, te manda a configurar la hora en autom谩tico establecido por red, pero si lo tengo en autom谩tico siempre sale ese error no se puede pagar servicios, no dan soluci贸n, las actualizaciones van de mal en peor, a煤n no solucionan el problema del token 筐筐",authenticity
1616,"Era una aplicaci贸n simple, r谩pida, f谩cil de usar y bastante amigable con el usuario.. Lamentablemente la convirtieron en una acumulaci贸n de fallas y complicaciones.. Espero mejoren todo pronto, por ahora el descontento es grande..",not_applicable
1617,Estoy hace m谩s de una semana intentando hacer pago de cr茅dito y se congela y se cierra la aplicaci贸n. Otros pagos o transferencias no me presentan problemas pero con lo del cr茅dito all铆 es donde falla la aplicaci贸n. Intent茅 por Banca por internet y no me aceptaba la token. Resolver lo de la aplicaci贸n!,authenticity
1618,Muy mala la actualizaci贸n de la aplicaci贸n... Es la primera vez que veo una aplicaci贸n tan mal铆sima y eso que utilizo bastantes aplicaciones de tarjetas pero est谩 no la recomiendo muchos anuncios que uno se pierde y ni encuentra lo que uno quiere pagar,not_applicable
1619,"Ha fecha de hoy d铆a 4 de nov de 2021, el servicio cay贸 fatalmente, y su sistema de token digital no funciona al estar ca铆do, por lo que perjudica a煤n m谩s debido a que aunque quieras realizar tus transacciones v铆a computadora te pide token digital, el cual no genera cuando est谩 ca铆do est谩 nueva App, y prob茅 tmb con m铆 token f铆sico, y no es v谩lido, as铆 que, estamos atados de manos por este inconveniente.",authenticity
1620,"En tema de Dise帽o (Front) bien, hay una mejora, pero en funcionalidad (Back) muy mal, es mas complicada que la versi贸n anterior, hay muchas cosas que no funcionan bien y ya no se pueden hacer, se cuelga, y algunas veces no permite ingresar.",not_applicable
1621,"Es rid铆culo que cuando voy a hacer una operaci贸n me piden token digital y es imposible verlo ya que la app esta en pleno funcionamiento y no puedo cerrarla. Para arreglar esto volvi a instalar la app y ahora me pide que vaya al banco a perder mi tiempo para que me activen el token digital, cuando otros bancos los hacen autom谩ticamente o por tel茅fono. Estoy muy disgustado.",authenticity
1622,"Para que lanzan una actualizaci贸n, si no la han probado primero, para eso existen el periodo de prueba. Pesimooooo, quiero transferir y dice que tengo problemas en el ajuste de la hora  imag铆nense uno en una emergencia y no pueda transferir.",not_applicable
1623,"Qu茅 p茅sima aplicaci贸n, el 煤nico d铆a que funcion贸 bien fue cuando la instal茅. Ahora ni siquiera me puede mostrar mi saldo. No puedo hacer una transferencia o un pago. Solo aparece una nota que dice: 'No s茅 encontraron resultados con los criterios de b煤squeda' Si se pudiera dar 0 estrellas, lo har铆a",not_applicable
1624,"Que sucede con su aplicativo cada vez es una porquer铆a, as铆 como son buenas para cobrar, deber铆an de ser buenos en invertir en sus aplicativos o ingenieros para que puedan mejorar la plataforma digital!!! Es una perdida de tiempo. Siempre colapsa, no se puede acceder a la.bamca m贸vil. Sale error ",not_applicable
1625,"La nueva actualizaci贸n para mi es un desastre total!!!! Cada q quiero hacer alg煤n movimiento me sale 隆ocurri贸 un problema! Tengo q estar ingresando a cada rato a probar suerte a ver si funciona, ni ver tu saldo se puede cuando lo necesitas. MEJOREN LA APP PORFAVOR",not_applicable
1626,"Hace d铆as que no me abre la aplicaci贸n , cada vez que intento se cierra ya instale otra vez varias veces pero nada sigue igual, y me causa muchos inconvenientes porque no puede hacer mis pagos. Espero puedan solucionar eso cu谩nto antes",not_applicable
1627,"Van 3 d铆as que no me deja ver mi informaci贸n. Preocupense por mejor el tiempo de respuesta, rendimiento y disponibilidad del servicio en lugar de cambiar la interfaz gr谩fica que ahora es menos intuitiva. Un cambio innecesario, p茅sima decisi贸n.",not_applicable
1628,"Si pudiera describir este aplicativo, no alcanzar铆a lisuras para hacerlo.. asi......una porqueria....es simplemente una app para hacerte perder el tiempo, cada actualizaci贸n es peor que la anterior...tendr茅 que cambiar de banco. Pasan los meses y sigue igual.",not_applicable
1629,"La 煤ltima actualizaci贸n es un desastre, demora mucho en iniciar sesi贸n, muchas veces sale error de inicio de sesi贸n. Y la nueva implementation a la hora de hacer una transferencia, te pide colocar el token digital, 驴se supone que tenga que salir de la operaci贸n para conseguir el c贸digo token? P茅simo.",authenticity
1630,"Totalmente p茅simo antes ten铆a un buen concepto de esta app pero ahora es un desastre, en medio de una transacci贸n la app se cierra autom谩ticamente, ahora hace instantes intent茅 ingresar nuevamente para poder culminar con la transacci贸n y me sale la pantalla totalmente en negro, deber铆an enfocarse en poder solucionar, esos errores que aunque no crean nos retrasa demasiado en muchos aspectos y nosotros no tenemos culpa alguna del mal mantenimiento que manejan en este sistema",not_applicable
1631,"Con la nueva versi贸n me solicita actualizar el sistema de mi celular, lo realice y sigo sin poder ingresar, que pasa si un equipo no puede actualizar el Android a versiones 9 o superiores, una p茅rdida de tiempo en llamadas y los clientes colgados, habr谩 que buscar otros bancos con plataformas m谩s amigables.",not_applicable
1632,Esta aplicacion es muy lenta y nose que haces cada vez con sus actulizaciones si siempre es lo mismo no hay nada buenos y en los q uno quiere hacer algo te ponen actulizar . Y nesecita mucho espacio yo tengk um celular baja gama y ya no puedo actualizar por nececito espacio q mas siempre lo tengo las mismas aplicacion y lo peor es q no pueda yapear nose a q se debe ..,not_applicable
1633,"Malisimo,nisiquiera permite descargar tengo mas de 4 horas tratando de descargarlo. Cada vaz peor, y de cada 3 veces que quiero usarlo 2 tiene problemas...siempre el mismo problema falta de conexion, y eso no pasa con app de otros bancos con el mismo telefono, en el mismo instante.",not_applicable
1634,"Mala actualizacion. Todo esta lento. No puedo realizar transacciones, constantemente sale error. Y la seguridad vulnerada. Ya no tengo que escribir mi n煤meto de tarjeta, ya quedo grabado con esta actualizaci贸n, lista para que los ladrones me roben. Pesimo. No puedo ponerle estrellas menos o cero solo porque no esta la opci贸n.",confidentiality
1635,"Llevo un mes intentando hacer una transferencia interbancaria a una cuenta del Interbank y no puedo, o me sale error o simplemente la aplicaci贸n se cierra. En la coyuntura actual deben mejorar su servicio y brindar calidad, es la 煤nica app que tengo problemas.",not_applicable
1636,"Me pregunto porque cambiar la aplicaci贸n a una peor? No tenia ning煤n problema con la versi贸n anterior, ahora me aparece error varias veces al ingresar, al intentar transferir y de ahi con el token. Cambien a la versi贸n anterior, la actual es un desastre.",authenticity
1637,"Deber铆an poder permitir generar cuotas desde la misma app, deber铆an permitir ver en cu谩ntas cuotas estan las transmisiones. En todos los formularios que recibo siempre proponen eso y hasta ahora no se ve reflejado. Es imposible compartir tu tarjeta con alguien y uno solo gestionar los gastos. Espero pronto ver est谩s opciones",not_applicable
1638,"Estoy teniendo problemas a cada rato para abrir la aplicaci贸n, antes no ten铆a ese problema, no se entiende el criterio de su 谩rea de sistemas para cambiar una aplicaci贸n que funcionaba relativamente bien por este adefesio que el 70% de las veces no funciona bien.",not_applicable
1639,"Porqueria de aplicacion, luego de la actualizacion no te deja entrar, tienes que forzar detencion y si logras entrar a veces no puedes realizar ninguna transaccion. En vez de mejorar, empeoran cada vez mas. No se para que actualizan si antes todo estaba bien.",not_applicable
1640,"Pesima app, no funciona bien, siempre trae errores, el peor fue transferir a un tercero y que aparezca error de transacci贸n y luego al intentar varias veces, entro a mi estado de cuenta y veo que se si realizaron... No confiar铆a en una empresa asi por nada del mundo y menos si es mi plata lo que est谩 en juego. Chau banco y app basuras.",non_repudiation
1641,"Esta actualizaci贸n es muy Bonita gr谩ficamente pero malaaaa es lenta, se pega, a veces no abre al realizar esta actualizaci贸n en vez de acelerar el proceso y tiempo que es lo que uno como usuario quiere, atrasa todo... modifiquen los errores.",not_applicable
1642,"Cada d铆a peor... La app no te deja hacer transferencia, se demora,carga lenta siempre sale el anuncio estamos trabajando para solucionar los problemas... Pero nada... Uno de las p茅simas de app que tengo en ning煤n banco sucede esto solo aqu铆... En vez de facilitarte las cosas la app solo las empeora....",not_applicable
1643,"P茅sima aplicaci贸n. La peor de banca m贸vil que he usado, cambie de tel茅fono y quiero acceder y en el paso para elegir a donde enviar el c贸digo de validaci贸n no me aparece ninguna opci贸n ah elegir, solo aparece que debo actualizar mis datos en una agencia. Pero es absurdo mis datos estas actualizados estuvo funcionando bien en el anterior celular. Que mal servicio. Muy malo. Y nunca se preocupan en solucionarlo.",authenticity
1644,Es un rotundo desastre esta 煤ltima actualizaci贸n tiene muchos errores desde pago de servicio ( que no encuentra una empresa en la lista ) a intentar ingresar al aplicativo te da un aviso !ocurri贸 un problema ! De reintegradas veces . Con este error no se puede hacer nada,not_applicable
1645,En celulares Huawei no se puede ver toda la aplicaci贸n es decir en la parte donde pones tu n煤mero de tarjeta est谩 bien pero m谩s abajo hay otras opciones para marcar y ello nose puede hacer porque tiene problemas nose visualiza bien est谩 muy grande las letras pues acaparan la pantalla y no deja ver las dem谩s opciones para ingresar a la app y ver tus cuentas,not_applicable
1646,La app en mi m贸vil se vio afectada con su nueva interfaz....me hicieron desinstalarla varias veces y ahora cuando la instalo no puedo ingresar a bcp m贸vil...es muy mortifica te esto ...y nisiquiera se puede arreglar por tel茅fono....les puse 1 esyrella pero realmente me gustar铆a ponerle 1.000.000 en contra por la falta de seriedad de su personal en buscar la soluci贸n...usando la rid铆cula excusa que mi tel茅fono es el problema....entonces porque el resto de mis apps no traen ning煤n problema..,not_applicable
1647,"Un asco la nueva actualizaci贸n las operaciones son muy lentas a cada rato sale que ocurri贸 un problema .. adicional a ello es muy confusa cuando se tiene muchas cuentas, sinceramente no entiendo por qu茅 tanto dise帽o y colores si en manejo es una desastre..",not_applicable
1648,"Es terrible la aplicaci贸n, la verdad estoy pensando seriamente en cambiar de banco. Cuando uno necesita hacer sus operaciones sale el mensaje... Ha ocurrido un error. La ventaja de tener siempre un bcp cerca de ti lo estropea la aplicaci贸n. La de la competencia nunca me falla.",not_applicable
1649,"Terrible la actualizaci贸n de la APP, est谩bamos mejor con la versi贸n anterior, me mudare a Interbank sin dudarlo, se supone que est谩 actualizacion permite agilizar los tr谩mites y evitar las colas, pero ahora te tarda m谩s de 7 d铆as en una transacci贸n. FATAL, NO LA RECOMENDARA! NI A VAINAS.",not_applicable
1650,"No me parece las actualizaciones... si estaba bien como estaba? Eso que sea obligatorio esta mal.. si alguien quiere actualizarlo por su cuenta bien, o en otro momento... pero en el peor momento cuando uno tiene que hacer un deposito rapido aparece la actualizacion y es una vaina... no me gusta. La app es buena, pero la actualizacion no.",not_applicable
1651,"Por fin actualizaci贸n seguro q funciona bien esta vez me dije yo pero en realidad no mejoraron absolutamente nada y mucho menos corrigieron el error de acceso a la app por q sigue igual sale el mismo mensaje de antes q dice ocurri贸 un error estamos trabajando, osea quien es el inuti q hace estas actuaciones, deber铆a tener un trabajo 10 de 10 por q son una entidad bancaria de las m谩s grandes del mundo y tienen una aplicaci贸n basura",not_applicable
1652,Muy pero muy mal...que tenga que actualizar para poder tener acceso a mi cuenta. P茅simo...estoy muy molesta por eso. Me hace perder el tiempo...cuantas veces se tiene que actualizar ya actualic茅 hace como 2 meses. Y de nuevo la misma vaina.,not_applicable
1653,"Por Dios Mejoren Su App, la anterior versi贸n estaba mejor, ahora solo lo puedo abrir una vez y si lo quiero abrir denuevo tengo que reiniciar mi tel茅fono por que si no dice tenemos problemas ingresa por la banca m贸vil. Y ahora s铆 hago DEPOSITOS DOBLES..... lo hago una vez el proceso del dep贸sito y en mi estado de cuenta sale que hice dos dep贸sitos de la misma cantidad a la persona que recibe el dinero.... Hasta cuando van a seguir esos errores BCP",integrity
1654,"Actualice la app tuve muchos problemas porque se colgaba, luego se solucion贸 y ahora de nuevo esta fallando pero aparece que hay un problema con mi identidad o hay un problema con el teclado!! Solucionen eso porque en si es buena app ideal para saber tu estado de cuenta, hacer transferencias, pagar servicios etc",authenticity
1655,"El aplicativo es bueno, lo malo es que cada vez que hay actualizaci贸n no puedes ingresar sin actualizar y eso crea incomodidad pues a veces no se cuenta con el espacio necesario para esas a actualizaciones lo que impide realizar las transacciones que se tiene planeadas.",not_applicable
1656,Horrible!!!! con esta 煤ltima actualizaci贸n la aplicaci贸n falla mucho. Tengo que apagar y reiniciar mi equipo para usarla. Se queda colgada cuando realizo una transferencia. A veces no se si se realiz贸 o no la transferencia. Por favor corregir.,non_repudiation
1657,"P茅simo no deb铆 actualizar la aplicaci贸n. No carga el teclado, o no carga el token, se cuelga, y dicen que lo intente luego voy dos d铆as sin poder transferir, y para transferir tengo ingresar el token y ya no es autom谩tico como la anterior versi贸n, que p茅simo servicio le pondr铆a menos 5 estrellas",authenticity
1658,"Una desgracia, me complica mucho. Estaba mejor antes. Ahora tengo que ir a la oficina a cada rato. Que barbaridad. Solucionen el problema. Ya se ha bloqueado mi tarjeta dos veces por culpa de la app que no reconoce debido a que el teclado no funciona bien.",authenticity
1659,"Actualizan su aplicativo y ahora me pide ingresar nuevamente mis datos y me hace perder tiempo cuando se supone que debe agilizar las cosas, ni que hablar del funcionamiento del aplicativo, una desgracia, parece que por ahorrar contrataron al m谩s barato No puedo usar su aplicativo, me dice que su equipo est谩 trabajando para solucionar, solucionen cambiando de equipo, y volviendo a la versi贸n anterior, luego hagan lo que saben y no vuelvan a tocar el aplicativo jamas",not_applicable
1660,"Con la 煤ltima actualizaci贸n arruinaron todo, no puedo pagar mis servicios desde la secci贸n favoritos, al dar click sale error (verifica si el c贸digo est谩 correcto) c贸mo es eso posible si ya lo ten铆a en favoritos. Agradecer铆a que corrijan ese error, porque es molesto estar buscando uno a uno los servicios que voy a pagar.",not_applicable
1661,"INTENT VARIAS VECES (40) solicitar mi c贸digo de verificaci贸n para poder ingresar a la app, ""PENSANDO QUE ESTARIA MAL MI CELULAR PROB EN INSTALARLO HASTA EN 3 DISPOSITIVOS DISTINTOS"" y al solicitarlo se DEMORA 15 o hasta 30 minutos en llegar el bendito c贸digo, y cu谩ndo llega a mi correo ya paso el tiempo de espera y s铆, me vuelve a REBOTAR todo lo que venia haciendo, PSIMO PSIMO PSIMO servicio de calidad!! cu谩ndo antes era m谩s f谩cil pedir que el c贸digo llegara como mensaje al mismo celular.",authenticity
1662,"Terrible! Se cae la app, funciona la web pero no puedo hacer transacciones por qu茅 el token digital est谩 en la app, fatal la experiencia del usuario, mejor vuelvan al token f铆sico. Cada fin de mes tienen problemas, por qu茅 no potencian su plataforma para atender bien a su flujo de usuarios que tienen.",authenticity
1663,Prefiero usar el app del bbva porque en esta te permite mostrar la descripci贸n de la operaci贸n en el estado de cuenta. En cambio en el del bcp no se puede por lo que hay que entrar a cada correo y ver la constancia para ver qu茅 pago se hizo. Adem谩s el app del BCP falla much铆simo.,accountability
1664,"Esta nueva versi贸n es p茅sima, todo el tiempo tiene problemas de ingresar a la aplicaci贸n y me manda a la banca por Internet. Encima tiene expuesta la tarjeta lo uso no deber铆a ser. Es super lenta. La versi贸n anterior era m谩s b谩sica pero mejor. Mejoren el app trae demasiados inconvenientes",confidentiality
1665,"Despu茅s de la actualizaci贸n, est谩 horrible la apps se borraron los datos, no funciona la clave toquen, est谩 muy lento el sistema, lo 煤nico que mejoraron son los dibujitos lo dem谩s p茅simo servicio, si hubiera para poner 0 puntos lo dar铆a.",authenticity
1666,Todo funcionaba muy bien. Acabo de actualizar la app hace 3 horas y no funciona! Se cierra s贸lo! Y yo necesito hacer operaciones desde mi cel y no puedo! Pens茅 que solucionar铆an en el transcurso de 1 o 2 horas. Pero nada hasta ahora. Que fastidio en serio,not_applicable
1667,"Tienen la obligaci贸n de dar a elegir al usuario la versi贸n, esta nueva no funciona, no deja abrir, esta mal desarrollada la app, obligan a ir al agente, banco, quiere que cambie de equipo...prob茅 en otro equipo moderno y tampoco se puede ingresar...si no resuelven nada tendr茅 que hacer llegar mi denuncia al organismo encargado.",not_applicable
1668,Que mala actualizaci贸n. Estaba tan conforme antes. Ni siquiera he podido ingresar una vez ya que siempre me sale error o dice datos incorrectos intente nuevamente. Que decepci贸n. Ser铆a genial que solucion谩ran pronto porque la verdad es de suma necesidad y m谩s en esta cuarentena!,not_applicable
1669,"La aplicaci贸n est谩 fallando , me pide codigo de verificaci贸n , lo cual se debe enviar al correo Electr贸nico con el que estoy registrado , y no me llega nada , ah y 3n otras ocasiones ni siquiera quiere abrir la app , no s茅 que pasa , deben arreglar esos errores , uno quiere verificar su cuenta y ni siquiera abre la aplicaci贸n , yo me molest贸 cua do pasa eso , as铆 que mejor arreglen ese problema",authenticity
1670,"P茅sima app, demora much铆simo, se cierra autom谩ticamente, se cuelga, nos茅 como una empresa tan grande tiene una aplicaci贸n q en verdad es p茅sima. En estos tiempos deber铆an tener una aplicaci贸n m谩s r谩pida, ya que ahora todo pago es con tarjeta, pero creo q ustedes no van de acorde a los tiempos de ahora. Valoraci贸n ""0""",not_applicable
1671,"""Ocurri贸 un error"" d铆as y d铆as que me aparece eso, una porquer铆a de actualizaci贸n! Enviaron un correo diciendo que hab铆an actualizado la App pero hasta ahora no se puede ingresar, no env铆an correo ni n煤mero de confirmaci贸n. 1 estrella es demasiado para el p茅simo servicio que est谩n ofreciendo",authenticity
1672,"Mal铆sima la app, est谩 actualizaci贸n tiene demasiados errores, cuando hago un pago o transferencia, o cualquier otra transacci贸n las opciones se bloquean, y no permite volver a interactuar. Sale error!!!",not_applicable
1673,"La App era una gran ventaja que tenia el BCP ante el resto de bancos, era en pasado porque ahora es p茅sima, se sale sola, te da error, es m谩s lenta, casi todo es p茅simo, jalados los que dise帽aron e implementaron los cambios, pregunta final POR QUE LA CAMBIARON SI ERA MUY BUENA ???",not_applicable
1674,"Actualizaron el app y empezaron los problemas, esta horrible el nuevo perfil, antes se pod铆a ver todas las cuentas ahora te limita, se sale del aplicativo a cada instante, despues de dos intentos logras una transferencia.  P茅sima experiencia.",not_applicable
