id,comentario,etiqueta
1201,"Esta p茅sima esta actualizaci贸n con la versi贸n anterior ten铆a ofertas con esta nueva actualizaci贸n me sale que no tengo ofertas ,es como sino me reconociera como cliente ,aparte al querer abrir el aplicativo me sale ocurri贸 un error ,estamos trabajando en eso ,int茅ntelo m谩s tarde ,otra cosa q en la versi贸n anterior el monto de las cuentas estaba oculto y ten铆a la opci贸n de mostrarlo o no ,ahora con esta versi贸n no tiene esa opci贸n siempre est谩 a la vista ,muy p茅sima est谩 actualizacion .",confidentiality
1202,"Llevo un tiempo desde que lo desinatal茅 por que me cansaba que acada rato cuando lo necesitaba pedia actualizar y aveces no entraba por q decia que ocurrio un error y los encargados lo estaban solucionando. Pero despues de mucho tiempo hoy me lo vuelvo a instalar y me parece lo mismo ""ocurrio un error y lo estamos solucionando"". No lo recomiendo, tiene que ver otra app que s铆 sirva como debe de ser para todo el publico que realmente lo necesite",not_applicable
1203,"Hay un bug con la activaci贸n del token digital, estoy tomando la foto para activarlo, supuestamente la realiza y me redirige al mensaje para tomar la foto. No me genera ning煤n mensaje de error ni de validaci贸n incorrecta, por lo que termina en un bucle infinito entre tomarse la foto y el mensaje para tomar la foto. Estoy usando un samsung A54 y la app est谩 actualizada.",authenticity
1204,"En general la app est谩 bien. Los principales defectos que encuentro es la falta de opciones para compartir los voucher de operaciones a WhatsApp como si lo tiene INTERBANK, por lo que tengo que tomar captura de pantalla y hacer todo m谩s tedioso. La carga de la app es un poco lenta.",accountability
1205,"De verda da colera cada rato actualizaciones ..... cansa a una, sobre todo por que cada vez pesa m谩s, deberia a ver opci贸n para las personas que no quieran actualizar ya sea porque tienen poco espacio en su celular o que no quieran simplemente, ;/. Es una barbaridad.... Por favor para todo p煤blico deber铆a de sar buen servicio.",not_applicable
1206,Las 煤ltimas 2 actualizaciones terribles malazos. Para usar la app del bcp obliga a colocar seguridad de bloqueo al tel茅fono a nivel general. Se supone que ahora los tel茅fonos ya tienen la opci贸n de colocar m茅todo de seguridad a las app de forma individual sin necesidad de estar bloqueando todo el equipo. De momento tendr茅 que usar otro banco para que no interfiera en la agilidad de mis operaciones.,authenticity
1207,"Hola. Le puse 5 estrellas desde un principio. Pero hoy le dejo 3 pues 煤ltimamente surgen muchos errores. Hoy por ejemplo, me pide actualizar para poder ingresar pero no hay actualizaciones. Regreso y sigue pidiendo una actualizaci贸n que no existe. Bueno esperar茅 a ver qu茅 pasa pero, 驴qu茅 tal si tuviera que hacer una transacci贸n urgente? No pueden ir a peor por favor.",not_applicable
1208,"No puedo abrir la aplicaci贸n hace como 20 d铆as, al principio si abr铆a pero ahora no abre solo muestra la pantalla azul BCP y necesito ingresar ya que veo mis movimientos, hago transferencia y es importante para m铆 d铆a a d铆a. Su ayuda porfavor, ya desinstale la aplicaci贸n miles de veces, mire videos para alguna soluci贸n (hice todo pero igual sigue sin arrancar) porfavor ay煤denme.",not_applicable
1209,Desde mayo de este a帽o 2025 no me permite hacer casi ninguna operaci贸n y rechaza todas las solicitudes. Que perdida de tiempo y abuso inaceptable.,not_applicable
1210,"Una basura la actualizacion a version 7.1 para Android, hay algunos que ni usamos el celular salvo para manejar nuestros ahorros y ahora con esto nos obliga a comprar un nuevo dispositivo compatible con la version de la asquerosa app, y no, no se puede actualizar el android, ya no soporta o no hay",not_applicable
1211,"Parece incre铆ble, pero no puedo ver las operaciones completas del d铆a, solo una cantidad limitada, si sobre paso ese n煤mero, el resto de operaciones las podr茅 ver al siguiente d铆a con el filtro, pero si necesito confirmar una dep贸sito que me hicieron temprano.. No puedo porque como hay un mont贸n de yapes, esa fila ya no se visualiza, otro punto es que antes pod铆as ver el n煤mero de operaci贸n de una transacci贸n, ahora ya no. Por favor corregir.",accountability
1212,"A un comienzo el aplicativo funcionaba muy bien, seg煤n a 茅l tiempo con cada actualizaci贸n la aplicaci贸n a ido decayendo hasta el punto de no poder ingresar y notar mis movimientos y estado de cuenta ; a este paso solo har谩n como cliente de la banca bcp , confie en otra identidad financiera para poder tener la confianza de poder notar mi estado de cuenta en otro app y banco.",not_applicable
1213,"Caraj@ arreglen su aplicativo como van a lanzar una actualizacion con todos esos errores de cada 10 intentos de ingreso solo 1 o 2 ingresan para luego demorar en cargar informacion o en ultimo caso no se puede visualizar movimientos, el peor app para banca movil, el peor banco. Mil veces interbank creo.",not_applicable
1214,"Esta aplicaci贸n necesita urgente una actualizaci贸n o mantenimiento! exactamente ya un mes que tiene problemas tanto en iniciar sesi贸n como en transacciones. Ahora desde hace 2 semanas tienen problemas para hacer pagos, transferencias, pago de servicios y otras cosas. Pr谩cticamente no sirve para nada, por favor trabajen de manera r谩pida en todo esto que lo 煤nico que logran son clientes que se pasan a otros bancos",not_applicable
1215,"Sinceramente estoy cansada,la app viene fallando ya desde la semana pasada, intento ingresar y no carga el teclado de clave,cuando logro ingresar no carga mi token,se demora y encima me sale que ocurri贸 un error. No entiendo me pueden estar robando y no puedo ingresar por esta gran falla. Que p茅simo conf铆e bastante en la app y mira el resultado.",authenticity
1216,"No puedo instalar la actualizaci贸n, me sale error siempre, desinstal茅 y volv铆 a instalar, y sigue con el mismo error, deber铆an arreglar eso, pues necesito hacer transferencias y pagos, adem谩s de ver mi saldo, que por culpa de los errores que tiene la app ya no puedo hacer, SOLUCIONENLO!!!!!",not_applicable
1217,"Hasta hace poco la aplicaci贸n ha estado funcionando con normalidad . Hoy he tratado de abrirla y se cierra autom谩ticamente. Le desinstalado y he vuelto a instalar , reinicio mi celular y no funciona ,no levanta , solo sale el logo de la app y al abrirla continua cerr谩ndose . Por favor necesito alguna soluci贸n a este problema .",not_applicable
1218,"Si se le pudiera poner 0 estrellas a esta aplicaci贸n no lo dudar铆a ni un segundo. Te obliga a actualizar la versi贸n o sino no lo usas te bota, intento abrir mi cuenta desde un tel茅fono de un familiar que ya tiene la app y no me permite. Borro la aplicaci贸n y la instalo de nuevo y me pide confirmaci贸n de correo. Se busca una app que te d茅 acceso r谩pido y seguro a tu informaci贸n. En resumen me cambio de banco",authenticity
1219,"Vuelvan a la aplicaci贸n anterior urgente!!!, esta aplicaci贸n es muy pero muy pesada, la anterior versi贸n era m谩s amigable, liviana y f谩cil de realizar pagos, ahora solo puedo usar otras apps de otros bancos, porque esta app no carga y lo peor de todo cuando carga no est谩 la opci贸n de universidad para realizar los pagos correspondientes. Ayudaaa",not_applicable
1220,"La aplicaci贸n no me funciona desde la 煤ltima actualizaci贸n. Se congela la tratar de ingresar para ver mi saldo y hacer transferencias, ingreso mi clave y de frente me env铆a a un apartado que exige que pongamos la forma de navegaci贸n pero se da en guardar y al final nunca carga se congela y termina por salir del aplicativo. Muy mal p茅simo servicio.",not_applicable
1221,"La actualizaci贸n est谩 matando 茅sta app ya no sirve y cada vez ponen trabas para su correcto funcionamiento, la verdad que deben priorizar solucionar lo m谩s pronto posible en plena pandemia que urge tener una herramienta as铆 para evitar aglomeraciones y largas colas en las agencias, ya no puedo ingresar a la app, me sale que tengo que actualizar mi sistema operativo y es que m谩s no puedo hacer, salvo que piensen en que deba comprar un nuevo celular de 煤ltima generaci贸n, eso ya no ser铆a honesto",not_applicable
1222,"Es una porquer铆a de App esta presentando fallas que SON MUCHISIMAS Y MUY SEGUIDAS coloque la clave para ingresar y me dijo que era incorrecta y no es as铆, siempre la coloco y me bloqueo hasta el d铆a pr贸ximo teniendo un gran apuro para solucionar un pago.... de veras todo lo que confiere a internet con el BCP es un asco. Deber铆an invertir un poco m谩s en su plataforma... no creo que no tengan dinero para tecnolog铆a.",authenticity
1223,"La aplicaci贸n es buena y manejable, solo que deber铆a incorporar dos cosas para que pueda ser completa, primero token por huella digital usando el sensor de smartphone y segundo deber铆an a帽adir la opci贸n de poder hacer un giro a nivel nacional para personas que no tengan tarjeta y que puedan cobrar por un agente, creo que este 煤ltimo si es necesario. Poder hacer un giro desde la app seria excelente y nos ahorrar铆a colas interminables en los agentes y otros lugares.",authenticity
1224,"Por m谩s que pongo mis datos correctamente, me aparece el mensaje de que mis datos est谩n incorrectos. Cambie la clave de internet, desinstal茅 al app y lo volv铆 a instalar y cre茅 una nueva clave de internet, pero nada. Ya van dos d铆as que no puedo ingresar a mi cuenta y contaba con que est谩 app facilitaria mis pagos. Muy mal",authenticity
1225,"Ya es la segunda vez que tuve que actualizarlo de manera obligatoria porque sino no me permite acceder a mi cuenta, de verdad que es molesto porque no tengo el espacio en la memoria de mi celular y solo me queda eliminar algunas de mis app o archivos. Espero que solucionen el hecho de que cada vez ocupe m谩s memoria su banca m贸vil.",not_applicable
1226,"Me funcionaba bien, pero lo que no me gusta es que tiene demasiadas actualizaciones, estoy ya desde casi 1 mes que intento actualizar a la 煤ltima versi贸n y no me deja, tambi茅n si desinstalo la aplicaci贸n para volverla a instalar se borra el token digital. Adem谩s, demora un mont贸n en llegar el n煤mero o c贸digo de validaci贸n. Par谩 iniciar sesi贸n, llevo como 2 horas esperando y no llega nada. P茅sima aplicaci贸n.",authenticity
1227,"Esta app era buena en sus inicios, actualmente no tengo la posibilidad de ingresar a su app para poder revisar mis movimientos o estado de cuenta, ya que cuando la app se inicio aparece ocurrio un error, llevo asi mas de 6 meses y la verdad es que es desesperante hasta el momento con las actualizaciones que sacan no haya progresado ni lo mas minimo en corregirlo.",not_applicable
1228,"Se帽ores, a ver si revisan la aplicaci贸n, no me deja hacer pagos. no s茅 por qu茅 pues, estaba funcionando con normalidad, funciona con normalidad, pero el bot贸n de ""CONFIRMAR"" no aparece como activo. Tal vez sea porque mi tel茅fono Huawei actualiz贸 su SO a EMUI 10 y tal vez no es compatible. Ojal谩 puedan corregir este problema...",not_applicable
1229,"Llevo 2 d铆as tratando de actualizar la aplicaci贸n, porque de otro lado no puedo ingresar, y sinceramente no descarga al 100%, pens茅 que era mi internet o mi tel茅fono pero veo que hay varios usuarios con el mismo problema, no entiendo el objetivo de obligar al usuario a actualizar el app a una versi贸n que ni siquiera es posible completar la descarga. En fin",not_applicable
1230,"Seria bueno si solucionan los problemas de la App, 1000 intentos de abrir la aplicaci贸n y lo 煤nico que dice es ""estamos trabajando para brindarle un mejor servicio"" yo digo cuando terminaran de trabajar por q el servicio sigue p茅simo, malisimo. Lo mismo que nada si no abre la aplicaci贸n para hacer mis operaciones por q de todas maneras tengo q ir a un agente o al banco donde hay colas enormes.",not_applicable
1231,"Ser铆a estupendo que podamos pagar la cuota de la tarjeta de credito con tarjeta debito en la misma aplicacion, ademas que se pueda poner en cuotas las compras que se realizan en 1 sola cuota. Tambien podrian agregar la opcion de enceder o apagar la tarjeta sea titular y/o adicional. Ademas poder hacer transferencias interbancarias inmediatas o diferidas. Darnos la opcion de elegir.",not_applicable
1232,"Anteriormente al realizar una transferencia permit铆a ingresar un mensaje, el cual aparec铆a en la constancia de la transacci贸n, siendo muy 煤til ya que serv铆a de referencia posteriormente al revisar la constancia en el correo o la misma constancia. Ahora se ingresa un mensaje pero al hacer la transferencia se pierde el mensaje y NO APARECE ni en la constancia generada por la app ni en la constancia que llega al correo. Por favor considerarlo.",non_repudiation
1233,"Una aplicaci贸n que su finalidad es evitar perder tiempo, pero que sucede todo lo contrario. Punto n煤mero al momento de registrase el bendito c贸digo de verificaci贸n que te lo env铆an al correo no llego sino es despu茅s de 10 minutos cosa que llega tarde y tu sesi贸n expira y tienes que volver a realizar todo desde cero(perdida de tiempo). Punto n煤mero dos luego de un par semanas aproximadamente de uso te muestra un error cuando intentas ingresar lo que te genera que tengas que desinstalar la app",authenticity
1234,"Si la anterior version era pesima, esta nueva version es un fiasco. De donde han conseguido a sus ingenieros informaticos, deberian demandalos. mucha pantalla para tan poca eficiencia. Se lagea, hay que rebuscar para encontrar lo que quieres, carga por todo y peor se le va la se帽al constantemente. hace perder tiempo, si cambiaron la version para mejorarla pues lamemtablemente amigos del BCP han sido estafados.",not_applicable
1235,"No tiene la opci贸n de carrito de pago, a veces se queda congelado al realizar varios pagos de servicios continuados y muestra mensaje de error. Cuando transfieres a otros bancos ya sea de manera inmediata o diferido igual cobra la misma comisi贸n. Algunos cajeros autom谩ticos tienen la pantalla tan agotada que no se ven las opciones y peor si les da la luz del sol directo.",not_applicable
1236,"La nueva actualizaci贸n de la aplicaci贸n es p茅sima!!! Por favor, rev铆senla. No de entiende nada, se trata a cada rato es incluso para un joven es dif铆cil de entender. La anterior versi贸n era perfecta, est谩 nueva versi贸n es p茅sima. Muy mala actualizaci贸n.",not_applicable
1237,"P茅sima! Paro reiniciando el celular porque su app siempre me manda un mensaje de ""ocurri贸 un problema'. No se puede entrar con facilidad, y si tienes varias cuentas es dif铆cil identificarlas. Regresen a su versi贸n b谩sica, no ten铆a una interfaz moderna pero por lo menos era r谩pida y f谩cil de trabajar.",not_applicable
1238,"Ya es la octava vez que descargo , desinstalo y reinicio. No se qu茅 pasa con la aplicaci贸n autom谩ticamente se cierra no se porque no es compatible con mi celular realme, fui al banco de BCP y no hay soluci贸n a este problema. Solo horas pude abrir mi cuenta y con la clave y ahora autom谩ticamente me vota , esto es estresante . Soluciones o actualizan la aplicaci贸n .",not_applicable
1239,"No puedo utilizar el app, lo reporte por banca telefonica el 16/12/22 y solo pidieron disculpas que no pueden hacer nada, que el area esta revisando porq no se usar el app con version de android 7.0, incluso indicaron que son varios clientes con el problema y parece que no les importa. Acabo de revisar la compatibilidad y la aplicacion si debe funcionar.",not_applicable
1240,"Con cada actualizaci贸n los problemas de conectividad han ido aumentando, cada vez con m谩s fallas de conexi贸n (tal vez x saturaci贸n de su servidor) y/o conexiones m谩s lentas obligando a permanecer en l铆nea m谩s tiempo y el riesgo de ser hackeado. Siempre con su app y las de BBVA, Scotia e Interbank ven铆a conectandome a trav茅s de un VPN contratado para mayor seguridad, con su 煤ltima actualizaci贸n ya no me permite hacerlo. Voy a desinstalar su nueva app xq es menos segura sin VPN",confidentiality
1241,"Imposible realizar transferencias ! , Errores casi todo el tiempo , el teclado tiene lag ( corriendo en un Galaxy Note 10 Plus ) , no se pueden realizar operaciones de noche / madrugada , problemas de conexi贸n con el servidor ( probado en red inal谩mbrica Wi Fi , alambrica y LTE ) .",not_applicable
1242,"Si pudiera dar 0 estrellas las dar铆a. Pens茅 que era el 煤nico con problemas en la app pero ya veo que TODO EL MUNDO tienes los mismos inconvenientes. LLEVO 3 DIAS intentando hacer una transferencia interbancaria y sigue saliendo error. Me lanza que mi clave es incorrecta, se queda congelada y no puedo hacer nada.. en fin, hicieron una desactualizaci贸n de porquer铆a",authenticity
1243,"Desde su 煤ltima actualizaci贸n y su nueva imagen, esta p茅sima la aplicaci贸n, dificultad para realizar pagos, actualizar el estado de cuenta, ingresar a la aplicaci贸n, no carga los favoritos, no actualiza el token digital para hacer pagos, no se pueden hacer transferencias. P茅simo servicio.",authenticity
1244,"No se que pasa ultimamente, trato de abrir la aplicacion y se cierra automaticamente ya lo volvi a instalar y nada, por favor hagan algo, a muchos de mis amigos les esta pasando lo mismo, esto ya es un problema general, evaluen bien antes de lanzar sus actualizaciones que perjudican mas de lo que benefician.",not_applicable
1245,"Se cuelga muchas veces,y cuando se realiza una transferencia no siempre env铆a la constancia al correo,e invita a volver a intentar,pero si lo intentas aparece la operaci贸n duplicada y tienes q hacer tooooodo un tr谩mite para la devoluci贸n e incluso no lo puedes hacer con BCP sino con la empresa a la q se le duplic贸.Adicionalmente la actualizaci贸n es tan pero tan lenta q termina por cansar con la espera como hoy 28 e FEB",integrity
1246,"Malograron la app, antes era excelente, ahora un desastre, no se puede usar a pesar que he reinstalado la 煤ltima versi贸n, adem谩s pretend铆 usar la zona segura del BCP para una transferencia y gran sorpresa en la relaci贸n de bancos a transferir no figura el BBVA, me obligan a usar el cajero. Se necesita soluci贸n inmediata a estos problemas BCP es un maltrato a los clientes. No le dar铆a ni una sola estrella pero para publicar este mensaje tengo que marcar al menos una estrella.",not_applicable
1247,"P茅sima app, primero le faltan funciones como desbloquear con huella, cerrar cuentas de manera m谩s f谩cil, pero lo que me dio m谩s c贸lera, fue que no me deja verificar el token digital con el escaneo facial, se queda en bucle una vez que me ha escaneado, vuelve al inicio como si no hubiera escaneado nada, y tengo que estar pasando por el banco para que al final me deriven a banca por tel茅fono, p茅rdida de tiempo y paciencia.",authenticity
1248,"Pesima app, la he descargado nuevamente porq mi celular lo formatee, y me sale ingresar c贸digo de validaci贸n q llega a mi celular lo ingres茅 y sale c贸digo incorrecto cuando es el mismo n煤mero que me llega en mensajes, y solicito nuevamente el c贸digo y llega despu茅s de finalizado la sesi贸n que dura 40 segundos, p茅sima aplicaci贸n siempre lo mismo con los del bcp, ya aburren, mejor cambiar茅 mis cuentas al continental que nunca he tenido esos inconvenientes.",authenticity
1249,"Hice unas transferencias de montos regulares y en algunas me sali贸 ""error, intentar de nuevo"" as铆 que lo intent茅 de nuevo, pero resulta que ""SI"" se realiz贸 la primera y la segunda operaci贸n, caus谩ndome un da帽o enorme. Esto ya ha pasado varias veces en montos menores tambi茅n. Esto considero que es grave y no lo corrigen desde hace tiempo. Ahora febrero 2023 y sigue muy su App a tal punto que transferir茅 mis fondos a otro Banco dado que falla demasiado causando p茅rdidas en dinero y tiempo valioso",integrity
1250,"Esta nueva aplicaci贸n es muy mala hace 3 d铆as que no puedo hacer ninguna operaci贸n marco mi toque digital y me sale que esta mal (error) y que me van a bloquear, si yo sigo con el mismo celular que habilite mi toke digital, como es posible que nos perjudique de esta manera , mejor estaba la versi贸n anterior nadie les pidi贸 que hagan otra versi贸n, sino pueden hacer algo bien mejor no lo hagan y lo peor es que cuando uno va al banco a que te ayuden y no te reciben de la mejor manera",authenticity
1251,Hace un par de dias funcionaba correctamemte y desde hace 2 dias no logro entrar a la App. Tengo un GALAXY S21+ 5G y es increible q la app presente errores. Me manda a suspension profunda el mismo sistema. Es incomodo perder el tiempo estando llamando a su centro de Atencion. No sirve para nada. He formateado mi telefono y la AP no levanta. No se que han hecho con la APP. NO FUNCIONA..!!,not_applicable
1252,"No se puede utilizar, No se puede hacer la actualizaci贸n de los datos, la aplicaci贸n te dice que te envara un c贸digo a el correo y este demora en llegar 30 minutos y para cuando llega la sesi贸n en el aplicativo ya expiro, y te pide volver a ingresar lo cual implica volver a enviar el c贸digo y este de nuevo se demora 30 minutos en llegar. En conclusi贸n nunca pude ingresar a la aplicaci贸n",authenticity
1253,Desde hace unos dias intento abrir la aplicaci贸n y esta no abre y luego me sale un ventana peque帽a que la aplicacion: Banca m贸vil BCP sigue sin funcionar. He intentado resolver el problema borrando la cache y datos de la aplicaci贸n y desinstalando y volviendo a instalar y el problema persiste. Por favor me pueden ayudar a resolver el problema. Muchas gracias,not_applicable
1254,"El app es bueno, no eh tenido problemas. Pero ser铆a genial que sea m谩s liviano como del INTERBANK y sobre todo, que aparezca los n煤mero de operaciones de todos los movimientos o solo de los dep贸sitos. Ya que trabajo mucho con eso. Y es una molestia estar entrando a la banca por internet para verificar. Seria genial implementarlo. Gracias.",accountability
1255,"Ya mas de 15 dias que no puedo abrir la app bcp para hacer mis movimientos!! BCP cuando se levantara su app??? De nuevo desde que actualizaron la app el 28 de febrero del 2024 se volvio a caer la app no me funciona, de manera similar que en octubre del 2023 luego de dos meses se me arregl贸. Porque tienen que actualizar muchas veces si va ver problemas en algunos equipos como el galaxy A30 -.-",not_applicable
1256,"PESIMA!! Tengo 2 semanas intentando ingresar y me pide una clave de acceso que ""enviaran"" a mi correo, pues si llega pero luego de 30 a 40 minutos, cuando tengo la clave mi sesi贸n ya cerr贸 y as铆 estoy 2 semanas en un bucle infinito. Definitivamente mala la programaci贸n de esta app, si la mejoran puede que la vuelva a instalar, por ahora negativo.",authenticity
1257,"Se帽ores de bcp pedimos soluci贸n por el tema del app esta actualizaci贸n es p茅sima, no permite realizar las transacciones con 茅xito porque aparece un error ,solo se puede hacer a los favoritos y es inaudito que un banco con prestigio como ustedes pueda tener estos errores. Necesitamos la soluci贸n lo m谩s pronto no soy el 煤nico tengo varios familiares amistades con el mismo problema. Esperamos la soluci贸n lo m谩s pronto.",not_applicable
1258,"Porquer铆a de app..!!! No se para que actualizan el interface si estaba bien, preoc煤pense en mejorar la seguridad para que no nos roben.!! Llevo 3 semanas sin recibir los correos de confirmaci贸n de mis pagos, tampoco me deja acceder a la aplicaci贸n, siempre sale: Estamos trabajando en actualizaciones, tampoco por la pagina web no me llega los correos 贸 comprobantes de pago ni para un correo opcional.",accountability
1259,"Para ver los movimientos rata bien, pero a veces al hacer la transferencia se congela y dice error, pero al ver la cuenta ya se hizo la transferencia, y solo se puede ver en el correo, y si no sabes bien tu correo puedes terminar perjudicado. Antes en al hacer la transferencia te permit铆a registrar el concepto ahora no... ojal谩 lo mejoren.",integrity
1260,Despu茅s la actualizacion lo que hicieron fue da帽arla . M谩s trabajo para que dibujo y animaci贸n lo que se quiere es seguridad y menos riesgoso para no equivocarnos por las pura colocar el mensaje porque no aparece . Lamentablemente lo que hicieron fue una desgracia con esta actualizaci贸n. La versi贸n antigua est谩sba mucho mejor . P贸ngale cero por bruto ,accountability
1261,Pesima actualizaci贸n no funciona al abrir la Ap sale que esta dejo de funcionar al parecer no es compatible con Android 10 la versi贸n anterior funcionaba muy bien con la 煤ltima actualizaci贸n no se puede acceder y nos complica porq al estar afilado al token digital mientras no sea por la ap no puedes hacer ninguna operaci贸n espero que solucionen pronto,authenticity
1262,"Bcp cree que porque usamos su servicio de tarjetas de cr茅dito, ahorros, etc tenemos plata para cambiar de celular a uno que tenga Android 10 p茅simo lo que estab haciendo con las actualizaciones Yo tengo un celular con Android 8 y ahora no puedo utilizar la app. P茅simo servicio  en vez de mejorar para sus clientes, les complican todo",not_applicable
1263,"una porquer铆a de app no me deja ingresar cada vez q quiero ingresar me sale ""ocurri贸 un problema nuestro equipo esta trabajando para solucionarlo ,da帽os unos minutos e int茅ntalo de nuevo y me manda a la banca x Internet q clase de aplicaci贸n es yo preferir铆a seguir con la antigua q con esta actualizaci贸n q an echo y si no asen algo para q esto mejoren xq es demasiado para q tanta actualizaci贸n a nadie le importa los cuadros dibujos q salgan es un aplicaci贸n de banco no una aplicaci贸n de juegos .",not_applicable
