1770,"Es un completo desastre estoy instalando más tres veces el app porque cada vez que ingreso me sale error, por obligación tuve que actualizar la aplicación porque ya no podía hacer ningún movimiento, mil veces estaba la anterior. Más Enfoque en esta actualización porfavor",not_applicable
1771,"El problema con su aplicación sigue ocurriendo, ya va 2 instalaciones , y persiste el problema. La opción de atajo para Yapear, que esta ubicada en la parte inferior no ingresa, cuando se coloca la clave de 6 digitos, se borra y luego la pantalla queda congelada. Ya hice la consulta a través de Messenger del BCP, y no dieron solución. NO SE PUEDE HACER CAPTURA DE PANTALLA POR QUE LA APP NO LO PERMITE. Ya hice la consulta por Facebook, pero no resulta la solución que brindan..",non_repudiation
1772,Esta actualización que hubo me esta perjudicando demasiado. Como van a hacer una actualización en estos momentos no puedo ingresar a mis cuentas no carga la página de inicio in desastre total. Arreglen este problema urgente. O tendré que mover todo mi dinero a otro banco para realizar mis operaciones. Entras a la banca por internet otra tontería no carga etc. Mejoren no retrocedan con el servicio.,not_applicable
1773,"No me permite ingresar hace 5 días, aparece cargando y ahora tengo que volver a instalar el app. Otro problema fue que cuando cambiaron a su nueva interfaz todos mis datos se eliminaron y tuve que volver a registrarme en la web. Esto ya no es funcional.",not_applicable
1774,una decepción total estoy molesto porque no puedo crear mi clave de internet porque el reconocimiento facial no sirve y pa remate las fotos que toma del rostro lo distorsiona. es una porquería actualice mi rostro en la reniec. pensé que talvez por eso era pero sigue igual. creo que me voy a cambiar de banco mejor. pues no hay otra opción que te den para que puedan solucionar el problema. si el reconocimiento facial no funciona debería haber más opciones. y en el yape igual.,authenticity
1775,"Todo cambio para mal, nunca entra la aplicación cuando la necesito, tengo que reiniciar el celular solo para usar esta app. , los saldos se demoran en cargar y mis pagos de servicios guardados como frecuentes, desaparecieron. Pésima app.",not_applicable
1776,"Cada vez que quiero entrar a la aplicación me aparece que mi tarjeta está bloqueada, lo cual no es cierto y tengo que borrar todos los datos y volver a entrar. Un banco tan grande y no pueden ni con una aplicación de banco, que clase de programadores tienen.",not_applicable
1777,"Llevo varios días tratando de poder ingresar a la app para hacer mis transferencias y no me permite, se cierra automáticamente ni bien la intento abrir. La he instalado y desinstalado varias veces y nada. Sus actualizaciones empeoran la app en lugar de mejorarla.",not_applicable
1778,"La aplicación es buena pero quisiera saber porque ponen la opción de pagar con yape si cuando vas a ver los movimientos o pagos que hiciste con yape no aparecen y en el app de yape tampoco, en el estado de cuenta peor. Lo digo porque hace un tiempo hice un pago con yape en el app del bcp y olvide tomar captura del pago y busque el comprobante y no lo encontré por ningún lado (tuve que pagar otra vez porque la entidad dijo que sin el comprobante harían nada)",non_repudiation
1779,"Nos facilitarían las cosas si pudieran poner para copiar el num de la operación, ya que lo piden mucho cada vez que se hace una operación. Es incómodo tener que memorizar el num de operación para el comprobante de pago. Nos ahorrarían bastante tiempo. Gracias.",accountability
1780,Tengo un problema con la aplicación... no abre en modo datos moviles... en modo wifi si abre... que paso actualizaron la aplicación y pusieron algun bloqueador en modo datos... eso perjudica enormemente ya que no puede realizar mi operaciones en la calle... favor de corregirlo,not_applicable
1781,"En diciembre del 2021 cambie de equipo del celular y tuve que instalar la app y resulta que hasta la fecha de hoy no puedo ingresar ya me comunique por Messenger, WhatsApp y teléfono y nada de solucionarlo. Siempre sale ocurrió un problema que lo están solucionando y que intente mas tarde. Ya a pasado 2 meses y nada de solucionar el problema.",not_applicable
1782,"Es inoportuno pedir de la nada actualización y bloquear la anterior version, si no hay memoria no se instala y generan problemas, termibsnos dejs do de usar la aplicación y ver otro banco o efectivo, no deberian tener este sistema sin avisar y permitir hacer ese cambio tranquilamente",not_applicable
1783,"Se cuelga a cada rato, justo cuando nececito usarla tienen un problema y lo estan solucionando me parece q antes era mas ordenada, ahora mucha ventana por gusto se trata de hacer las cosas mas rapidas no demorandome pasando de ventana en ventana para q mus productos , sin mencionar q hasta ahora por apkicacion no s epuede hacer giros en mi opinion pesima esta actualizacion doy una estrella porwue no se como comentar sin darle ninguna.",not_applicable
1784,"Su última actualización ha sido muy mala, tengo el mismo problema que varias personas reportan aquí, ingreso a la app desde el celular y la pantalla se queda negra. Llamé a la banca telefonica y me dijeron que no habían tenido reporte de presentar problema, super raro ya que aquí hay reportes de esa falla desde el 18, deberían estar atentos a los comentarios para la pronta solución.",not_applicable
1785,"Con la actualización está aplicación q casi no fallaba ahora falla constantemente, además que la interfaz es pésima y nada intuitiva, le baje hasta 1 estrella y le pondría menos xq en lugar de mejorar o mantener volvieron pésima la aplicación, la nueva actualización sigue siendo mala y con más errores",not_applicable
1786,"Que está pasando con la app ya es casi una semana que está fallando, no sé si será por la nueva actualización que hasta ahora no me llega, pero mis problemas son que, demora en cargar el contenido, aveces me sale hasta 3 veces el teclado digital vacío, hace poco me anularon mi token sin razón alguna, quise hacer la solicitud otra vez y puro error salía no quedo otra que acceder a banca por Internet y todo normal. Decepción con la APP 😒😒😒",authenticity
1787,"Todo bien con la app, pero su sistema de notificaciones no se arregla llevo varios días sin que me notifiquen las transferencias que se hacen o quien deposita, me acaban de robar plata de mi cuenta hace 2 días y llamo al banco nl me dan solución, y recién vengo a dar cuenta. Ojalá mejoren su sistema de notificaciones y sus bug que tiene cuando se intenta iniciar sesión.",accountability
1788,"Terrible esta última actualización. Tengo que estar instalando y desintalando a cada rato para hacer mis operaciones. Luego de instalarla e ingresar por primera vez...cierro sesión y para las siguientes sesiones...simplemente me indica cuenta bloqueada, pero mi cuenta sigue vigente ....que terrible. La peor de las experiencias. Espero puedan mejorarlo",not_applicable
1789,"Buenas tardes ,en mi opinión ,pésima la última actualización ,podrían darle solución al problema xfavor ,veo q somos varios con el mismo inconveniente de la app q no funciona ,esto causa demasiados inconvenientes y perjudica a quienes trabajan x este medio",not_applicable
1790,"Me pidió una actualización para ingresar, vengo a la play store y no indicaba nada, luego intento instalarla de 0 y me crea problemas como que no quiere instalarse o directamente me dice que hay problemas con la app. Luego de varios intentos logré instalarla nuevamente, de todas formas la mala experiencia de usuario ya se hizi",not_applicable
1791,Definitivamente no funciona esta última actualización. Deberían poner la versión anterior también como disponible y así evitar que otras personas la estén comercializando. Ya he escrito al chat msn de bcp pero la guía que he recibido no ha solucionado el problema.,not_applicable
1792,"Ya lo había calificado y de pronto se borró mi calificación y comentario! Entonces con más ganas ... pésima app, fui obligado a actualizarla porque ya sabía que era un desastre y encima con menos funciones, ahora no puedo hacer nada por los cientos de errores ... Teclado, login, cargar las cuentas, iniciar una operación ... En cualquier paso puede fallar. Colmo de males que nuevamente tengo que ir al banco a activar mi token digital ...",authenticity
1793,"No se merece ni una estrella Ya más de un mes que no puedo ingresar al app por más que borro el app y vuelvo a descargarlo. Actualizo mi software y nada. Es una incomodidad. Uno no puede hacer ni transferencias porque sale "" ocurrió un error, inténtelo más tarde"" Arreglen eso. Mi equipo es un Samsung",not_applicable
1794,"Es realmente indescriptible manifestar lo que han hecho con esta app, lo peor de todo es que este banco es del que más cobra por transferencias, y sin embargo no pueden contratar a un buen ing de sistemas, porque hasta mi sobrino haría un mejor trabajo con esta app que es un asco, no funciona, te debería facilitar las cosas pero he ido 2 veces al banco a activar el estupido token y supuestamente ya debe estar activo pero su asquerosa app sigue dándome el aviso de que no lo tengo activo, inutil",authenticity
1795,Es bastante molestoso cuando quiero hacer una transferencia o simplemente abrir mi App y me piden actualizar a veces no tengo espacio y no lo puedo hacer eso me han traído varios por problemas deberían mejorar en eso no actualizar a cada rato o simplemente dar la opción de que si desea actualizar o no.,not_applicable
1796,"Llevo dos días intentando pagar un servicio y simplemente cada que quiero pagar me sale error, esto no es la primera vez que me ocurre. Por favor solucionen los problemas que presenta la app, por no pagar a tiempo las deudas se incrementan y los únicos perjudicados somos los clientes.",not_applicable
1797,"Una desgracia instalación, trato de iniciarlo y envian un código al celular que caduca en pocos segundos o el aviso de que ""ha ocurrido un error""...., intenté decenas de veces y nada! Los de BCP leen estos comentarios? Si es así los programadores de la aplicación deben ser cretinos.",authenticity
1798,"Saludos, ya tengo TOKEN activado y todo... Pero de manera súbita luego de unos dias al momento de realizar envios o pagos desde la app me dice que ""HAY PROBLEMAS CON LA SINCRONIZACIÓN DE FECHA Y HORA DEL TELÉFONO"" Ya activé esa opción, ya devolví configuración de fabrica, ya desinstalé y reinstalé la app y el problema PERSISTE no entiendo si es un conflicto o bug del app que no reconoce la fecha y hora del teléfono, y para colmo en el portal virtual me piden token ""lo pongo y..."" No reconoce",authenticity
1799,"Una vez cerrada la app es dificil volver a abrirla. Siempre sale el "" Ocurrio un problema. Nuestro equipo esta trabajando en......"" de esa manera no permite realizar otra operación en el momento qe desees.",not_applicable
1800,Con la versión anterior todo me iba bien con esta actualización no me permite hacer transacciones ahora me piden claven toquen física cuando ya tenía mi clave digital y muchas veces el aplicativo no abre vuelvan a andar versión anterior o mejoren esta por favor... Siguen los problemas es mas lentaaaaa,authenticity
