ID,Comentario,Clasificacion_ISO25010
1701,"Desde que se actualizo se desactivo el token digital y no puedo hacer transferencia a otras cuentas bcp solo puedo hacer a mis favoritos. Y se activo token físico que nunca he tenido, espero arreglen pronto. Al querer activar token digital desde la app como dicen sale error.",authenticity
1702,"Esta aplicación es una porquería. Me dicen que mis datos están desactualizados que me acerqué a un banco más cercano, si hice el cambio de tarjeta débito en febrero de este año 2021, además di mis datos actuales. BCP acaso no saben que estamos en pandemia y es una pérdida de tiempo.Ir al banco,hacer la cola, ingresar,esperar que atiendan. BCP ERES DE LO PEOR. NO USEN ESTE APLICATIVO OBSOLETO. TE CALIFICO CON -2000 ESTRELLAS.",not_applicable
1703,"Pésima la actualización, no permite hacer transferencias, siempre sale ""ocurrio un error"", demora en cargar las opciones. ESPERO LA MEJOREN, YA MAS DE UNA SEMANA QUE SE ACTUALIZO .LA.APP Y SIGUE CON EL MISMO PROBLEMA.",not_applicable
1704,"Malisima la actualización y lo peor es que debe ser obligatoria. No puedo estar más de 3min en la aplicación porque se cierra, a parte su menú está un poco complicado, no es ordenado como la actualizacion anterior. De verdad deben de corregir urgentemente para que no se siga cerrando de repente.",not_applicable
1705,"Pésima, con la antigua App podía enviar comentarios de mis transferencias y revisarlas en el correo, ahora no, sólo salen montos por más que escribo el comentario ya no aparece. Tampoco tiene la opción de ocultar mis cuentas y se muestran todas. En lugar de mejorar lo malogran.",accountability
1706,"Se supone que las actualizaciones son para mejorar el funcionamiento de una aplicación... Es decir... Avanzar a mejor... No es el caso con Uds... La han malogrado toda. Pesimamente mal el desarrollo, el orden y la facilidad del uso... Regresar a la versión anterior seria lo más acertado que podrían hacer...",not_applicable
1707,"De mal en peor, prefiero mil veces la anterior versión que con todas sus deficiencias era mucho mejor que la actual. Se supone que toda mejora debe ser para bien, en este caso fue al revés, por favor corrijan a la brevedad y mejoren el aplicativo. Gracias!!!",not_applicable
1708,"Una porquería su nueva actualización. Necesito hacer pagos y no puedo entrar, intento hacerlo por la web y me sale que debo validar mi token digital que está en la app, pero como carajos hago eso si la app no funciona!!! Si no van a hacer algo bien, mejor no lo hagan. Estábamos bien mientras ni movían nada. Desgraciados!!!!!!!!!!!!!!",authenticity
1709,"¡Ocurrió un problema! , el mensaje que veo más seguido cuando ingreso a la app. Se recomienda que arreglen la versión anterior y la relancen en lugar de esta nueva pero nada funcional versión; a menos que quieran perder más clientes. Hay que rezar para que la app de BCP funcione sin ese mensaje molesto",not_applicable
1710,"01.jun.2020: La última actualización está muy lenta, genera códigos de error entre otras cosas... Mucha pantalla para tan poco. 04.nov.2021: luego de más de un año sigue teniendo problemas la actualización lanzada en octubre pasado. Llevo todo un día tratando de hacer una transacción y nada. Ni media estrella les daría.",not_applicable
1711,"No soy del banco, soy un cliente común y corriente pero descubri algo que soluciono mi problema lo cual publico por si les ayuda, si renovaste tu tarjeta y al ingresar sale siempre tarjeta bloqueada y no te deja ingresar, en la app debes ir a la parte superior 👆 izquierda 👈 en el icono de sesión 👤das click y allí cambias la tarjeta antigua registrada y la reemplazas por la actual así ya no tendrás problema de ingresó 😒eso no podían contestar los del BCP, tan difícil se les hace🤷🏻‍♀️",not_applicable
1712,"Una completa porquería, a partir de la medianoche, toda la madrugada y en horas aleatorias del día, la aplicación no funciona, se actualiza demasiado seguido, lo cual entorpece el uso cuando uno la necesita con urgencia o no tiene datos.",not_applicable
1713,"Pésima actualización, ya lleva como dos semanas y no puedo hacer operaciones desde mi móvil. La APP se abre sola, genera mucha confución en todos los íconos, etc. A diferencia de otras APP de otros bancos que sí funcionan e incluso con ingreso biométrico. PÉSIMA NO ME DEJA INGRESAR MI TOKEN!!!",authenticity
1714,"Pésima App. Ningún banco es tan pésimo como la del BCP. De la nada se borró mi token una vez más y nuevamente tengo que ir hasta el banco a activarla. Justo cuando necesito hacer transferencia urgente. Además, siempre se cuelga de la nada, te pide reintentar varias veces, pésimo todo. Una vergüenza que un banco como BCP tenga estos problemas. Con ninguna app de otros bancos he tenido estos inconvenientes. PÉSIMO TODO",authenticity
1715,"Terrible demasiada animación innecesaria, la app se cuelga 9 de cada 10 intentos era una app de banco con la interfaz más simple y accesible ahora parece una versión kids, le doy una estrella porque es lo mínimo que se me permite.",not_applicable
1716,"Esta nueva versión del aplicativo falla todo el tiempo, no carga las operaciones frecuentes, para ingresar al interfaz tienes que reiniciar el aplicativo a cada rato. En pocas palabras no sirve su aplicativo, se hubieran quedado con versión antigua que funcionaba muchísimo mejor que este. Mal BCP",not_applicable
1717,"Un asco esta app, no me permitía ingresar ni actualizar quizá por la antigüedad de mi cel así que cambié de dispositivo, pero por más que intento ingresar no me lo permite, me sale que hay un error y que están trabajando para resolverlo. Ya van más d 1 mes con ese problemas y otros dentro de la app y no lo solucionan, una vergüenza que con todo el presupuesto que tienen no puedan arreglar la app, por qué nos impiden acceder a nuestras cuentas prácticamente? Por internet es donde se dan los robos",not_applicable
1718,"Funciona bien, aunque varias veces he experimentado interrupciones en el servicio, esto se puede entender por temas de demanda o mantenimiento, pero ayudaria si se avisa con anticipacion. Por otro lado, algo que que me ha perjudicado en la app es no poder asignar alias (nombres) a las cuentas, esto era muy util para identificarlas rapidamente. Sin embargo la asignacion de alias si funciona en la web.",accountability
1719,"Pesima aplicacion es lenta y hay veces que no puedo acceder a mi cuenta . Hasta para actulizar hay problemas , solo trae molestias y no mejoran en nada con sus actulizaciones MUY MALA APLICACION encima de todo cuando actualizas tus datos se pierden y tienes q ir al banco para solucionarlo perdiendo mucho tiempo PESIMO SERVICIO",not_applicable
1720,"Hasta parece que lo hicieron con la intención de que el usuario no pueda realizar su pagos a tiempo y pague penalidades. Una bazofia la nueva actualización, debieron mejorar y empeoraron. Ahora sale error cuando quiero realizar cualquier operación, dice que no está sincronizado el token digital y que ponga en automático la hora. La hora de mi celular está en automático. Ayer 04/11/21 podía realizar operaciones y ahora ya no.",authenticity
1721,"Ninguna estrella, antes el código para que piden en el segundo paso se podía hacer más rápido pero ahora se demora UNA HORA en llegar ya cuando la sesión es INVÁLIDA! y lo peor cuando lo quieres hacer vía SMS NUNCA LLEGA! e instalado y desinstaladi esta aplicación 2 VECES! Y nada que funciona PÉSIMO SERVICIO! 😡😠 y una perdida de tiempo total!",authenticity
1722,"Mala experiencia. Se congela, está más lenta en relación con la versión anterior. Su aspecto es amigable pero en cuanto a la rapidez de uso lejos de mejorar, la percibo muy lenta. Esperemos se corrija.",not_applicable
1723,"Estoy intentando hace 4 días ya descargar el aplicativo y no me deja... Me sale un mensaje de que ""vuelva intentarlo más tarde"" etc.. etc... Tome varias medidas como asegurarme de que haya memoria, limpie el cache, actualize mi versión Android, reinicie y apague ... Y nada me funcionó ... Por favor atención a este caso... Ya que todo comenzó con una actualización del bcp y que me obligó a desinstalar el aplicativo y cuando lo quiero instalar me sale un mensaje mencionado en líneas más arriba.",not_applicable
1724,"Pésima actualización, no carga nada, todo desordenado, no se ven todos mis productos, solo me dejan escoger unos cuantos, sinceramente la version anterior era mas simple a la vista e intuitiva, no se puede hacer nada. Pésimo todo.",not_applicable
1725,"Sinceramente hasta el momento me terminé de decepcionar de la app , sabía que aveces falla pero ya esto es demasiado, nose si los mismos del banco sabotean para que uno no pueda hacer nada en la app, llevo días si poder usarla, la versión anterior era mil veces mejor con sus fallas y todo, pero desde que actualice esta versión, es una total porquería que no sirve para nada",not_applicable
1726,"No tiene la opción de agregar correo al pagar un servicio Mucha actualización... cuando me comparten internet no puedo hacer nada, tengo que poner el chip al celular ahí recién la aplicación bcp puede funcionar... estaba bien hace un año, ahora es una app que da más afán y disgusto.",not_applicable
1727,"Solo me deja entrar una ves y después me dice que mi tarjeta está bloqueada y no me deja entrar. Que mal, la versión anterior que tenia funcionaba bien, pero cambie mi tarjeta porque esta deteriorada y me dijeron que tenia que instalar nuevamente la ap para pedir mi token con la nueva tarjeta, y ahora entro y me dice que la dichosa tarjeta está bloqueada, pero por mi laptop entra normal sin problema osea es problema de la ap. Con la del bbva me funciona muy bien y no hay problemas nunca me ha fa",authenticity
1728,Por favor solucionen el.proble.a de App dice que están intentando resolver el inconveniente que vuelva a intentarlo pero lleva meses y nada cuando fui al banco me dijeron como nose les cobra nada a veces presenta inconvenientes es decir porque es gratis te dan cualquier cosa entonces cobren y den un buen servicio en estos tiempos no podemos ir al banco por cualquier cosa aparte hay colas largas....por favor darle solución gracias,not_applicable
1729,Antes dejaba pagar los servicios ahora nada solo da error diciendo que hay problemas en el sistema recibirás una notificación y nunca notifica nada y al día siguiente lo mismo para que habilitan la opción. De pagar servicios si no es posible pésima experiencia,not_applicable
1730,"Hola , hoy me ha aparecido un mensaje para que me comunique con el desarrollador, esto después de eliminar el cache. La App no abre, se cierra automáticamente y ya la desinstale e instale y nada. Pueden dar una solución inmediata para poder seguir haciendo transacciones. Gracias Les escribi hace 2 días, la solución sería que me envíen un link para instalar la versión anterior, la 3.20. La 3.21 no abre. Es urgente! Gracias",not_applicable
1731,"Soy primerizo con las tarjetas y la verdad me siento muy confundido, ni siquiera puedo ingresar, fui a ver el codigo de activación para copiarlo y pegarlo y cuando entré a la app (ni siquiera la cerré) todo se había reiniciado y sin importar que haga, no me deja ingresar a mi cuenta, porque dice que ya está abierta, y yo en ningún momento ingresé a mí cuenta, pésimo servicio.",not_applicable
1732,"Es frustrante está actualización, ni siquiera puedo entrar porque me dice que no tienen mis datos y me pide un correo o celular y cuando llamo a la central solo dicen que están ocupados y que vuelva en 10 minutos y si ingreso en la web no puedo hacer ninguna transacción xk me pide el token digital al cual no puedo acceder por la app. Un total desastre el servicio",authenticity
1733,"Terrible experiencia la del uso de su aplicación, sus actualizaciones son un asco; o funciona mal o no funciona. La versión anterior era mucho mejor, ratificó lo dicho; obligan a actualizar la versión anterior que era mejor.",not_applicable
1734,Por favor help!!! .... Cada vez que ingreso me dice que la tarjeta está bloqueada ....pero borro los datos de la app.... Ingreso a la aplicación como si fuera primera vez sigo todos los pasos y logra ingresar a mi cuenta .....pero cuando cierro y quiero volver ingresar me dice que la tarjeta está bloqueda .....he probado también desinstalando la aplicación pero nada.,not_applicable
1735,"Es una de las app de banco con menos seguridad que vi en mi vida, sus sistemas son muy básicos y no ayudan en nada a la seguridad del usuario sobre todo en casos de robo. La app se cae junto con la de yape impidiendo realizar cualquier movimiento. Deberían mejorar el soporte de la aplicación. Si le pudiera colocar 0 estrellas se lo coloco",resistance
1736,"Que es lo que están haciendo con la app? Se actualizo bajo una nueva plataforma inepta, que piden el ingreso del tocken manual, y cuando seleccionó el automático me envía a la pag. Web, y lo peor de todo es que en atención al cliente no saben que hacer. Hacen perder el tiempo al usuario de ir nuevamente al banco por cosas que ya se hicieron, como sacar nuevamente la clave tocken ( que de por si no funciona en el app).",authenticity
1737,"Después de la última actualización falla constantemente. Una muy recurrente es que el token virtual no se autoescribe automáticamente cuando se trata de transferencias directas a otros bcp. En vez de eso, queda la casilla libre para hacerlo manualmente lo que dificulta ya que hay que salir, entrar al token, memorizarlo o anotarlo, y tener suerte de que no se cuelgue el app mientras se ingresa la nueva transferencia dentro de los casi 45 seg que quedan después de ver el token y salir. Muy mal!",authenticity
1738,"A pesar de todos lo problemas mencionados por los anteriores usuarios....cada día está app está brindando un pésimo servicio y con cada actualización el problema va en crecimiento, más errores y es un dolor de cabeza al momento de querer hacer algún pago o transacción....espero que lo solucionen a la brevedad posible.... gracias.",not_applicable
1739,Imposible entrar a está aplicación . Es lo peor me manda a cada momento error. O vuelve a poner la validación. Muy mal. Cambiaré de banco. Consume mucha memoria no puedo actualizar. Una más fácil de aplicación? ?,not_applicable
1740,"Desde que actualice a la nueva versión ha venido presentando fallas, se para colgando indicando que ocurrió problema y que se va solucionar, y así está por horas, pésima actualización a pesar que tiene mejoras como compartir la confirmación de la operación, pero de nada sirve si se para colgando la aplicación.",not_applicable
1741,"Ya varias cemanas estoy teniendo problemas con la app, intento abrirla y se pone azul con el logo y automáticamente sale de la app ya la instale y la desinstale las de 10 veces ya no se que hacer solo espero que arreglen este problema de una ves no lose si solo yoy yo o hay más personas que les está pasando lo mismo pero por favor BCP pónganse las pilas y solucionen los problemas de sus clientes gracias.",not_applicable
1742,"Desde ayer abro la app y se cierra sola, y me salen mensajes del sistema que la app tiene problemas, bloqueos frecuentes y la manda a suspensión profunda. Ya la desinstalé y la volví a instalar, previo borré los datos y el cache de la app, pero nada... sigue sin abrir",not_applicable
1743,"La opción de reconocimiento facial para la activación del token digital no es compatible con los nuevos Samsung s24 ultra, se realizó múltiples intentos y en diferentes horarios, mas de 3 días intentando activar el token sin éxito. Actualización, el 1 de marzo del 2024, fui a las oficinas y me indican que es un error en todos los dispositivos nuevos y que aun no tiene solución, que ya están con ese problemas mas de 1 mes y no hay fecha de solución y que la mejor opción es comprar un token físico",authenticity
1744,"Yo ya desinstalé la aplicación de mi celular porque desde esta última aplicación , me sale un mensaje que dice: Dispositivo modificado Por tu seguridad retira los privilegios y modificaciones en el sistema operativo. Me explican que es porque el celular fue reparado y bla bla que no es culpa del bcp. Pero si hacen actualizaciones deberían de ver ese tema. Yo tengo mi celular original no es de sgda. Ahora no puedo hacer mis operaciones hasta q no me compre un nuevo. Gracias bcp 😠😠",authenticity
1745,Muy mala la nueva aplicación se cuelga constantemente no puedo ingresar lo intente varias a veces... la aplicación se detuvo o error...muy mal vuelvan al antiguo así no se puede hacer ningún tipo de transacción... Lo peor es que se cuelga en el momento propicio Si van a actualizar ps que la aplicación sea mucho mejor de la antigua no unas más peor que la otra así no se vale...porfavor traten de solucionar lo más pronto que puedan se necesita muy urgente una solución eficaz para esta nueva,not_applicable
1746,"Pésima app y pésimo servicio. El día 23 de enero de 2023 me obligaron a actualizar el app y ya no funciona. Llamé a banca telefónica y me dijeron que por ser mi celular antiguo (a pesar de ser Android 8) no es compatible y que lamentablemente no puedo usar el app. En resumen, perjudican a sus clientes por ser más ""modernos"", linda justificación.",not_applicable
1747,Malisimo esta versión nueva no te permite hacer tus pagos ni disponer de efectivo de tus tarjetas de crédito. Siempre es um. Problema entrar a la aplicación en mis palabras una rael porquería. Me imagino q era mejorar la aplicación no empeorarala. De verda es frustrante,not_applicable
1748,"La nueva actualización no está mal, ESTA TERRIBLE! Con la anterior versión no había inconvenientes tan recurrentes a la hora de ingresar al app. Ahora es común que salga ""Ocurrió un error"". Lamentable.",not_applicable
1749,"Mala actualización, error en la carga, dias de dias con ""nuestro equipo esta trabajando para solucionarlo"", no hay forma en vez de solucionar dificultades está mas complicado que uno pueda usar la banca móvil, prefería la version anterior mil veces!",not_applicable
1750,"totalmente una desastre está última actualización, no me permite ingresar al app si no estoy conectado a una red local. Osea con mi señal de celular no puedo ingresar al app y lo peor que tengo que tener la opción de bloqueo de pantalla con algún tipo de seguridad para poder entrar al app. De lo peor ahora estoy pensando seriamente pasarme a BBVA continental porque no veo ese tipo de problemas en amigos míos. Son de lo peor como aplicativo. Falta la última actualización",not_applicable
1751,"No sé que han querido hacer con esta actualización, se visualizan todas tus cuentas, ya no puedes ocultar una de ellas por seguridad. Si quieres hacer un giro no se puede. Pésima está app y peor su actualización. 06-07-2024: Cada vez peor esta App, ahora ya no se visualiza una de mis cuentas ni el saldo, lo ratifico pésima esta App, con cada actualización aumentan los errores y mi disconformidad.",confidentiality
1752,Pésimo!!! Debo desintalar instalar la app después de haber realizado alguna consulta en mis cuentas puesto que después que exceso el tiempo de permanencia al ingresar nuevamente mi clave ya no es reconocida por la app y después de 03 intentos simplemente me bloquean el acceso por el día. La anterior versión no sacaba canas verdes como esta nueva. Pf corrijan ello.,authenticity
1753,"El app a mejorado de apariencia pero en funcionalidad sigue siendo la misma, no funciona la biometría con huella. No puedo abrir siempre la aplicación me sale error ojalá puedan arreglarla y sea más fluida.",authenticity
1754,"Estoy muy insatisfecho con está actualización. Parece novedosa y muy interactiva pero no funciona bien. Desde que actualicé ingrese un par de veces. Mis otros intentos han sido fallidos. Sale un mensaje diciendo que están trabajando en solucionar el problema. Pero la verdad, nada!",not_applicable
1755,Esta última actualización no permite abrir la aplicación. Se reinicia apenas ingresas los datos de la tarjeta y la clave Internet. Llame a banca por teléfono me dijeron que en 48 horas me solucionaban pero hasta el momento nada. Veo que no soy el único con el mismo problema pero parece que no les interesa a los del BCP darle solución a su famosa actualización.,not_applicable
1756,"Señores del BCP! No puedo transferir, yo tenía la aplicación antigua y era mas rápida y fácil, en esta nueva no me deja ni ingresar me sale ""Ocurrio un problema, nuestro equipo esta trabajando"", por favor es URGENTE! regresen la aplicación anterior, lean los comentarios que no soy la única que se queja, en vez de ayudarnos, empeoran haciendo tonterías para dis que ""Mejorar"", ahora quiero ingresar a la Banca x internet para transferir y me sale q necesito ingresar el nro de token🤦‍♀️",authenticity
1757,"Horrible!!! La version anterior funcionaba mil veces mejor!!! He demorado demasiado en pagar servicios básicos que estaban como favoritos, sólo porque dizque ""no habia conexion"" ""el servicio no está disponible"" y un monton de mentiras más.",not_applicable
1758,"No puedo descargar la aplicación, se cancela automáticamente cuando llega al 80 %, he probado descargando otras apps y descargan normal, el problema es solo con esta aplicación, necesito ayuda. Gracias",not_applicable
1759,La última versión es una perdida de tiempo tengo q llamar continuamente para q me habiliten puesto q se bloquea la aplicación cuando quieres hacer un pago o tranferencia es un asco regresen ala versión anterior o mejoren su aplicativo se agradece de antemano gana bien su trabajo o si no erradiquense por su mala y defectuosa aplicación...el tiempo es oro......,not_applicable
1760,"Me gustaba mas la version anterior, esta nueva version la mitad de las veces falla y sale un mensaje que dice ""ocurrio un problema"" y te deriva a la pagina web del banco, es una app invasiva, luego cuando el ""problema"" se solventa, ya sea minutos o horas despues, la app automaticamente se abre en 1er plano en la pantalla, independientemente de lo que estes haciendo en el telefono, la app se superpone al 1er plano; es mas complicada al momento de ubicar los servicios a pagar y registrar favoritos",not_applicable
1761,"Desde la nueva actualización la aplicación está horrible, si se pudiera colocar 0 estrellas ese sería mi votación. No me permite ingresar a mi App, coloco la contraseña y me redirecciona a la página principal de mi teléfono, para realizar operaciones tengo que ingresar a la banca por internet. Es un desastre total el App BCP",not_applicable
1762,"Malísima. En algunas actualizaciones, simplemente, deja de funcionar, como en las últimas 2. Una vergüenza que un banco tan grande tenga una experiencia de usuario, móvil, tan mala. Deberían aprender de Interbank. Actualización (20/01/20): 3ra actualización y sigue sin funcionar, una desgracia.",not_applicable
1763,"¿Se puede saber qué han hecho con la configuración del permiso de compras por internet de las tarjetas? No me permite entrar en esa opción, sólo me muestra el siguiente msj: ""Lo sentimos, este servicio no está disponible en este momento."" ¿Cómo no van a tener activa esa configuración? Se necesita entrar ahí. En vez de estar ""actualizando"" la app, busquen técnicos que solucionen esos problemas que ya vienen presentando. Es un fastidio tener la obligación de usar la app para ciertas operaciones.",not_applicable
1764,"Que está pasando con la aplicación bcp ,en un momento a otro ,no puedo entrar a la aplicación ,con la última actualización,no me deja ingresar a la aplicación,entro y me saca ,lo he desistalado y vuelto a instalar,sigue con el mismo problema 😵‍💫. Pésimo,no he tenido ningún problema hasta está actualización.🙂",not_applicable
1765,Todos los meses una actualizacion con lo molesto que es estar actualizando para que ademas de eso la aplicacion sea la porqueria mas lenta del mercado. A ver si invierten un poco en personal capacitado el app es un asco total.,not_applicable
1766,Sr.. Bcp traten de mejorar y cincronizar app BCP para que todos los equipos tengan acceso a la plicacion bcp En mi caso se me hace imposible entrar a la aplicacio con mi equipo. Y nesecito estar informado de los movimientos y asi poder hacer mis transferencias. Saludos,not_applicable
1767,"Está actualización es una porquería, no permite hacer nada, para toda función sale mensaje de error, parece tener buena apariencia pero no sirve de nada si no cumple su objetivo, espero que lo solucionen pronto, la anterior estaba muy bien, no le daría ni una estrella por el momento",not_applicable
1768,"Tengo muchos años trabajando con BCP. Pero Ya tengo más de dos semanas con el problema con esta aplicación, todo iba perfectamente bien, pero llegó una actualización el 18/09 y empezó todo a fallar luego lanzaron una actualización el 23/09 y el mismo problema... Lo siento señores del BCP pero a mí ya me perdieron como cliente. Afortunadamente tenemos otras alternativas para elegir. Espero lo solucionen por el bien de sus usuarios.",not_applicable
1769,"Esta aplicación es una porquería, para q entres se demora como media hora, lo peor te dicen q te van a enviar el código a tu correo para q entres, y te envías después de 2 horas y la sesión ya expiró... Carga demasiado para todo... Carga para clave, carga para verificar, carga para todo, es un asco..",authenticity
