id,comentario,etiqueta
1264,"Qu茅 pasa con la aplicaci贸n??? Desde el 12/12/2022 que no funciona y me dice que la vuelva a abrir lo hago y me dice que no se puede y que la cierre. Ya me queje varias veces, primero me dicen que desinstale y lo vuelva a instalar. Pero como a煤n as铆 no funciona, me dicen que van a enviar un correo al 谩rea respectiva. Pero a煤n no la puedo usar porque sigue sin abrirse.",not_applicable
1265,"No me permite ingresar a mi cuenta, ya registr茅 mis datos en m煤ltiples oportunidades y sigue saliendo que hay un error, que espere unos minutos. No hay una respuesta o soluci贸n a esto, me comunico con atenci贸n al cliente y hasta me cuelgan. Esta actualizaci贸n est谩 horrible, nada funciona. Si pudiera le dar铆a 0 estrellas.",not_applicable
1266,"Con la ultima actualizaci贸n la aplicacion esta dando muchos problemas, me paso que al momento de hacer una transferencia a otra cuenta ,al momento de confirmar aparecia una pantalla de carga y se quedo ah铆 por mas de 10 minutos y no me aparecio en ningun momento el baucher y aun asi los fondos se transfirieron, lo cual ocasiono que casi pierda mi dinero, felizmente la persona a la que transferi el dinero fue consciente y recib铆 lo que compre. Deberian mejorar la aplicacion y no empeorarla!!!",integrity
1267,"Es un problema constante que me viene sucediendo, cada vez que pide la aplicaci贸n actualizar demora en reponerse; ahora ya voy una semana tratando de actualizar y a煤n puedo hacerlo, favor BCP tener en cuenta estos comentarios de muchos y evitar inconvenientes ya que me es muy 煤til dicha aplicaci贸n pero con este problema de actualizaci贸n afecta mucho.",not_applicable
1268,"Lo peor! Esta nueva aplicaci贸n no sirve desde que la crearon, en vez de mejorar lo que hicieron fue empeorar. Siempre se tiene problemas, errores de sistema, de token, definitivamente no sirve. Espero que los administradores del banco est茅n al tanto de esto y trabajen en una nueva app o regresar a la versi贸n anterior. Hoy 15 de febrero todo el d铆a fallando la app.",authenticity
1269,"Buena aplicaci贸n en general. Pero el equipo de TI deber铆a hacer una versi贸n estable en caso de emergencias, en el Pa铆s que vivimos la conexi贸n por Datos es vol谩til y ante una emergencia el actualizar por obligaci贸n es una desventaja total.",not_applicable
1270,"No puedo hacer transferencias interbancarias ni entre cuentas de terceros del mismo banco, sale teclado seguro escribo los n煤mero del tokken continuo y vuelve a cargar teclado seguro, desinstale y volv铆 a instalar y ahora sale que no puedo ingresar por que exced铆 n煤mero de cuentas... Ser铆a bueno que prueben bien el uso de su app para mejorar y no retroceder en la atenci贸n a sus usuarios",authenticity
1271,"Antes la app funcionaba bien, pero ahora no se que actualizaciones est谩n haciendo que se cierra y tengo que desinstalar e instalar de nuevo, eso fue hace una semana, hab铆a solucionado el problema y ahora me esta pasando lo mismo otra vez, es una p茅rdida de tiempo tratar de buscar soluci贸n desde el tel茅fono cuando el problema es de sus ing de programaci贸n",not_applicable
1272,"No funciona la App. Abro y se cierra autom谩ticamente, no me permite ingresar. Hace varios d铆as que est谩 pasando lo mismo. No puedo hacer transferencias desde la web, porque me pide mi token digital por seguridad, pero la app se cierra incluso antes.",authenticity
1273,"P茅sima actualizaci贸n ahora se tiene que cerrar sesi贸n para ver el token digital, para poder hacer una transferencia ya sea entre las mismas cuentas a terceros o incluso cuando quer铆as realizar una recarga cuando antes pod铆as realizarlo con solo ingresar porque se supone que siendo banca m贸vil ya tienes todo registrado la verdad que tremenda decepci贸n con bcp",authenticity
1274,"Desde el 2014 esta App ha mejorado bastante pero no lo a la altura del avance de la tecnolog铆a, la gran mejora es el Token digital pero habr铆a que ver en adelante su perfecci贸n. Por otro lado falta incorporar las tarjetas empresariales y corporativas.",not_applicable
1275,"Sigo con la antigua app y espero quedarme con esta interfas por que la nueva es realmente pesima orrible , mas animacion que la verdad es un asco su app y hablo por todos creo , en ves de mejorar empeoran , por mas que califiquen 1 estrella creo que estan centrados en sus programadores , por que no piensan en volver ala antigua actualizacion , que es mas facil rapido y sencillo , que es asi como deve de ser una app de banco, pero igusl les importa un comino lo que digan sus consumidores",not_applicable
1276,"No me da la opci贸n de "" actualizar luego "" es ACTUALIZAR ... Si o S铆 ! Y es frustrante x que en mi caso tuve que realizar una operaci贸n de urgencia y no pude posponer la actualizaci贸n. Y es algo insulso la actualizaci贸n ya que la App no cambio en nada . PERDIDA DE TIEMPO!!.",not_applicable
1277,"Cada vez que abro la aplicaci贸n se cierra nstant谩neamente, mejor dicho no se puede abrir, lo he reinstalado varias veces y reiniciado mi tel茅fono y sigue igual, eso que uso un equipo actual, un SM-G678F con Android 13. Por favor solucionen cu谩nto antes este error, no puedo usar mi banca hace semanas, cre铆 que era un problema con mi equipo pero veo que le pasa a muchos de mis familiares",not_applicable
1278,"Porquer铆a de aplicaci贸n, es el colmo que siendo una entidad bancaria que maneja grandes cantidades de dinero, no puedan con la optimizaci贸n de una simple app, la carga de acceso es eterna y si entra no se puede vincular con la tarjeta d茅bito por qu茅 el c贸digo de validaci贸n tarda a帽os luz en llegar... Es a帽o nuevo, p贸nganse las pilas y dejen de estar hueveando",authenticity
1279,"Est谩 un desastre esta aplicaci贸n, no puedo usar la aplicaci贸n por el siguiente motivo: Debo de validar un c贸digo de verificaci贸n que llega a mi correo electr贸nico, sin embargo este c贸digo de verificaci贸n demora aproximadamente 40 minutos en llegar a mi correo, y sin el c贸digo no puedo usar la aplicaci贸n, y hasta q pasen 40 minutos el ingreso del c贸digo de verificaci贸n ya expir贸. Solucionen este problema que ya lleva meses",authenticity
1280,"Por cada actualizaci贸n que hacen empeoran el aplicativo!! Cada que necesito hacer alguna transferencia marca error como si estuviese caida toda la plataforma, marca error al cargar el teclado numerico para ingresar la contrase帽a y si por un milagro logro ingresar no carga para realizar transferencias o pagos ○",not_applicable
1281,"Una porquer铆a est谩 app hasta hace poco funcionaba todo bien, ahora cuando quiero ingresar me dice q mi tarjeta est谩 bloqueada desinstalo la app y la vuelvo a instalar y puedo ingresar bien, cierro sesi贸n y cuando quiero volver a ingresar otra vez con la misma porquer铆a de que mi tarjeta est谩 bloqueada cuando no es as铆. Antes me parec铆a una app genial pero ahora con este fallo tengo q desinstalar e instalar la app cada que quiero ingresar. ABSURDO",authenticity
1282,Su 煤ltima actualizaci贸n se ve horible la aplicaci贸n no arranca se traba su dise帽o a mi parecer es fea y al menos varios de mis amistades opinan lo mismo ojal谩 corrijan el error que sale porque no se puede acceder a nada se queda en inicio y nunca avanza y yo que utilizo bastante la app estoy muy decepcionado de su 煤ltima actualizaci贸n.,not_applicable
1283,Para ingresar a la app demora en cargar y el teclado es tan pesado para digitar la clave. Lo mismo sucede cuando navego por su app al querer realizar una operaci贸n o tan solo para entrar a mi cuenta. Deber铆an mejorar el rendimiento y no solo enfocarse en el dise帽o.,not_applicable
1284,Yo pens茅 que era mi celular por reciente actualizaci贸n de mi versi贸n Android 10 hasta que lo desinstale y lo instal茅 pero nada sigue con el mismo error que no me deja abrirlo pero viendo los comentarios todos tienen el mismo problema as铆 que se帽ores del BCP mejoren su plataforma virtual de banca m贸vil. Muy p茅simo desde hace m谩s de una semana ya no puedo ingresar.,not_applicable
1285,"La app tuvo problemas, las solucionaron, es buena a煤n as铆, sin embargo, me gustar铆a que, como otras app bancarias, permita visualizar desde la interfaz de la app los detalles de la movimientos, como el nro de transacci贸n, hora, fecha, entre otros detalles que se a veces son importantes.",accountability
1286,"Hace un mes que no puedo ingresar a la aplicaci贸n, me sale un mensaje de que la tarjeta est谩 bloqueada, y no es as铆 ya que llam茅 a atenci贸n al cliente y me confirman que est谩 activa y sin problemas, incluso la puedo utilizar para cualquier tipo de compra, yapear, o banca por internet, pero la aplicaci贸n nada, mal铆sima, ya la actualic茅 y nada, y los de atenci贸n al cliente me dicen que espere a que se arregle el sistema, que no pueden hacer nada!",authenticity
1287,No permiten realizar transferencias interbancarias diferidas por la app cuando en todas las aplicaciones de los dem谩s bancos permiten. Deber铆an permitir realizar ambas tanto diferencidas como inmediatas. Y ahora tampoco puedo realizar transferencias interbancarias inmediatas. Cada vez peor la app.,not_applicable
1288,"No me sirve la aplicaci贸n, llevo d铆as sin poder entrar a realizar pagos, y tengo que perder tiempo en ir a cajeros o al banco. Podr铆an repararla o cambiarla a la anterior. Se supone que deber铆a ser de mejor utilidad, sin embargo, hacen perder m谩s tiempo. No merece ni una sola estrella. Pero hay que calificar, sino no te permite, ni siquiera opinar",not_applicable
1289,"Falta hacerle mejoras a la app, quise hacer una transferencia y me mostraba error con la hora, por m谩s que lo tenia ped铆a el aplicativo (siempre est谩 as铆) no pude por que se qued贸 en el mismo error, enc铆a para eso, se bloqueo el token y al llamar a la central telef贸nica del bcp no hay respuesta, hasta la fecha sigue bloqueado, lo deje de usar",authenticity
1290,"La peor actualizaci贸n que han lanzado no reconoce el token digital que ya estaba activado en la versi贸n anterior. No funciona el reconocimiento biometrico, creo que deber铆an validar mejor una versi贸n antes de su lanzamiento, equipo BCP tienen mucho que mejorar en la pr贸xima versi贸n.",authenticity
1291,Luego de la 煤ltima actualizaci贸n de la aplicaci贸n si bien se ve muy interesante est谩 muy lenta y algunas operaciones como los pagos de servicios est谩n p茅simos y no se pueden realizar. Siempre sale ERROR.. Antes era m谩s f谩cil realizar operaciones. Ahora est谩 terrible. Una estrella a su nueva app 火火,not_applicable
1292,"La nueva versi贸n tiene una interfaz mejor pero por lo que veo, tiene muchas fallas. Yo uso diariamente el pago m贸vil con el celular y antes funcionaba bien, ahora debo reintentar ya que sale error de conexi贸n, la transacci贸n ya no es r谩pida y es inc贸moda. Por favor corrijan eso.",not_applicable
1293,"P茅sima actualizaci贸n. Hasta el momento no puedo realizar ninguna transacci贸n. He tenido que cambiar de operador para mejorar la reactividad pero sigue igual y solo me dicen que es ese el motivo. Pero eso no sucede con Interbank y Scotiabank. Solucione lo ya, INDECOPI deber铆a de oficio en salvaguarda de los usuarios accionar y as铆 como nos cobran los abusivos intereses al no pagar a tiempo, que tambi茅n se le sancione por no poder realizar transacciones con nuestro propio dinero.",not_applicable
1294,"Muy mala, la nueva interfaz se puede ver muy bonita, pero para que sirve eso si lo primordial, que es un buen funcionamiento de la aplicacion no se da y ahora que cambi茅 de celular de nuevo me pide ingresar los datos, me sale que hay un problema y me manda a la p谩gina del bcp. Espero que mejoren.",not_applicable
1295,No entiendo la raz贸n de que la app no sea compatible con mi equipo (Google Pixel 7). He tratado de reinstalar y reiniciar muchas veces pero sigue sin levantar la app. Imagino se debe a la 煤ltima actualizaci贸n de su appa pues hasta hace un par de semanas estuvo funcionando bien.,not_applicable
1296,"La app es responsable de un 20-30% del drenado de la bater铆a estando activa en 2do plano. As铆 est茅 cerrada y no la haya usado en varios d铆as o una semana, siempre aparece ese ranking ya sea en las 煤ltimas horas o 煤ltimos d铆as, seguida de otras con 1% o menos. He tenido que aplicar suspensi贸n profunda. Uso Samsung Galaxy S22 Ultra. Por favor corregir.",resistance
1297,"Realmente un desperdicio, con la anterior me resultaba bien todo era rapido y no tenia problemas, en la de ahora que se actualizo no se puede ingresar siempre sale OCURRIO UN ERROR, nunca se puede ingresar, cuando logras ingresar visualizas una nueva presentacion hay q buscar lo que quieres hacer, en la anterior todo estaba ala mano, muy mala esta actualizacion, solucionen esto lo antes posible, porq veo q no les intereza hay imnunerables reclamos y parece ser q no tienen intesion de solucionar,",not_applicable
1298,Mala actualisacion no me permite usar el token digital sale me pude actualisar fecha y hora la cual estan bien en mi dispoditivo. No me permite pagar por la app No me permite hacer transferencias a otros bancos. Solo lo uso para ver mi saldo . En realidad no se merece ni 1 estrella. Q mal equipo de desarrolladores tienen aprendan del scotiabank tiene una excelente aplicacion.,authenticity
1299,"P茅sima 硷 La app me dice que tengo bloqueada mi tarjeta y algo m谩s grave pasa,cuando intento quitar mi tarjeta anterior; La aplicaci贸n se cierra autom谩ticamente despu茅s de pulsar sobre el icono de la personita en la pantalla de INICIO DE LA APP.. tengo que decir que intente con otros m贸viles y es lo mismo.. la banca Telef贸nica no me da soluci贸n .. hice un reclamo y me dijeron que eso pas贸 con otros y no pueden hacer nada.. que espere硷 .. p茅sima.. p茅sima. ME CAMBIO A INTERBANK硷硷",authenticity
1300,"Desde hace 6 meses tengo problemas con la transferencia interbancaria, me repite el mensaje ""la sincronizaci贸n de tu token digital fall贸"", aunque mi token digital es visible, he realizado las indicaciones que me dieron los operadores del banco, he instalado y vuelto a instalar la app y sigo con el mismo problema, en el banco me dijeron que llame al n煤mero de atenci贸n, me vuelven a dar las mismas indicaciones, sin embargo, no corrigen el problema a煤n.",authenticity
