id,comentario,etiqueta
1675,"No entiendo c贸mo el BCP actualiza su aplicativo sin hacer las pruebas necesarias, es casi imposible entrar su nuevo aplicativo, es muy lento y tiene muchos errores para cargar.. la anterior era mucho m谩s r谩pida y m谩s amigable.",not_applicable
1676,"Me da c贸lera es la 6 vez que instalo la app, desde la 煤ltima actualizaci贸n, no puedo entrar a la app, despu茅s de aceptar la ubicaci贸n y todo, se sale de la app, puedes arreglarlo?, literal no puedo hacer ning煤n. Moov.",not_applicable
1677,"Tuve que desinstalar la aplicaci贸n ya que no pod铆a actualizarla. Y ahora resulta que no ke deja instalar. Y tengo suficiente espacio en mi celular, as铆 que ese no es el inconveniente. Pido que solucionen lo antes posible este error en su app. Porque utilizo la aplicaci贸n a diario y esto me perjudica.",not_applicable
1678,"La nueva actualizaci贸n no funciona, est谩 s煤per mal, no me deja transferir y hasta tiene problemas con cargar el teclado virtual. Despidan a la empresa que les actualizo porque antes funcionaba genial. Ahora es la peor aplicaci贸n de banco, un asco total.",not_applicable
1679,"Falta atajos. He actualizado app 1 de junio, esta demasiado LENTO! Han agregado imagen din谩mica, y lo hace robusto y pesado... Demora en aparecer el tablero de clave y tambi茅n demora ""leyendo"" la clave. Y para abrir las cuentas y cr茅ditos sale mensaje ""OCURRI UN ERROR.."" CORRIJAN o mejor lo desinstalo!!!",not_applicable
1680,"pesima aplicaci贸n casi siempre al momento de iniciar me aparece la ventanita: ""uy parece que ocurrio un problema"". incluso otras ocasiones ni se puede iniciar la aplicacion, deberian mejorar ese aspecto y muchas otras con respecto a las operaciones de la misma aplicaci贸n. decepcionante.",not_applicable
1681,"Antes de la actualizaci贸n la app me permit铆a poder transferir en cualquier momento, pero desde hace un mes no me lo permite, es inc贸modo ver el mensaje de "" ocurri贸 un error ingresa nuevamente a consultar tus saldos"" y verificar que te hayan realizado el extorno. Arreglenlo",integrity
1682,"Deberian mejorar el proceso de actualizacion de la app, y dejar que se siga usando hasta que uno acepte actualizar y porfavor no nieguen el acceso de la app solo para actualizar (palma de la mano en la frente con gesto de aaaash) hay muchos casos donde no permite que la descarga se complete al 100% inviertan un poquito mas soles en su app que no les ara da帽o asi mejoran la experiencia de uso a todos.",not_applicable
1683,"Una app inservible que con cada actualizaci贸n,en vez de mejorar el rendimiento y la interfaz, empeora todo culpando a la versi贸n del android cuando antes funcionaba normalmente. Puntaje 1",not_applicable
1684,"Que paso BCP, est谩 un desastre tu aplicaci贸n. Antes todo funcionba excelente. Ahora: Se cierra. Aparece error constantemente. Va demasiado lento, etc. Solucionen para evitar inconvenientes con los clientes, porfavor",not_applicable
1685,"Que desgracia de Aplicaci贸n BCP, MAL  Se帽ores BCP, cometieron un error tremendo con la nueva App, No Funciona, no carga, se cierra sola, la anterior interfaz era mejor, al menos se pod铆a terminar la transacci贸n, un par de veces se cerr贸 sin poder capturar la transferencia. Pero esta nueva no ayuda para nada.=(",non_repudiation
1686,"Es horrible me da rabia cada vez que entro a la aplicaci贸n no abre hay que reiniciar el tel茅fono o apagarlo y prenderlo nuevamente para volver entrar, si uno quisiera hacer una transferencia de urgencia no sirve para nada, por m谩s que lo actualice sigue igual ojal谩 puedan hacer algo lo m谩s r谩pido posible como pueden dar un servicio de esa forma a sus clientes y siendo una empresa muy grande o la m谩s grande en el Per煤 en cuanto bancos, la aplicaci贸n anterior era 100% mejor que esta no se que pas贸",not_applicable
1687,Pens茅 que era el 煤nico usuario y cliente con el problema de la app...pero veo que soy uno m谩s del mont贸n que tiene la misma situaci贸n...necesito que la reparen. Eso evita que vayamos a los bancos a hacer pagos de nuestras tarjetas. Exijo una soluci贸n pronta ...nuestra fecha de facturaci贸n esta pronto.,not_applicable
1688,"La actualizaci贸n es muy muy mala, demasiado pesada para el internet en estos tiempos, si quiero realizar una operaci贸n tengo que intentarlo entre 10 o 20 veces, y siempre sale mensaje de error o intenta en 5 minutos, el dise帽o anterior era m谩s simple y adecuado para tiempos como estos en los que el internet est谩 saturado, este es la peor experiencia",not_applicable
1689,"Su aplicativo NO SIRVE para ver movimiento de mas de 15 d铆as. Su filtro NO FUNCIONA desde que lo instal茅. Estoy leyendo que tienen varias quejas al respecto 驴por qu茅 no hacen NADA? el error no es m铆o sino del aplicativo, el de mis parientes y conocidos est谩 con el mismo problema 隆ARRGLENLO! PD: No tengo Facebook porque es basura progre.",accountability
1690,"La aplicaci贸n es un desastre total, para ingresar y crear mi contrase帽a me indica muchos pasos, sigo cada uno de ello hasta llegar al final y cuando espero para la confirmaci贸n, me sale ""error"" y me manda de nuevo al inicio. Nisiquiera puedo ingresar, si tengo problemas tan solo para iniciar sesi贸n en mi cuenta no quiero imaginar que fallas m谩s tendr谩 esta aplicaci贸n.",authenticity
1691,"Muy mal, no puedo usar la aplicaci贸n por incompatibilidad con el sistema operativo y tengo Android 7.0, y su web me pide token digital que estaba en la App, Perjudican a muchos usuarios con sus actualizaciones. No les pondr铆a ni una estrella.",authenticity
1692,"Desde hace 5 d铆as no puedo ingresar al aplicativo.. Me sale un mensaje que dice: ""Por tu seguridad retira los privilegios y modificaciones en el sistema operativo"". Y yo no he cambiado nada... De la nada se borr贸 el 铆cono de acceso de la pantalla de mi celular... Muy mala actualizaci贸n de la aplicaci贸n.....",authenticity
1693,"Como rayos van a cambiar la confirmaci贸n de mis transferencias a token en f铆sico, si mi cuenta la abr铆 cuando se dej贸 de usar y todo era digital. Ahora una perdida de tiempo ir al banco a ver como solucionan su burrada. P茅sima actualizaci贸n!!!!",authenticity
1694,"Le pongo 1 porque siempre pide actualizaci贸n, pero cuando quieres abrir el apps se cuelga, sale cargando, uno no puede hacer transferencias. En otros bancos es al toque este proceso pero en bcp ya voy 1 a帽o y no hay soluciones. Es lamentable donde esta su soporte t茅cnico para nosotros los usuarios.",not_applicable
1695,"Desde hace varios d铆as no funciona el app y lo mismo se repite la p谩gina web, lo peor de todo es que ni siquiera sacan alg煤n comunicado en su p谩gina para indicar que est谩 pasando y cuando estar谩 operativo. En otras entidades bancarias no pasa esto. Lamentable soporte de sus 谩reas de TI",accountability
1696,"Por el momento dejar茅 en 2 estrellas, hace tiempo que uso la app y nunca le vi fallos, hoy quise hacer una transferencia y se cerr贸, para los desarrolladores o programadores no hay receso de trabajo deber铆an de arreglar esto al ser una app tan uitilizada.",not_applicable
1697,"No s茅 exactamente qu茅 est谩 pasando, pero la aplicaci贸n est谩 teniendo un terrible funcionamiento, desde hace varios d铆as que presenta inconvenientes, no puedo realizar pagos, se cuelga la aplicaci贸n, no puedo ni usar el Yape para cumplir mis obligaciones, pero requiero de urgencia, deben de solucionar estos problemas lo m谩s pronto posible, representa un inconveniente muy molesto para nosotros los usuarios, o en todo caso comunicarnos que su dichosa aplicaci贸n no va a funcionar. No puedo cumplir",not_applicable
1698,"Cada vez que hacen su actualizaci贸n, no permiten ingresar para realizar operaciones o si ya est谩 la app actualizada, por las puras te pide actualizar y no te deja ingresar, arreglen su app. Otra vez su app que intento volver a instalar para que al final no me permita descargarlo. Ni actualizar se puede.",not_applicable
1699,"Con la nueva actualizaci贸n se ha vuelto una pesadilla hacer transferencia o realizar algunos pagos, surgieron varios problemas que antes no me aparec铆an, la nueva interfaz me resulta innecesaria era mejor la antigua y m谩s sencilla.",not_applicable
1700,"Definitivamente es la peor app de banca m贸vil, e trabajado con otros banco y esta es la peor de todas.... A cada rato se va el sistema y no deja hacer las opciones necesarias, para hacer transferencia te piden reconocimiento f谩cial y en el momento de hacerlo la aplicaci贸n te hace una serie de p茅rdida de tiempo alejando y hacercando la c谩mara. Definitivamente no la volver茅 a usar, est谩 app no merece ni una estrella",authenticity
