2082,"La aplicacion no me funciona correctamemte desde hace unos dias y el dia de hoy necesito sacar efectivo sin tarjeta y ni por el app ni por la pagina. (Actualización)La aplicación había mejorada pero con los últimos meses va de mal en peor ya la verdad estoy a solo un paso de ya no utilizarla y con la última actualización está peor todavía, retirar o guardar en la alcancía es un problema y no sé te ocurra pagar un taxi con plin en la madrugada porque la pasarás muy mal, todo mal.",not_applicable
2083,Pide actualizar a cada rato llenando la memoria,not_applicable
2084,"Luego de la última actualización, se cierra sola la app luego de realizar un pago de servicio o etc etc. Ni bien me acepta el pago, a los segundos se cierra la app, no se puede ver el recibo del mismo. Luego los consumos no SE VEN AL MOMENTO... tiene q pasar horas o hasta días para poder visualizar por la app",accountability
2085,"Siempre se raya la aplicación para hacer pagos o si salgo un rato de la app, se cierra automáticamente. Qué pésimo servicio. Edit: la nueva actualización no me permite usar plin: ""Estamos teniendo un invomveniente"" a cada rato me sale esa frase. Terrible.",not_applicable
2086,"Esta actualización, se supone que es para mejorar el App y sus funciones. Sin embargo, es todo lo contrario, tengo que estar desinstalando e instalado constantemente para tener activa mi cuenta. He ido al banco y dicen que es ""normal"", lo que está pasando. Si no hay solución, tendré que optar por otra entidad.",not_applicable
2087,"Cada vez que quiero realizar un plin colocando el número de celular, el app se cierra solo en automático, ni siquiera me deja colocar los datos y hago el procedimiento por más de 5 veces, es bastante molesto. La actualización en el modelo Huawei no funciona bien y eso que ya desinstalé y volví a instalar el app pero nada, sigue igual con la falla",not_applicable
2088,"Otra vez se desconfigura todo. Ni acceder se puede. Cuándo van a solucionar el problema de los accesos? Actualización. Después de 6 meses, sigue siendo un fiasco. No puedo ingresar aún. Sale error al ingresar y que están solucionando el problema.",authenticity
2089,"Después de lo del hakeo masivo que sufrió, esta app dejó de ser eficiente, es lenta. No envía clave token,no te permite ver información de movimientos más allá de 1 mes, hoy domingo se le dio por no permitir ingreso. Nefasto no poder contar con tu dinero en cualquier momento...",authenticity
2090,"Verdadera desgracia. Antes era mejor, ahora suelen haber fines de semana enteros en que no se puede entrar. Si quieres hacer pagos por plin o transferencias no es una app confiable porque no se sabe cuando estará bien y cuando estará en ""mantenimiento"".",not_applicable
2091,"Yo me la descargue para saber mi sueldo y cuanto gasto cuando uso mi tarjeta. Sin embargo no me aparece al instante ni en un dia despues. Se demora mas de 5 dias para que me aparezca mis gastos y mis ingresos! Por ello, perdi una oferta de compra ya que no sabia cuanto me cobraron por que estaba en dolares y tuve que cancelar. Y en serio estoy muy enojada por eso.",accountability
2092,Mi aplicación es buena pero el problema que tiene al menos en mi caso es que VISA Me hace los depósitos a una cuenta que tengo pero resulta que cuando llamó avisa dice que me han hecho los depósitos pero no figura en mi cuenta de ahorros Y cuando llamó a interbank demora en contestar y cuando contesta la operadora lo deja a 1 en espera durante horas y Nunca contestan,accountability
2093,"Pésima, llevo 3 días queriendo transferir dinero y no lo puedo hacer porque nunca llega la clave dinámica 😌",authenticity
2094,"La aplicación,viene fallando una y otra vez. Dice error está en mantenimiento; la instalo, desinstalo; borro el caché de la memoria, y ni así funciona; realmente es incómodo porque uno tiene que estar ingresando a la web, cuando realmente la banca digital debe ser V 5.0, no V 0.5",not_applicable
2095,"Pésimo servicio siempre está en mantenimiento o está solucionado un problema cuando uno necesita plinear o recargar, siempre está dando problemas de verdad que a veces uno solo se estresa con este banco, si uno necesita hacer algo rápido y urgente no funciona, dique solucionando un problema que en realidad nunca solucionan",not_applicable
2096,"Pésima actualización, ahora pide activar la clave dinámica con reconocimiento facial, el cual no reconoce ninguna foto y creo que no soy el único con el problema no se cómo es posible una app tan importante llegar a tardar mucho en solucionar este error de la app. Deja mucho de que hablar del banco 🏦.",authenticity
2097,"La peor experiencia! No permite guardar datos de tarjeta y tengo que estar escribiendo cada vez que quiero ingresar, se vuelve lento y cierra pamtalla antes de terminar de transferir y demasiados pasos para hacer transferencias , pagos o ahorro",not_applicable
2098,"¡DEMORA EN LA ATENCIÓN! Y realizan cobros indebidos qué no se registran en la app o en la boleta de importe de cajeros, hay muy poca transparencia en la información cuando cobran ""comisiones"" incluso parece un robo, hasta ahorita no atienden mi reclamo.",accountability
2099,"Desde hace tres días no puedo hacer ninguna operación a través de esta aplicación, siempre sale la notificación de ""estamos trabajando para solucionar este inconveniente"", aparte de ser lenta, se están demorando mucho en solucionar ese problema lo que está volviendo a la app inservible:)",not_applicable
2100,Es útil pero aún tiene deficiencias. Deberían aparecer los movimientos bancarios con más detalles en fecha y hora a veces aparecen después de un mes y encima no se detalla la información. Y cuando pagas se ve falta de dinero pero no sé ve el informe que has pagado... Lleva meses así. Arreglen eso por favor!,accountability
2101,"Esta fallando desde ayer. Y no ofrecen una solución. Nisiquera responden los números de ayuda. Y la banca de Internet brilla por la falta de información para solucionar esto. Después todo lo demás funciona bien. Pero les falta más empatía en como arreglar ""problemas"".",not_applicable
