ID,Comentario,Clasificacion_ISO_25010_2023,Justificacion
1001,"La app está inservible hace ya 2 semanas, es increíble que uno de los bancos más grandes del Perú tenga un servicio tan pésimo con una de sus aplicaciones principales. Reportes tras reportes de errores de parte de sus usuarios (la mayoría reportando lo mismo) y lo único que dicen es envíenos por FB la captura del error. P. madre. Resuelvan el problema ya!",not_applicable,"2 semanas inservible - banco más grande Perú servicio pésimo"
1002,"La descargue para juntar dinero por una causa, la cuenta que tengo no esta asociada con ninguna tarjeta, al inicio podía yapear normal a mis contactos, ahora después de una semana, no me deja yapear absolutamente nada, y me sale que es error de tu banco. Quiero una solución ahora, ese dinero no se puede quedar ahí.",accountability,"Dinero para causa bloqueado - no puede quedar ahí"
1003,"Entre a yape a validar unos pagos y sale error al abrir . Lo desinstale y lo instale otra vez y seguía el problema. Probé en otro equipo que tiene yape y estaba con el mismo mensaje, parece que o hay sistema Deberían te de mensajes claros para no tener que desinsrale e instalar otra vez. No es la primera vez que yape no indica y te hace ir L banco o desinflamar",not_applicable,"Error múltiples equipos - sistema caído sin mensajes claros"
1004,"Probé la app para poder recargar una línea móvil, pero me doy con la sorpresa de que no puedo recargar el dichoso yape a menos que alguien que tenga saldo me transfiera el monto que necesito. Entonces si no conozco a nadie que use yape nunca podré recargarlo. No tiene sentido ese procedimiento, más rápido sería ir a un cajero o agente y recargarlo ahí, en fin nunca llegaré a usarlo",not_applicable,"Sistema circular: necesita YAPE para recargar YAPE"
1005,"Estos dos últimos días he tratado de ingresar a yape pero no me deja, me sale error. He visto que los demás yape si funcionan, pero el mío nada. Ya hice de todo pero aún no me deja ni siquiera crear otra cuenta. Me sale ¡Ups algo salió mal! Cierra la aplicación y todo ello, pero al final nada.",not_applicable,"2 días sin acceso - otros funcionan pero el suyo no"
1006,"Muy mala desde su actualización a la hora de renovar o crear cuenta no reconoce el rostro para nada... Y por más que lo vuelves a intentar dice ""reconocimiento fallido"" cuando soy yo.... debería ser suficiente con el reconocimiento del dni.... Se ha vuelto un problema no puedo tener una cuenta hasta ahora!!!",authenticity,"Reconocimiento facial fallido sistemático - no reconoce usuario real"
1007,"Intento instalar la app, y me bloquean la cuenta solo por un error, en lugar de votación hace 3 años, y dicen vuelve intentar en 24 horas, creo que deben hacer más simple el procedimiento y si se equivocan volver a intentar, no ahí mismo bloquear, me parece adsurdo, solo complican las cosas, espero que Yape, pueda tener en cuenta estás cosas, ahora tengo que esperar 24 horas otra ves para registrar, que pasa si la memoria falla y dígito mal?? Otra ves 24 horas esperar?? No me parece justo.",authenticity,"Bloqueo 24h por error - sistema punitivo desproporcionado"
1008,"A veces funciona bien y otras por nada, dejándote mal en las bodegas o comercios que deseas comprar...ahora me he pasado como 2 horas en transferir un poco de dinero a otra persona y ahora me dice "" esta opción no está disponible, pero puede seguir usando YAPE mientras se soluciona"".. .y que otra miércoles opción tengo para usar Yape , si la App, no funciona?????",not_applicable,"2 horas transferir dinero - opción no disponible pero siga usando"
1009,"Desde hace más de una semana tengo el problema de que demora en cargar demasiado para poder ingresar a mi cuenta. La pantalla se queda morada y tengo que esperar varios minutos antes que aparezca los números para insertar mi código, ya instalé y desinstale la aplicación más de dos veces y continua el problema",authenticity,"Más de 1 semana pantalla morada - números tardan minutos"
1010,"No puedo ni siquiera usarla después de rellenar el dichoso formulario no me deja entrar y sale ""de produjo un problema ""error, vuelve a intentarlo más tarde"" y ya llevo así 3 días dónde ni siquiera llegó a entrar a la app , que fastidio . Mejoren ese problema y cambiaré mi calificación hasta el momento no anda nada bien",not_applicable,"3 días sin poder entrar tras completar formulario"
1011,"Intente poner otro número de tarjeta y da error. Eso es en todos los casos. E imagino a todos les pasa lo mismo, solo acepta BCP cual es el chiste asi. Hacen mucha publicidad para que la descarguemos pero no cumplen lo que dicen. Mis clientes aparte de ser solo del BCP se les complica crear una cuenta y encima no me pueden pagar ya que no hacepta sus tarjetas. Antes de lamzarla la aplicación deberían solucionar los problemas no creen?",not_applicable,"Solo acepta BCP - publicidad engañosa otros bancos"
1012,"Lean esto!! Cuidado con aceptar y yapear a las (promociones) por qué si es en comida muchas veces están al mismo precio que pagarlas sin esta.en cuanto recargas para Cabify , juegos y seguro otras cosas está app no se hace responsable si la recarga no llego sino que te dicen ya te dimos el codigo y ya es la culpa de Cabify , del juego en cuestion oh los productos que pidió... Y claro el bot lo entretiene por 3 horas con lo mismo. suerte si le solucionan, solo usen para pagar y cobrar suerte.",integrity,"No se responsabiliza recargas fallidas - 3h bot entretenimiento"
1013,"Buenas noches, vengo hacer mi reclamo sobre la app yape, que no puedo ingresar me aparece acceso bloqueado  en el mensenger de yape me dice que tiene que llamar al número de BCP, llame al número y aparece la opción yape en cuál me dice que tiene que ingresar a la página se yape en la opción ayuda, eh ingresado y me dice que cualquier otra duda ingrese al messenger, perdida total de tiempo. En el cual me dicen que cambie de número, le pregunto el motivo, y solo me dice por seguridad.",accountability,"Acceso bloqueado - círculo vicioso atención sin solución"
1014,"en los ultimos 15 dias me paso que los cliente tratan de pagar de plin a yape, y pese a que me muestran captura de pantalla y se les descuenta de su saldo, a mi noe llega nada, y es un problema ya que aveces tantos mis clientes estan apurados y se supone que las transacciones son rapidas, ellos luego tienen que estar llamando a su banco para verificar porque se les descuenta y no se efectua la operacion. en fin una perdida de 1 hora, disguste del cliente e incertidumbre de que me llegue el pago.",integrity,"15 días Plin→YAPE: descuenta pero no llega - clientes apurados"
1015,"Me cambie a otra app porque, tengo 9 meses tratando de recuperar mi yape, ya que cambie de número y nadie me ha podido solucionar, no por facebook, no en la pagina oficial, ni en la agencia de forma presencial, ni vía telefónica. Puse un reclamo y hace 2 o 3 meses y eso quedó ahí, nadie me contactó y nadie me ha podido solucionar.",accountability,"9 meses sin solución cambio número - migró otra app"
1016,"Pésimo, tuve un problema al momento de yapear dentro de la aplicación y hasta ahora no me devuelven mi dinero , lo han hecho pasar como que yo he yapeado a un conocido y a esa persona no le ha llegado nada , eso recién me entero porque reclame , por que si no jamás me mandaban el correo , siendo sincera funcionaba pero cuando ocurre problemas así no dan solución, no me lo volvería a descargar , no es seguro, no ofrecen solución rápidas y se olvidan de contestar",integrity,"Yapeo no llega pero lo hacen pasar como realizado"
1017,"Queja N°2: esta es la segunda o tercera vez que Yape me dice ""Hemos tenido inconvenientes con uno de los bancos"" o cosas así, y no he podido Yapear y me pueden Yapear, tampoco puedo ver mi Saldo ni nada por el estilo. Estoy disgustado. BN. No sé qué le pasa a la Aplicación, 😡 la he actualizado, he borrado datos, reiniciado el celular, y no puedo Yapear nada a Nadie. ""ocurrido un error, intente más tarde"", siempre me sale eso.... Solucionen eso, un Mes esperando que lo arreglen y nada!.",not_applicable,"1 mes esperando arreglen - 2da o 3ra vez mismo problema"
1018,"Soy usuario constante mejor dicho era!!! Usuario constante de yape he decidido dejar de usarlo porque al realizar transferencia de daba error me debitaban el dinero del banco y no me aparecía el movimiento ni en mi yape ni en el yape destinatario y luego tenía que hacer una serie de reclamos y esperar de 2 a 3 días para la reposición del dinero... Y yo tenía que pagar en el momento y por culpa de eso tuve varios problemas... Así que fue bonito mientras sirvió... En su momento fue buena.",integrity,"Ex-usuario: débito sin movimiento + 2-3 días reposición"
1019,"Una decepción, he intentado afiliar con mi tarjeta visa desde hace semanas y siempre dejan un mismo mensaje sin intentar dar una solución. "Problemas de verificación" "vuelva a intentarlo en 24 horas", "vuelva intentarlo en 48 horas" o "los datos no están en vigencia" ¿cuáles? si mis documentos están en vigencia y a la fecha. Ahora por todos esos intentos de querer verificar, ya "excedí" la cantidad de intentos y ahora no se puede afiliar a una cuenta que ni siquiera me dejaron crear.",authenticity,"Semanas afiliar Visa: 24h→48h→excedió intentos sin crear cuenta"
1020,"Como sugerencia se podría mejorar la aplicación implementando un sistema que cuando se realice la transferencia por yape, el dinero quede en el banco como saldo contable en la cuenta del usuario que recibe el yape y el dinero puede ser liberado cuando el usuario que realizó el yape y la compra de algún producto dé conformidad y aprobación que el producto que compro le llegó perfectamente y en buen estado, y así se podría evitar muchas estafas y muchos reclamos contra el propio banco.",not_applicable,"Sugerencia sistema escrow anti-estafas"
1021,"Todo iba bien con la aplicación hasta hace un par de días atrás que ya no puedo ingresar a la app con datos porque me aparece UPS! Hubo un error, cierre la app o inténtelo nuevamente. Al principio pensé que era por un tema de la red del operador, pero luego me di cuenta que solo se puede ingresar con wifi y eso se me hace muy complicado y fastidioso, espero solucionen esto lo más antes posible, gracias",not_applicable,"Solo funciona WiFi - datos móviles bloqueados"
1022,"Funcionaba bien la app hasta que cambie de telefono, cambie a un Huawei P8 y siempre se quedaba en cargando al momento de querer poner mi clave de usuario. Siempre se queda alli y no me da razon de porque no llega a ponerse siquiera el teclado del telefono. Prefiero mil veces ir hasta el mismo banco a depositar.",authenticity,"Huawei P8: carga infinita al poner clave - prefiere banco"
1023,"kisiera k arreglen el apartado de gaming donde recargos para nuestros videojuegos ya k cuando entro allí solo m sale una pantalla blanca o morada, el problema ya está varios dias y no m deja entrar a recargar y ps kisiera k lo solucionen pronto. Todo lo demás está bien.",not_applicable,"Varios días gaming pantalla blanca/morada - no recarga"
1024,"Esta app no sirve. Ya llevo 2 dias intentandolo y dice que espere unos cinco minutos. Incluso, he actualizado la aplicacion y nada. Y, lo peor de todo. Estamos 27 de agosto, y recien me descuentan un monto del 22 de julio. En mi estado de cuenta, aparece el descuento, pero ahora me vuelven a descontar. Escándalo.",integrity,"2 días 5 minutos + descuento doble: julio y agosto mismo monto"
1025,"Esta aplicación no brinda un soporte, no dan respuesta de ningún tipo y no tiene sentido ni molestarse por eso solamente no pierdan su tiempo descargando busquen otra app. como bien se comenta si llegas a perder las credenciales por cualquier motivo o cambias de teléfono caerás como todos los que comentan aquí. APLICACIÓN SIN SOPORTE Y SIN AUTOGESTIÓN. SUERTE PARA EL QUE SE ATREVA A DESCARGAR.",not_applicable,"Sin soporte ni autogestión - no descargar"
1026,"lenta,falla imprevista y frecuente,función muy irregular",not_applicable,"Lenta + fallas imprevistas frecuentes"
1027,"Se que la app ayuda mucho para los pagos, es por ello que me anime a instalarlo. Pude registrar mis datos y todo, pero me salio un mensaje que tenia que llenar un formulario, intente hacerlo pero me sale el sgte mensaje, ""Ups se ha producido un error, vuelva a intentarlo más tarde"" y llevo más de 2 días intentando ingresar y no puedo. Mi calificación cambiará cuando el problema se solucione para todos los que tenemos este inconveniente. :D",not_applicable,"Más de 2 días sin llenar formulario post-registro"
1028,"Lleven un buen control antes y después de girar dinero. yape se quedó con 500 soles míos",integrity,"YAPE se quedó con 500 soles"
1029,"Acabo de volver a instalarlo, ya tengo yo una cuenta, lo pongo y me sale qk habido un error y que están solucionando que en unos minutos vuelva, pasa media hora y lo vuelvo a intentar y me sale igual, no puedo ingresar mi cuenta y mucho menos crear una cuenta nuevo xk me sale q habido un error, arreglen esto por favor llevo 3 días con el mismo problema por favor solucionando rapido",not_applicable,"3 días mismo error - no ingresa cuenta ni crea nueva"
1030,"En la actualidad que vivimos se busca tener una alternativa segura alterna a una cuenta de ahorros y a la tarjeta de crédito, para eso es factible una cuenta yape solo con DNI para no tenerlo vinculado a lo antes mencionado. Lo malo es que no se han preocupado por que se pueda realizar la recarga deel yape con DNI desde la página web de cada banco. Es engorroso ir a un cajero sacar dinero e ir a otra persona a pagarle para que recargue el yape propio.",not_applicable,"YAPE DNI sin recarga web bancos - proceso engorroso"
1031,"Muy mal BCP demora en instalar el aplicativo ya tengo mas de doce horas y nada de nada por otro lado la mayoría de usuarios presenta casi el mismo problema y ustedes piden mas información, si el problema es en general recurrente por q piden información por interno? Ya esto mas parece burla q otra cosa. Sean más serios por favor y solucionen el problema.",not_applicable,"Más de 12 horas instalando - problema general burla"
1032,"Ya van dos veces que mi dinero se desaparece, mi problema es que, a la hora de yapear, me salio un error, y cuando cerré y volví abrir el yape mi saldo había desaparecido, pero no había nada de transacciones.... En mi historial, prácticamente mi dinero se desapareció, y eso es muy mal 😡😡",integrity,"2da vez dinero desaparece tras error yapeo sin transacciones"
1033,"Es una buena aplicación pero pasada la media noche ya no se puede usar. Tengo un negocio y muchos clientes evitan pagar con efectivo, es una desgracia que una aplicación de un banco con tanto tiempo funcionando tenga un problema tan tonto. Vi quejas por este tema desde el año pasado y hasta el día de hoy 22 de Feb 2024 NO LO SOLUCIONAN. Se la pasan promocionando su aplicación pero tienen este problema tan nefasto que simplemente no quieren solucionar. Pésimo",not_applicable,"Post-medianoche no funciona - problema desde año pasado"
1034,"Últimamente está fallando mucho, desde la última actualización, al momento de yapear según la aplicación no responde y se debería intentar después, sucede lo mismo que veo en otros comentarios que al intentar reiteradas veces, al instante no responde pero después aparece el yapeo en 2 o 3 ocaciones. Y genera mucha incomodidad, e inclusive perdida del dinero. Esta empezando a desagradar la experiencia con la aplicación. A mejorar y mucho",integrity,"Yapeos múltiples: aparece 2-3 veces tras intentos"
1035,"No uso mucho la app pero todo iba de maravilla, hasta hace unos días que quise yapear y no me dejaba porque supuestamente tenía permisos de administrador cuando no es así. Instalé otra ROM con android 11 pero tampoco funciona. Pésima app, dejó de funcionar de la noche a la mañana. Volví. En efecto, el problema es la compatibilidad con el Android 11. Yape sería bueno que arregles la app para que sea compatible con Android 11.",not_applicable,"Android 11 incompatible - funciona día deja noche"
1036,"Desde el 23 de Julio, el app viene fallando en mi diapositivo. Ya les escribí a sus canales de atención y su respuesta fue:""Es su sistema de su celular"" lo cual es imposible dado que mi celular tiene suficiente espacio y buen sistema operativo, ninguna otra app me falla, solo la del Yape. Espero una solución Inmediata.",not_applicable,"Desde 23 julio falla - echan culpa sistema celular"
1037,"Hola, desde hace tiempo no se puede usar yape, se supone que esta aplicación es para algo rapido y facil de usar, siempre sale TENEMOS PROBLEMAS,INTENTALO MAS TARDE, yo no quiero para mas tarde, quiero para ese mismo momento,es una perdida de tiempo, y muy peligroso, por tanto intento hasta me pueden robar el teléfono .",not_applicable,"Tiempo indefinido problemas - peligroso intentos robo celular"
1038,"No se puede abrir yape. No responde,a pesar que la he reinstalado hoy 7 de noviembre 2023. Esto ha pasado con la ultima actualizacion. Es un desastre. Tampoco la tienda oficial de yape en whatdapp se quedaron mudos,no atienden. Resuelvan este problema que sin duda es falla de su software. No es la primera vez!!! Con la ultima actualizacion el yape no funciona,no abre. Pude comprobar que esta app esta fallida,tiene error,de modo que aparece el mensaje de 'validando aplicacion 1 de 1 ' .",not_applicable,"Última actualización noviembre 2023 no abre + WhatsApp mudo"
1039,"Yape lo usó con banco de la nación y al comienzo funcionaba muy bien Y de un momento a otro salieron errores (o con el banco o con la plataforma) Pedía ayuda y lo solucionaban, lo malo es que luego me permitía un movimiento y después volvía a salir error. Mi dinero regresaba a los tres días, salía error y esperar otros tres días más. Desinstale y volví a instalar y no cambia nada. Por favor solucionenlo, esta idea de Aplicación es muy buena, no debe perderse por uno pequeños errores.",integrity,"Banco Nación: 1 movimiento→error→3 días espera cíclica"
1040,"Tuve problemas con la app, no había tenido este problema antes, me enviaron 100 soles y yo mande 50 normal, luego iba a mandar 50 más y me salió error con su banco y me mandó al inicio, luego el dinero ya no estaba, tampoco llegó al destinatario y mucho menos sale en el historial, el dinero no se puede simplemente desaparecer, les escribí al soporte de messenger y nunca se comunica el asesor, espero que brinden solución pronta. PÉSIMO SERVICIO.",integrity,"50 soles desaparecen sin llegar destinatario ni historial"
1041,"La porquería de aplicación no me deja entrar a cada rato ""error intenté en unos minutos"" ag!!!",not_applicable,"Cada rato error intenté en unos minutos"
1042,"Utilizaba seguido Yape para hacer pagos o para que me los hagan, era exelente para mí emprendimiento, pero hace más de un mes que ya no me funciona, cuando quiero realizar un yape ingreso los datos y al presionar yapear me sale ocurrió un inconveniente, inténtalo en unos minutos, y al momento de ver si saldo me sale lo mismo, así llevo intentando después como me dicen y sale lo mismo igual desintalandolo y volviendo a instalar y nada. Y a mi tampoco me pueden yapear otras personas.",not_applicable,"Más de 1 mes sin funcionar emprendimiento - otros no pueden yapear"
1043,"La aplicación no es nada mal solo que tiene defectos que merece ser actualizado ya que cuando sin querer borras la aplicación y luego lo vuelves a instalarla , te pide actualizar tu DNI y más que lo pones correcto en el centro , la aplicación al parece no lo reconoce y es más se pone erróneo y es mas te dicen que se te acabó el tiempo. Y es más por esa razón como que la aplicación no da gusto usarlo, espero que lo actualicen pronto",authenticity,"DNI puesto correcto pero app lo marca erróneo + tiempo acabado"
1044,"Eh estado viendo lo mismo que los comentarios y si , me pasa lo mismo desde hace como 2 semanas yape a tenido muchos problemas, quiero hacer un yapeo y me dice que ah ocurrido un problema y que lo intente en unos minutos , e desintalado la aplicación como 3 veces y nada , pensé que era mi teléfono , cambié de telefono y nada, sinceramente cuando comencé con esta aplicación me gustó muchísimo , era muy rápida y fácil de utilizar , era muy efectiva , pero ahora no .",not_applicable,"2 semanas problemas + cambió teléfono sin solución"
1045,"Esta app me a dejado una gran desconfianza ya hace un par de semanas que no abre por más que intente; no puedo ni siquiera reclamar, por otro lado es una estafa ya que tengo varios depósitos y no las puedo retirar exigo una solución, no se las recomiendo ya a muchos les está pasando y se quedan con nuestro dinero.",accountability,"Semanas sin abrir + depósitos no retira - estafa dinero"
1046,"Por motivos de fallas en abril eliminé la app y la volví a instalar, pero ha pasado un mes y el aplicativo no me deja ingresar, siempre me sale: ERROR, vuelva a intentarlo más tarde. He seguido al pie de la letra los instructivos de como tomar la foto y etc. que ponen allí, más nada sigue saliendo error o para colmo Yape no logro identificarte. Es desesperante y más cuando dice que puedes autenticar con otro método y al final sale reconocimiento facial, o sea lo mismo.",authenticity,"1 mes sin ingresar - facial único método pese a promesa otros"
1047,"Super nefasto la aplicación, me sale desde hace días que algo salió más y que lo intente más tarde. Entonces el banco me dará dinero, porq todo el tiempo que me hace perder, y aún no se corrige... Tanto millones que se mete y no puede solucionar un problema que ya tiene días... Desinstalé y volví a descargar y me sale el mismo problema.",not_applicable,"Días algo salió mal - millones ganados pero no solucionan"
1048,"Su plataforma es una porquería, llevo largo rato intentando enviar un monto y me hicieron el descuento pero no hay movimiento alguno. Les he enviado tres correos y me responden de manera automática invitándome a hablarles por Facebook. No utilizo esa plataforma, ¿por qué yo como usuario debo supeditarme a sus preferencias? ¿No pueden ser un poco más amables y responderme el correo? Esto me resulta una burla, no lo recomiendo, presenta de manera constante problemas de conexión y cero consideración por el usuario.",integrity,"Descuento sin movimiento + solo atienden Facebook forzado"
1049,"Ocurrió un inconveniente, inténtelo más tarde... Es el mensaje que aparece y no me permite ingresar al app; he desinstalado y vuelto a instalar varias veces, pero el mismo mensaje recurrente vuelve aparecer. Ya me cansé de instalarlo para ingresar porque es la única vez que funciona y luego después vuelve a lo mismo.",not_applicable,"Solo funciona 1 vez tras reinstalar luego falla"
1050,"No lo recomiendo... hace unos días intenté hacer un pago de 34 soles en una tienda y como salía error y en ese momento figuraba mi saldo bueno cambien mi forma de pago a efectivo... días despues cuando entro de nuevo a hacer un pago me doy con la sorpresa que no dispongo de ese monto y no figura en los movimientos.... no recomiendo esta aplicación es un robo",integrity,"34 soles desaparecen sin figurar movimientos - robo"
1051,"La última actualización dejo al celular de mi esposa fuera de la aplicación, no deberían excluir teléfonos antiguos, la mayoría de las personas no tiene dinero para comprar nuevos teléfonos y la idea es masificar la aplicación así que el tipo que hizo eso deberían despedirlo, y hacer que viva a ser compatible con teléfonos antiguos como la versión anterior. Muy molesto.",not_applicable,"Actualización excluye teléfonos antiguos - anti-masificación"
1052,"No puedo entrar a mi yape, está que falla la app, la desinstale y la volví a instalar pero nada sigue igual..",not_applicable,"Falla app pese a reinstalar"
1053,"La última actualización está pésima, primero que no puedo abrir el aplicativo y cuando lo consigo, me sale un mensaje que dice ""cargando datos"",y se queda ahí por mucho tiempo bloqueando para cualquier uso. Y eso que estoy cerca al wifi, no entiendo cual es la intención de el aplicativo, que solo use mis datos para que funcione? Y así gastar mas. Realmente que molestia, ya que tengo que trabajar a diario con el yape.",not_applicable,"Cargando datos infinito pese WiFi - fuerza gastar datos"
1054,"Problemas cuando actualización se instala con el táctil del móvil Ok he utilizado está aplicación sin ningún problema, pero luego de la última actualización me da un error con el táctil de mi celular , les cuento Marco los dígitos que me proporciona la aplicación pero me marca otro número Total tube que desinstalar la aplicación y esperate a que resuelvan el problema",authenticity,"Táctil marca números diferentes tras actualización"
1055,"Tengo más de 60 días en comunicación con los operadores de la plataforma y me dicen lamento la demora estamos solucinando tu problema. Problema que recibe en que eliminen la cuenta para poder ingresar de nuevo, tipifica el error que los datos ya son registrados para ingresar. NO SOY INGENIERO EN SISTEMAS, pero no creo que eso sea tan complicado de hacer. Más de 2 meses y nunca han dado respuesta. Se nota la falta de compromiso con los clientes y dicha app es para USO de los mismos.",accountability,"Más de 60 días sin eliminar cuenta - 2 meses sin respuesta"
