ID,Comentario,Clasificacion_ISO_25010_2023,Justificacion
101,"todo bien pero no s茅 q paso de la nada ahora sale q tengo 00/$ saldo solucionen el problema",integrity,"Saldo que aparece en 0 repentinamente sin causa aparente"
102,"no se puede instalar la app",not_applicable,"Problema de instalaci贸n"
103,"aplicaci贸n de mrd, necesariamente tengo que ser mayor?",not_applicable,"Molestia por restricci贸n de edad"
104,"Estaba yapeandole a alguien, y de pronto me apareci贸 un ""ocurri贸 un inconveniente, no te podemos mostrar tu salario"" detesto eso, me da la sensaci贸n de que mi dinero acabar谩 desaparecido. La 煤ltima se me perdi贸 una m铆nima de dinero, pero eso no deb铆a ocurrir.",integrity,"Error durante transacci贸n con antecedente de p茅rdida de dinero"
105,"ARREGLEN EL PROBLEMA DE YAPE POR LAS MADRUGADAS!!!!!!",not_applicable,"Fallas sistem谩ticas nocturnas"
106,"no me agarra la aplicaci贸n ",not_applicable,"Problema de acceso"
107,"deber铆an de crear cantidades de pago como de 5, 10, 20, 50 en su pantalla principal. y de hacer un segundo filtro antes q se realice el pago. c贸mo en el aplicativo del BCP para verificar los datos antes de yapear.",non_repudiation,"Solicitud de verificaci贸n adicional antes de pagos"
108,"no deja poner el n煤mero completo",not_applicable,"Problema de interfaz"
109,"ta mal optimizadoo",not_applicable,"Problema de optimizaci贸n"
110,"creo que no es buena aplicaci贸n...ya que ni me permite crear una cuenta",not_applicable,"Problema en creaci贸n de cuenta"
111,"Se cierra cuando entr贸 a ayuda y darle a el comercio no reconoce mi pago.",not_applicable,"Cierre de aplicaci贸n al buscar ayuda"
112,"Se desactiva el sonido de yape en mis 2 celulares",not_applicable,"Problema de notificaciones en m煤ltiples dispositivos"
113,"no se puede vincular ala cuenta de caja Huancayo",not_applicable,"Problema de vinculaci贸n bancaria"
114,"durante la noche la app para fallando y no permite realizar los pagos. causa malestar",not_applicable,"Fallas nocturnas sistem谩ticas"
115,"Buenos d铆as anoche me plinearon S/50.00 soles y al abrir hoy mi app de Yape solo hay S/1.73  a que se debio",integrity,"Recepci贸n de pago Plin pero saldo no refleja el monto correcto"
116,"muy buena",not_applicable,"Comentario positivo"
117,"no s贸lo desaparece saldos te dicen q en 72 horas el dinero de compras rechazadas estar谩 en t煤 cuenta no lo hacen as铆 es mal铆simo.",integrity,"Desaparici贸n de saldos y no devoluci贸n en plazo prometido"
118,"no puedo abrir mi cuenta con yape no sale el codigo",authenticity,"C贸digo de acceso que no aparece"
119,"ya pe no es para anuncios todo es negocio y admira como por un sistema monopolizan a la gente ya pe ahora es un servicio y es propagandas que l谩stima que se valgan de un servicio para engatusar a la gente",not_applicable,"Cr铆tica por exceso de publicidad"
120,"Bien",not_applicable,"Comentario positivo"
121,"muy lento",not_applicable,"Problema de rendimiento"
122,"la app es muy buena y facilita los pagos a terceros ..pero pienso que la privacidad es importante y esta app envia datos completos de la persona del negocio a el comprador..y esto abre una puerta a tus datos nombre completos para malas personas ..deberia haber una opcion para esconder datos y en su lugar configurar el due帽o del yape con una palabra clave .asi la privacidad se mantiene..",confidentiality,"Exposici贸n de datos completos del receptor comprometiendo privacidad"
123,"no permite pagar importes altos",not_applicable,"Limitaci贸n en montos de pago"
124,"siempre falla",not_applicable,"Fallas constantes"
125,"no suena notificaci贸n de yapeo",not_applicable,"Problema de notificaciones"
126,"que es muy bueno con el",not_applicable,"Comentario positivo"
127,"Aun no puedo usar la aplicaci贸n pero es muy buena e importante",not_applicable,"No puede usar pero opina positivamente"
128,"Primero esta muy buena, pero ahora quiero crear yape y no puedo, me sale n煤mero de celular ya se encuentra aprobado en otra cuenta, me ayudan",accountability,"N煤mero registrado en otra cuenta - problema de gesti贸n de cuentas"
129,"Desde ayer no puedo entrar esta que repite lo mismo Algo salio mal as铆 nomas esta que sale",not_applicable,"Error persistente de acceso"
130,"importante",not_applicable,"Comentario neutral"
131,"No me agrada que le hayan cambiado el tono de notificaci贸n cl谩sica que tiene, ahora suena como un timbre simple",not_applicable,"Molestia por cambio de notificaci贸n"
132,"dejen de actualizar no tengo memoria y no qero perder plata",not_applicable,"Temor a p茅rdida de dinero por actualizaciones"
133,"agregando paypal a yape tambi茅n para transferir dinero se paypal a yape o de yape a paypal.",not_applicable,"Sugerencia de funcionalidad"
134,"no permite compartir por WhatsApp los pagos",not_applicable,"Problema de funcionalidad de compartir"
135,"A alguien le ha pasado que cuando se instalan yape suena su notificaci贸n con una vocesita que dice yape y despu茅s ya no suena?. Ahora solo suena el sonido gen茅rico de notificacion. Mi consulta es como regresar el sonido original del yape",not_applicable,"P茅rdida de notificaci贸n caracter铆stica"
136,"no me deja usar yape a pesar que resete茅 mi celular 5 veces, que basuras",not_applicable,"Problema persistente pese a m煤ltiples resets"
137,"todo est谩 bien yo que uso continuo ningun prestamo otros que tienen el historial en rojo califican prefiero prex porque hasta prestamos dan y tambi茅n se puede yapear y planear y siempre hay promociones y descuentos al comprar.",not_applicable,"Comparaci贸n con competencia"
138,"la aplicacion esta bien pero lo que no me gusta es que cuando quiero iniciar sesi贸n en otro dispositivo no valida mi rostro aunque se vea nitida o sea igual al de la ultima ves, deberian arreglar ese problema.",authenticity,"Falla en reconocimiento facial al cambiar de dispositivo"
139,"no pued abrir l aplicaci贸n en mi zte v70",not_applicable,"Incompatibilidad con ZTE V70"
140,"Podr铆an agregar opciones de accesibilidad a la aplicaci贸n para cambiar el tama帽o de letras y la interfaz. etc Gracias",not_applicable,"Sugerencia de accesibilidad"
141,"me sale error mi yape",not_applicable,"Error general"
142,"Por qu茅 motivo Yape no acepta mi identidad? no logro obtener una cuenta Y demora en aceptar mi identidad facial, a qu茅 se debe el problema? necesito la App porque me dijeron que es muy 煤til.",authenticity,"Rechazo de identidad y demoras en verificaci贸n facial"
143,"no puedo acceder ala aplicaci贸n",not_applicable,"Problema de acceso"
144,"no suena el yape",not_applicable,"Problema de notificaciones"
145,"Porque ya no se puede recargar diamantes para el frefire?",not_applicable,"Problema con recargas de gaming"
146,"tengo un reclamo hace unos minutos me descontaron de mi yape 10 soles quiero que me ayuden",integrity,"Descuento no autorizado de 10 soles"
147,"No me gusta que se retrase en la notificaciones con los pagos",not_applicable,"Demora en notificaciones"
148,"estoy sin yape 8 d铆as ,cambie de operador y ahora no me llegan los msj de confirmaci贸n de yape ni del app BCP conatacte por Whatsapp a yape y dicen que tienen problemas para enviar los sms",authenticity,"8 d铆as sin acceso por falla en SMS tras cambio de operador"
149,"no puedo abrir mi yape no me deja poner la contrase帽a ni por 煤ltimo mi huella, se lajea",authenticity,"Falla en autenticaci贸n por contrase帽a y huella"
150,"la app tiene bastantes fallas, ya 2 recargas que no me llegan el saldo, arreglen su app por favor :)",integrity,"2 recargas sin recepci贸n de saldo"
151,"na ser铆a un 5 estrellas pero no se puede eliminar el historial, a menos de que lo elemines yo quiero que se borre como Google se pueda borrar algo del historial",confidentiality,"Imposibilidad de eliminar historial - problema de privacidad"
152,"porque mi yape no tiene la notificaci贸n yape",not_applicable,"Falta de notificaci贸n caracter铆stica"
153,"se queda cargando",not_applicable,"Problema de carga"
154,"buena bcp",not_applicable,"Comentario positivo"
155,"quiero ingresar a promo en yape y lo puedo se pone todo blanco",not_applicable,"Error en secci贸n de promociones"
156,"no puedo ingresar",not_applicable,"Problema de acceso"
157,"est谩 lento",not_applicable,"Problema de rendimiento"
158,"es muy lento para entrar, donde ses que me encuentre, que operador de telefon铆a me recomiendan uds. gracias",not_applicable,"Problema de velocidad de acceso"
159,"yape no me funciona nose que hacer no me deja ingresar nose que tiene la aplicaci贸n necesito que me ayuden",not_applicable,"Problema general de funcionamiento"
160,"la verdad me parece genial , pero acabo de tener un problema Desapareci贸 dinero solo sin yo hacer Alg煤n tipo de transferencia y le doy un 1",integrity,"Desaparici贸n de dinero sin realizar transferencias"
161,"No emtiendo porque crean un app que siempre falla en todas las madrugadas y en hora punta todav铆a m谩s 12 am y de 2 a 3 am.",not_applicable,"Fallas sistem谩ticas nocturnas y en horas punta"
162,"no puedo habrir mi app, estoy muy incomodo",not_applicable,"Problema de acceso"
163,"ULTIMAMENTE FALLA MUCHO EL SISTEMA DE LA APLICACIN",not_applicable,"Fallas sistem谩ticas recientes"
164,"Verg眉enza con su Pr茅stamo de Cr茅dito , Por eso 1 estrella",not_applicable,"Cr铆tica a servicios de cr茅dito"
165,"muy bueno",not_applicable,"Comentario positivo"
166,"Han eliminado las notificaciones de audio por yapeo? el popular YAPE?",not_applicable,"Consulta sobre eliminaci贸n de notificaci贸n caracter铆stica"
167,"Me disgusta que ahora se demoren en evaluar el cr茅dito, antes era mejor",not_applicable,"Demoras en evaluaci贸n crediticia"
168,"es muy 煤til y ahorrador.. gracias",not_applicable,"Comentario positivo"
169,"Gracias a Sunat nadie esta usando yape :)",not_applicable,"Comentario sobre impacto de regulaci贸n fiscal"
170,"no me deja ingresar el n煤mero completo c贸mo puedo hacerle",not_applicable,"Problema de interfaz"
171,"no quiero actualizar",not_applicable,"Resistencia a actualizaci贸n"
172,"mucha actualizaci贸n,ya da c贸lera y ensima te exigen Grrrr",not_applicable,"Molestia por frecuencia de actualizaciones"
173,"Por qu茅 le quitaron el sonido yape...",not_applicable,"P茅rdida de sonido caracter铆stico"
174,"no funciona",not_applicable,"Problema general de funcionamiento"
175,"las alertas no suenan ni por mas que le puse las del celular. Eso me decepciona :-(",not_applicable,"Falla en alertas pese a configuraci贸n"
176,"No sirve la funci贸n de activar compras por Internet ",not_applicable,"Falla en funcionalidad de compras en l铆nea"
177,"que esta pasando por q demora demasiado",not_applicable,"Problema de rendimiento"
178,"no deja hacer nada aparir de las 12 am",not_applicable,"Restricci贸n nocturna de funcionalidades"
179,"la app funciona bien pero cada vez que ingreso, me pide que active la ubicaci贸n por GPS. Tengo un celular Xiaomi",confidentiality,"Solicitud repetitiva de ubicaci贸n GPS"
180,"no habr茅 la aplicaci贸n en mi cel",not_applicable,"Problema de apertura"
181,"buenas",not_applicable,"Comentario neutral"
182,"e bien",not_applicable,"Comentario positivo"
183,"no puedo autenticar la verificaci贸n por rostro",authenticity,"Falla en autenticaci贸n facial"
184,"Sres de yape tengo un inconveniente al registrarme en yape AL ESCANEAR MI DNI LA APLICACIN NO LO ESCANEA , ME COMUNIQUE CON USTEDES AL WASAP QUE MENCIONAN E HICE LO QUE DIJERON Y NADA, SIGUE IGUAL Y AL FINAL SU ASESOR ME MANDO AL BCP DICIENDO QUE NO PUEDE HACER MS, MI mobil TIENE BUENA CALIDAD DE IMAGEN, el problema Es LA APP de PORQUERA ,TE PIDEN DE TODO, Y AL FINAL TE MANDAN A LA AGENCIA EN DONDE NO TE AYUDAN , y te dicen que tienes que abrir una cuenta BCP, eso no quiero , arreglen esto",authenticity,"Falla persistente en escaneo de DNI pese a soporte t茅cnico"
185,"Terrible aplicaci贸n perd铆 mi dinero cuando yapee",integrity,"P茅rdida de dinero durante transacci贸n"
186,"Quisiera tener yape pero como tengo 15 anos no puedo ingresar a la app hasta tener los 18 a帽os y me gustar铆a que bajen la edad para ingresar a yape,por favorス.",not_applicable,"Restricci贸n por edad"
187,"no s茅 actualiza f谩cil ,estoy un poco descontento",not_applicable,"Dificultad en actualizaci贸n"
188,"llevo d铆as que mi aplicaci贸n de yape no me funciona ...no s茅 qu茅 a que se debe si alguien me podr铆a ayudar",not_applicable,"Problema prolongado de funcionamiento"
189,"tengo m谩s de 300 megas en prepago y no me deja ingresar  para hacer mis recargas 驴 cu谩nto quieres 1 giga? ",not_applicable,"Problema de acceso pese a datos suficientes"
190,"bueno",not_applicable,"Comentario positivo"
191,"como activo el sonido yape ?",not_applicable,"Consulta sobre activaci贸n de sonido"
192,"no puedo abrir esta app",not_applicable,"Problema de apertura"
193,"Se pone lenta",not_applicable,"Problema de rendimiento"
194,"exele te",not_applicable,"Comentario positivo"
195,"muy buena",not_aplicable,"Comentario positivo"
196,"グググ",not_applicable,"Comentario positivo con emojis"
197,"A帽adan la opci贸n de editar el nombre, tambien ya no me suena la notificaci贸n de yape. Solucionen eso y para cuando el modo oscuro",not_applicable,"Sugerencias de funcionalidad y p茅rdida de notificaci贸n"
198,"p茅simo servicio desde la 煤ltima actualizaci贸n ... no me deja ingresar",not_applicable,"Problema de acceso tras actualizaci贸n"
199,"no puedo abrir el yape 0/0",not_applicable,"Problema de apertura"
200,"dicen que no se hacen responsables por los servicios de terceros que promocionan a pesar de lo pedimos que puedan ser y luego de las quejas todav铆a lo siguen promocionando.",accountability,"Falta de responsabilidad por servicios de terceros promocionados"
