comentario_id,contenido,clasificacion_seguridad,justificacion
2369,"Que pasa con esta app que cuando uno la necesita no se puede ingresar, ya se me ha bloqueado sola 2 veces y para colmo error en plin casi siempre. Uno necesita pagar algo y el plin no funciona eficientemente. Arreglenlo por favor!!! 😡",not_applicable,"Bloqueos automáticos y errores en PLIN sin aspectos específicos de seguridad"
2370,"Algo esta pasando con la app, siempre esta saliendo error y no deja hacer los pagos, si te llega un pago el dia domingo. Se guarda con fecha del día lunes. No debería, también es lenta.",integrity,"Fechas incorrectas en registro de pagos comprometen integridad temporal de transacciones"
2371,"Muchas veces no me deja ingresar, me dice que hubo un error que intente de nuevo más tarde, pensé que solo era en la noche pero es a toda horas. Como se si alguien me está robando si no puedo ver mi saldo cuando yo quiera",accountability,"Imposibilidad de acceso impide monitoreo de seguridad y detección de actividad sospechosa"
2372,"Me arrepiento de haberme cambiado de banco pensando que era mejor, tuve problemas para hacer pagos con Plin, a veces no carga, que terrible. El otro mes regreso a mi entidad bancaria anterior. Definitivamente no son serios como dice su propaganda. No la recomiendo.",not_applicable,"Problema en sistema PLIN sin aspectos específicos de seguridad"
2373,"Que paso, no se puede pagar ningún servicio, después de la actualización va fatal la aplicación. Pésima, lo hubieran dejado tal cual estaba. Adicional si tengo mi clave digital hace tiempo.",not_applicable,"Pérdida de funcionalidad de pagos post-actualización sin aspectos de seguridad"
2374,"Llevo una semana sin poder ingresar. No se que mas hacer, he ido a ls agencias y me dicen que el problema est siendo tratado y que es por la actualización. Fatal y mal servicio de la aplicación",not_applicable,"Error post-actualización sin resolución presencial efectiva"
2375,"Me gustaria que antes de que finalice sesion haya la opcion d poder elegir si desea seguir o cerrar la sesion, al menos que pregunte eso una vez, xq me ha pasado muchas veces q estoy haciendo pagos o transferencias o revisando los movimientos d mi cuenta y sale un mensaje q la sesion ha finalizado. Por favor agreguen esa opcion.",not_applicable,"Crítica constructiva sobre timeouts de sesión sin aspectos de seguridad"
2376,"Esta app es de lo más nefasto. Siemore hay problemas y hay que estar intentando e intentando para poder hacer una transacción. Solo problemas con este banco, sus seguros no cubren lo que te dicen y es muy vulnerable a robos.",not_applicable,"Crítica general sobre vulnerabilidad sin aspectos específicos de seguridad digital"
2377,"Tengo inconvenientes en el app, por ejemplo cada rato se actualiza para la clave, tampoco puedo pagar mi tarjeta me dice que el servicio no esta disponible, vendo intentando ya hace 5 días, y se vence el 23/12/24.",authenticity,"Solicitud excesiva de actualización de claves bloquea pagos de tarjeta"
2378,"Era una buena aplicación. Desde la última actualización esta lenta e inesperadamente se cierra. Sus claves llegan a la mensajería de inmediato, pero no permite verlo por un tiempo prudente.",not_applicable,"Cierre inesperado y problemas de visualización sin aspectos de seguridad"
2379,"No puedo entrar a la apk. Me sale su sesion ha finalizado engrese nuevamente. Y luego m3 mandan un mensaje diciendo que alguien a intentado ingresar desde otro celular. Cuando he sido yo que intento ingresar.. Q pena q no reconozca mi cel. Arreglen esa falla..",authenticity,"Falsa detección de acceso desde dispositivo desconocido generando alertas erróneas"
2380,"Pésima aplicación falla demasiado o está a cada rato en mantenimiento. Si pueden escoger otro banco háganlo! O usen yape porque lo raro es que puedas plinear sin problemas desde esta aplicación",not_applicable,"Mantenimientos frecuentes y errores técnicos sin aspectos de seguridad"
2381,"Aveces deja de funcionar esta app y no te permite iniciar sesión y no deja de llegarte los SMS de que estas iniciando en otro dispositivo a pesar que es el mismo, falta mucho por mejorar, muchísimo.",authenticity,"Spam de SMS por falsa detección de dispositivo diferente comprometiendo sistema de alertas"
2382,"Me gusta la aplicación pero hoy que realmente la necesito me sale mensaje que hay problemas y que vuelva intentarlo más tarde. Igual pasa con la banca por Internet en desktop. No me permite iniciar sesión desde hace horas.",not_applicable,"Error técnico simultáneo en app y web sin aspectos específicos de seguridad"
2383,"No funciona la app, problemas para el plin, no llega el dinero, todos los días deja de funcionar a las 11 de la noche y no se puede hacer pagos y tampoco funciona la tarjeta en el mismo horario.",not_applicable,"Desactivación programada nocturna sin aspectos específicos de seguridad"
2384,"Pésimo, estoy intentando pagar y siempre sale clave invalida y me llega otra clave, y así sucesivamente, porque lanzan cambios sin probarlo bien. Me estoy llenando de claves que no son válidas. No debería poner ninguna estrella.",authenticity,"Generación masiva de claves inválidas compromete sistema de autenticación"
2385,"Uno esta apurado en entrar a revisar el aplicativo para realizar el uso y sale esto que retraza .ya no pude mandar a tiempo .xk mientras descarga y si ko tuviera megas necesario...creo que deben ciestionar el mandar mensahe de actualizacion si ya uno usa el aplicativo.me eoja xk ni espacio tengo en mi celular para hacer dicha descarga.",not_applicable,"Problema de actualizaciones forzosas sin aspectos específicos de seguridad"
2386,"La app continúa fallando casi 3 semanas, la desinstalé y volví a instalar..pero nada. Simplemente se cuelga. Cuando van a solucionar el problema? No todos podemos ir al banco a realizar operaciones.",not_applicable,"Error técnico prolongado sin aspectos específicos de seguridad"
2387,"Esta con demasiada fallas la última actualización , cuando ingreso sale error que lo intente más tarde y aveces la clave digital demora demasiado , con la anterior versión era más rápido .",authenticity,"Demora excesiva en envío de claves digitales post-actualización"
2388,"Hoy 20 de febrero de 2021 intento abrir la aplicación y se para cerrando ni permite llegar a poner la clave. Desinstalé y volví a instalar pensando que hallaría solución pero el problemas persiste. Necesito urgente mover mi dinero. Muy mala aplicación.",not_applicable,"Cierre inmediato antes de autenticación sin aspectos específicos de seguridad"
2389,"Srs del banco estoy muy incontento con su proceder 1o no me aceptan la clave y después al querer cambiarla cundo me dan la clave despues de ingresar No de DNI ,No de tarjeta ,y todo lo que hay que llenar cuando pongo la clave que me dieron no la acepta ,la cambian muy rápido y vuelvo a repetir hasta 3 intentos q me dicen que ya se acabaron mis opciones. Voy a retirar mi dinero",authenticity,"Rechazo sistemático de claves válidas incluso después de proceso de cambio oficial"
2390,"De la noche a la mañana ya no quiere funcionar la aplicación ingreso todos mis datos y se cierra sola la aplicación me nota Si me pudieran dar una solución porque yo trabajo con la aplicación para ver los movimientos que realizó y ahorita no está funcionando como debe",not_applicable,"Cierre automático después de ingreso de datos sin aspectos específicos de seguridad"
2391,"Todo bien, pero hay algunas opciones que han retirado cómo el efectivo móvil... De ahí en cuánto a la interfaz ha mejorado pero está un poco lenta.... la anterior era mejor. Saludos.",not_applicable,"Crítica constructiva sobre funcionalidad eliminada sin aspectos de seguridad"
2392,"Pésimo ... Cada actualización nueva pide más claves para ingresar y al solicitar la clave digital el SMS demora mucho, finalmente cuando está abierta si atiendes Wasap por ejemplo y regresas a la app del banco está ya está cerrada... Ojalá mejore y vuelva la anterior",authenticity,"Escalada en requerimientos de claves y timeouts agresivos comprometen usabilidad segura"
2393,"Tío Scotiabank la nueva actualización me encantó, era más gráfica, mas clara y enserio se veía mucho mejor pero hace dos días ya no puedo usarla, sale que existe un error con la aplicación, arreglé esto a la brevedad porfavor y le cambió a 5 estrellas aparte merecemos respeto no? Somos clientes y estás fallas con un banco así no pueden existir.",not_applicable,"Error técnico post-actualización inicialmente exitosa sin aspectos de seguridad"
2394,"una porquería se llenan de plata y ni tienen para invertir en una app que funcione que mediocres los encargados de la basura que llaman aplicación y como ganan con las descargas joden a los clientes que confian en un banco asi deberían ser honestos en su publicidad engañosa y mentirosa y todos los que dicen que es buena seran sus empleados por que es UNA BASURA QUE NI ABRE DICIEN "" HUBO UN PROBLEMA"" el problenma es la falta de capacidad de los programadores en hacer algo bien",not_applicable,"Crítica extrema sin aspectos específicos de seguridad"
2395,"La actualización última tiene errores. Escribo la contraseña correcta y me sale con usuario o contraseña inválidos; luego sale con que hay un error en la aplicación inténtalo más tarde. Más estable era la versión anterior.",authenticity,"Rechazo de contraseña correcta seguido de error técnico comprometiendo autenticación"
2396,"pésimo. tengo varias cuentas aquí y me sale el mensaje ""no tiene cuentas afiliasas a esta tarjeta"" y no me deja ingresar. Ya desinstalé e instalé de nuevo pero no funciona la app en mi celular. por eso y más, me estoy cambiando de banco. qué pésima experiencia desde que actualizaron esta app.",authenticity,"Sistema no reconoce cuentas válidas afiliadas comprometiendo acceso legítimo"
2397,"Desde que mi celular se actualizo a Android 10 ya no puedo ingresar a la aplicación, se cierra forzosamente, o simplemente no inicia. Espero puedan solucionar eso, porque la aplicación me iba funcionando bien. Gracias",not_applicable,"Problema de compatibilidad con Android 10 sin aspectos de seguridad"
2398,"Que mal !! Dice que no puedo usarlo si tengo otras aplicaciones, como el Ramset .... Y otras que no tengo, definitivamente nada de lo que dicen , existe en mi equipo. Es muy molesto, por que necesito hacer transacciones urgente desde mi celular, y no puedo !!! Ojalá lo modifiquen , porque sino habrá que buscar otra entidad bancaria que nos facilite la vida!!!!",resistance,"Falso positivo en detección de aplicaciones inexistentes bloquea acceso urgente"
2399,"Porquería me pide datos y todo y al final indica , hay un error de aplicación inténtelo luego, llevo así 2 días , x q no realizan las pruebas necesarias antes d lanzarlo, traen dificultades al momento que uno quiere realizar alguna operación.",not_applicable,"Error después de completar proceso de datos sin aspectos específicos de seguridad"
2400,"Hola buenas No se que le pasa a la aplicación se detiene cuando quieres depositar por plin cuando solo era plin estaba normal todo ahora que se ha unido con yape se demora mucho en poder hacer el tramite de depositos por plin Espero se pueda solucionar este inconveniente",not_applicable,"Problema de rendimiento en PLIN post-integración con Yape sin aspectos de seguridad"
