comentario_id,contenido,clasificacion_seguridad,justificacion
2301,"soy cliente nuevo ... trate de descargar la aplicacion pero no funciona .. crei aue loa demas comentarios solo eran por una mala experiencia pero al parecer siempre es una mala experiencia con la app .. pesimo .. realmente pesimo ... por que necesitaba ver los movimientos urgente de mi tarjeta. como nuevo cliente la experiencia digital es pesima y ni que decir de la experiencia en la agencia.",not_applicable,"Problema técnico general de nuevo cliente sin aspectos específicos de seguridad"
2302,"Demasiados errores. el mas grave es cuando ingreso a mi cuenta free y doy click en mi saldo me sale una notificación ""producto inválido"" aveces de plano no abre el app y aveces me pide ingresar la clave digital cuando ya marque el equipo como seguro, que sucede?",authenticity,"Sistema no reconoce dispositivo marcado como seguro y rechaza producto válido"
2303,"No puedo usar el app. No abre, sale error dejo de funcionar. Uso android 8 y se Supone que si funciona en este android la app. La última actualización lo malogro todo. Arreglar eso. Urgente. Perjudica a los clientes que hacemos todo por la aplicación y no vamos al banco para nada.",not_applicable,"Problema de compatibilidad post-actualización sin aspectos de seguridad"
2304,"Pésimo, lo malograron... Si antes era muy simple... Ahora es simple y pésima, 1)no me permite pagar servicios, simplemente deja de funcionar no avanza el sistema. y aparte de eso. 2)Busco movistar para pagar hacer mi pago, y no lo tienen en su base de datos... Es. Decir esta app no tiene registrada a movistar, solo tengo mi cuenta scotiabank y app para pagar mis servicios.. Y ahora de que me. Sirven???",not_applicable,"Pérdida de funcionalidad de pagos post-actualización sin aspectos de seguridad"
2305,"Pésimo...hoy hice un pago ..me salio errorx 3 veces..nunca apareció la confirmación de la transferencia..así ke lo intente x 3 oportunidades..me rendí de intentarlo..luego vi mis movimientos y si se había realizado las 3 operaciones..menos mal era una amiga y me devolvío el exceso..lo desinstale",integrity,"Múltiples ejecuciones de transacciones sin confirmación comprometen integridad financiera"
2306,"Si pudiera ponerle cero, lo haría. Estoy meses sin poder ingresar a la aplicación, ya no puedo usarla, no sirve. Lo he intentado desde diferentes dispositivos, pero simplemente no ingresa, me sale el mensaje de ""Error en la aplicación, inténtelo más tarde"". ¿Cuando lo solucionaran?. :/",not_applicable,"Error técnico persistente en múltiples dispositivos sin aspectos de seguridad"
2307,"Su aplicación es una basura , se cae a cada rato , ni para poder plinear se puede , "" error al cargar los contactos"" , "" hubo un problema no se puede enviar el dinero"" , una aplicación de banco que se cae a cada rato...",not_applicable,"Error técnico general sin aspectos específicos de seguridad"
2308,"Esta apareciendo un mensaje de '' hubo un Error'', y no puedo acceder a la aplicación. Por favor su apoyo, ya que no puedo hacer los pagos de mis servicios por la quarentena es mi única opción. Lleva varios días así.",not_applicable,"Error técnico persistente sin aspectos específicos de seguridad"
2309,"Esta actualización ha destrozado a la aplicación. Arreglen cuánto antes este problema, por algo son una multinacional con infinitos recursos. Imposible que no puedan solucionar una aplicación móvil.",not_applicable,"Crítica post-actualización sin aspectos específicos de seguridad"
2310,"Qué demonios le pasa a esta app se jodio todo después de su última actualización, ya no puedo hacer transferencias inmediatas a otros bancos como antes lo hacía sin problema, lo único que logran es que uno elimine esta app inútil.",not_applicable,"Pérdida de funcionalidad de transferencias post-actualización sin aspectos de seguridad"
2311,"Su equipo de sistemas es pésimo, tienen la opción de plin o yape por gusto porque no importa la hora del día siempre falla, de que hubo un error, mejor no ofrezcan una app si nunca va a funcionar o al menos intenten arreglarlo sin errores porque la verdad da ganas de cancelar las cuentas de ahi",not_applicable,"Error técnico constante en pagos sin aspectos específicos de seguridad"
2312,"tienen un aplicación complicada te llenan de mucha información de publicidad de crear cuenta es un contaminacion visual en menos de unas horas se me bloqueo la tarjeta y lo peor que el banco no tienen Buenos precemientos te mandan a llamar a números que nunca contestan pésimo banco, pésimo servicio, mala atención.",not_applicable,"Bloqueo de tarjeta sin aspectos específicos de seguridad digital"
2313,"No sirve para nada esta aplicación, solo sale error error y error no deja realizar pagos, justo en la emergencia cuando más se necesita, verdaderamente no sirva para nada. Antes funcionaba bien ahora ya es historia.",not_applicable,"Error técnico recurrente sin aspectos específicos de seguridad"
2314,"Pésima. Primero te obliga a ir físicamente a una agencia para ""reconfirmar"" tus datos (que ellos ya tienen) y cuando tratas de ingresar solo sale un mensaje de error una y otra vez. Parecen un banco estatal",authenticity,"Requerimiento de reconfirmación presencial de datos válidos seguido de error de acceso"
2315,"De verdad ya me esta cansado esta app, cuando recien lo instale estaba maravilloso , despues que se actualizó se volvio una porquería trato de ingresar y me dice « hubo un error en la aplicacion intentelo mas tarde» , asi llevo varios dias, que horrible que esta , no puedo ver nada",not_applicable,"Degradación post-actualización sin aspectos específicos de seguridad"
2316,"La nueva actualización funciona en Android 4 y no se puede actualizar en Android 6.01. Es una vergüenza, ya que todos los demás bancos tienen sus bancas móviles funcionando a la perfección en todas las versiones de Android. Espero se dé pronta solución, delo contrario será más fácil cambiarse de banco que de celular.",not_applicable,"Problema de compatibilidad inversa sin aspectos de seguridad"
2317,"Pésima la app, falla a cada rato, entro y me dice que estoy bloqueado, me pide que cambie contraseña, la cambio y me vuelve a decir lo mismo, si ingreso mi huella en lugar de mi clave tampoco funciona, y no hay quien te ayude porque tampoco contestan sus teléfonos y ni por la pagina web puedes ver tu dinero en tu tarjeta. Un desastre Scotiabank. Me voy a Interbank porque no dan ni luces de querer mejorar.",authenticity,"Bloqueo recurrente después de cambio de contraseña y falla en autenticación biométrica"
2318,"De que sirve que no te cobren comisión , si te perjudican constantemente con el cuento que están en mantenimiento , me arrepiento haberme cambiado de banco , he pasado momentos desagradables al no poder pagar en el grifo el abastecimiento de combustible ya que no contaba con dinero en efectivo",not_applicable,"Mantenimientos frecuentes sin aspectos específicos de seguridad"
2319,"La app dejó de funcionar desde hace unos días. Se cierra la sesión al querer ingresar, indicando error en la aplicación. Veo que es un problema general. Pésima experiencia.",not_applicable,"Error técnico general sin aspectos específicos de seguridad"
2320,"No me deja ingresar pide codigo de texto, estoy en el exterior sin servicio de Roaming disponible y no hay una manera sencilla de hacer que llegue clave al correo... No ayudan en nada todo tan complicado de manera presencial o demasiados requisitos y costosos... Horrible",authenticity,"Dependencia exclusiva de SMS sin alternativa de email compromete acceso internacional"
2321,"Para ingresar a la App te dan una clave digital la cual te la envían mediante SMS, pero hace poco me robaron y cambié de número de teléfono, ahora no puedo ingresar a mi cuenta porque la clave se la envían a mi anterior número y no hay ninguna manera de resolverlo, ni mediante la web , que fastidio!!!!!!!!!",authenticity,"Imposibilidad de cambiar número telefónico para claves digitales después de robo compromete acceso"
2322,"Esta porquería de aplicación lanza error muchas de las veces en que uno la necesita, otra perla es la llegada de los SMS de confirmación tardía, sino van a tener un buen servicio de APP mejor no lo tengan!!!",authenticity,"Demora en envío de SMS de confirmación compromete proceso de autenticación"
2323,"Sres hay algún problema con la aplicación? No se puede transferir con Plin, no se puede hacer compras por Internet a pesar que está habilitado, pueden dar solución a esto que se ha vuelto fastidioso estar ingresando a cada rato al App?",not_applicable,"Problema funcional en transferencias y compras sin aspectos de seguridad"
2324,"Funcionaba bien hasta antes de la última actualización. Ahora no permite el ingreso, dizque x seguridad ante la existencia de aplicaciones xposed, ramjet o sustrate. veo que muchos tienen el mismo problema. que desastre.",resistance,"Falso positivo en detección de aplicaciones de modificación bloquea acceso masivo"
2325,"Es un tonteria te pide q actualices en un cajero o una agencia mas cercana tu numero de celular y correo electronico. Mi numero y mi correo sigue siendo el mismo es mas me acerque a la agencia de minka. Y me dijeron q no sabian y q habia mas clientes al igual q yo. Q esperemos q solo se actualise la aplicacion es una lastima con escotiabank.",authenticity,"Requerimiento de actualización presencial de datos válidos con personal sin capacidad de resolución"
2326,"Esta aplicación es una tontería, no te permite realizar las operaciones, dice todo el tiempo hubo problemas con la aplicación, deberían tener más empatía y solucionar esta falencia a la brevedad... Uno quiere realizar transferencias y operaciones de pago y no se puede hacer nada. Que fastidio.",not_applicable,"Error técnico recurrente en operaciones sin aspectos específicos de seguridad"
2327,"Es la peor aplicación de banca móvil hasta las app de las cajas le ganan. En la madrugada no se puede ingresar ni usar plin. La verdad deberían cambiar a su programador hasta el queso la app Hoy jueves 25 son las 00.13 y no puedo mandar dinero en plin PORQUERIA DE APP",not_applicable,"Desactivación nocturna programada sin aspectos específicos de seguridad"
2328,"Acabo de bajar su aplicación y no puedo pagar mis servicios. Sale que no tengo recibos pendientes cuando si los temgo. O sale que hay un problema con el movil. Pésimo. Pensé que ahora podría hacer todo por aqui y veo que asi no será. Y no soy la única.. por los comentarios de otros usuarios no hay esperanza. Si hubiera 0 estrellas se las pondría pero tengo que ponerle muy a mi pesar 1. Tendré que hacer todo presencialmente o llevar mi cuenta a otro lado.",not_applicable,"Error en detección de servicios pendientes sin aspectos de seguridad"
2329,"Señores por favor solucionen ya el problema de la app...... Ya actualize y nada , no puedo hacer transferencias entre mis cuenta, ni logro ingresar a mis cuentas, cuando abro la app inmediatamente aparece error. Tienen que hacer algo porfavor.🙏",not_applicable,"Error técnico inmediato post-actualización sin aspectos de seguridad"
2330,"Buenos días, llevo varias veces intentando abrir la aplicacion y solo me sale un msj de Error e intente más tarde. Intento más tarde y no logro acceder a mi cuenta. Tengo pagos que realizar y no puedo hacerlos por este problema.",not_applicable,"Error técnico persistente sin aspectos específicos de seguridad"
2331,"Pésima actualizacion! Llevo 4 dias intentando ingresar, después de completar demasiada informacion, sale el aviso que hay un error en la aplicación y que se intente más tarde",not_applicable,"Error post-ingreso de información completa sin aspectos de seguridad"
2332,"En la última actualización que realizar está hecho un desastre, no carga los contactos de plin y si te demoras un poquito se bloquea y ya no puedes continuar con la operación que estás realizando, mejor volver a la versión anterior",not_applicable,"Problemas de carga y timeouts sin aspectos específicos de seguridad"
2333,"Deberían de revisar bien esta aplicación, siempre sale que hubo error y otra cosa, aveces Plinea hasta 2 veces al mismo número y los movimientos salen con fechas distintas. Hasta los depósitos de mi empleador.",integrity,"Transacciones duplicadas con fechas incorrectas comprometen integridad de registros"
2334,"Buenos días, que incomodidad necesito saber el saldo que presenta mi tarjeta y no puedo visualizar puesto que al descargar la. Aplicación solicite datos contraseñas pero luego sale un mensaje manifestando que no se puede ""utilizar la. Aplicación"" que clase de herramienta es si no se puede utilizar?!!. Gran incomodidad por favor solucionen (cliente insatisfecho)",not_applicable,"Error post-configuración inicial sin aspectos específicos de seguridad"
2335,"Estoy seguro que el área de sistemas del banco no ve esto, su aplicación PLIN se supera cada vez más pero para ser peor. Falla a cada rato , si se pudiera calificar con menos de 1 estrella lo haría. PÉSIMA!",not_applicable,"Error técnico en sistema PLIN sin aspectos específicos de seguridad"
2336,"Pues también con el mismo problema cada vez que quiero pagar sale hubo un error o estamos actualizando y hasta sobrecargo me cobraron por no pagar en fecha reclamé y me han devuelto una parte del sobre pago todavia sigo reclamando.",integrity,"Sobrecargos por imposibilidad de pago debido a errores del sistema comprometiendo integridad financiera"
2337,"porqueria de app siempre que quieres hacer una transferencia se cuelga. dice que ahi fallas que no se pudo realizar, que vuelva a intentarlo en otro momento. como si yo voy a esperar el momento que le de la gana de funcionar a su basura de aplicación. no sirve para nada perdida de tiempo. varias veces en dias distintos nunca funciona fluido como la del interban. pesima app",not_applicable,"Error técnico recurrente en transferencias sin aspectos específicos de seguridad"
2338,"El app está pésimo hace varios días no puedo ingresar sale que hay fallas en el sistema y esto persiste, deben arreglar a la brevedad, ya desinstale la aplicación y la volví a instalar pero siguen las fallas",not_applicable,"Error sistémico persistente sin aspectos específicos de seguridad"
2339,"Terrible me pide identificarme muy seguido y no me permite hacer los pagos que fue para lo que la descargue, ahora tampoco puedo ver los movimientos por qué a veces ingresa y otras aparece un error para que intente luego.",authenticity,"Solicitudes excesivas de identificación bloquean operaciones legítimas"
2340,"ÚLTIMAMENTE TENGO PROBLEMAS AL INGRESAR AL APP, CADA QUE INTENTO ME SALE ""ERROR DE APLICACIÓN INTENTELO MAS TARDE"" Y ES A CADA RATO, OSEA ANTES DE QUE LO ACTUALIZARA ESTABA BIEN PER AHORA YA NI ENTRAR PARA MIS MI SALDO O MOVIMIENTO, ENTONCES TENGO QUE DESINSTALAR TODAS LAS VECES QUE QUIERO INGRESAR PARA PODER RECIEN ENTRAR Y LO PEOR NO ES ESO SI NO QUE CADA QUE CIERRO LA APP Y QUIERO VOLVER A ENTRAR YA NO ME PERMITE Y TENGO QUE VOLVER A DESINSTALAR E INSTALAR PARA RECIEN PODER ENTRAR, LASTIMA.",not_applicable,"Error técnico que requiere reinstalación constante sin aspectos de seguridad"
2341,"Señores buena, deben tener programadores técnicos en el área y un ingeniero en sistemas que verifique y constate que todo los cambio que le realize a su aplicación sea de mejora y no que lo malogre, invierta para que su aplicación no decaiga eso hará que nosotros los cliente nos molestemos",not_applicable,"Crítica técnica constructiva sin aspectos específicos de seguridad"
2342,"Me agrada esta actualización lo que es bien complicado es realizar pagos si quiero pagar campo fe me salen cosas sin sentido y demasiadas opciones..deberían tomar de modelo a la app del BCP es más fácil de usar y más intuitivo con el usuaro",not_applicable,"Crítica de usabilidad en pagos sin aspectos de seguridad"
2343,"Después de instalarlo, quiero ingresar pero sale error en la aplicación pruebe más tarde. Estoy que intento desde una semana pero sale lo mismo, la anterior aplicación ingresaba sin problemas pero cuando lo actualice ya no pude ingresar",not_applicable,"Error post-instalación persistente sin aspectos específicos de seguridad"
2344,"Esta repleto de problemas, salidas inesperadas de la app, existen días en que es imposible ingresar por error en la app , yo no comprendo como pueden lanzar una aplicación con tantos problemas sin solucionar.",not_applicable,"Errores técnicos múltiples sin aspectos específicos de seguridad"
2345,"Es nueva actualización es completamente mala fue una odisea el poder ingresar, porque cambiar si antes me parecía perfecta y sencilla ahora demora demasiado, arreglen esto porfavor que se vuelva sencillo y seguro como antes no este intento de mejorar su app.",not_applicable,"Degradación de rendimiento post-actualización sin aspectos de seguridad"
2346,"Que pasa con la app?? No permite hacer operaciones y a cada instante aparece el mensaje ""Ha ocurrido un error........."" Arreglenlo prontoooo..!!!! Cambiare mi calificacion en cuanto este resuelto (29/06/2022)",not_applicable,"Error técnico recurrente en operaciones sin aspectos específicos de seguridad"
2347,"Tengo una tarjeta que saque en 2019, y sale desactivada??.. desde ese año hasta ahora no puedo activarla y he tenido que migrar a otro banco, porque este banco no me permite usarla¿?... Y peor aún abrir otra cuenta... Con esas ""facilidades"" es muy díficil solventar cualquier deuda así tenga más de 10 años???... Porque según parece las deudas son eternas en nuestro país...",not_applicable,"Problema de activación de tarjeta sin aspectos específicos de seguridad digital"
2348,"le daria 0 estrella si se pudiera no abre la app sale error desde hace una semana y no debe ser asi .. si van a poner una app que este buena pues no que este en fallos porfavor solucionen ese problema porque muchos aparte de mi trabajamos con la tarjeta .... gracias",not_applicable,"Error técnico persistente sin aspectos específicos de seguridad"
2349,"Desde hace varios días me resulta IMPOSIBLE iniciar sesión en esta app. Lo peor es que veo que hay gente quejándose desde la misma semana y la última actualización es del 18/02. Cuándo piensan volver a la última versión que sí funcionaba?",not_applicable,"Error técnico generalizado sin aspectos específicos de seguridad"
2350,"La última actualización está pésima. Al intentar ingresar me sale un mensaje que dice que tengo instalada aplicaciones similares a xPosed, Ramjet o Substrate y no me deja utilizar la aplicación. Por favor solucionen este problema que hasta antes de la actualización podía usar la aplicación sin problema",resistance,"Falso positivo en detección de aplicaciones de modificación post-actualización"
2351,"Hace unos años dejé de usar este banco por la deficiencia en su aplicativo ahora que vuelvo abrir una cuenta aquí encontre que dicha aplicación estaba mejor que antes pero días después que vuelvo a ingresar y me doy con la sorpresa que nose puede pese aver ya echo la actualización ya llevo cerca 3 semanas aproximadamente que no puedo ingresar. Acá voy a recibir mis pagos pero si veo que persiste voy tener que regresar a usar otros bancos así demore uno o dos días para poder visualizar depósito.",not_applicable,"Error técnico post-actualización en cliente que regresa sin aspectos de seguridad"
2352,"Desde hace 1 semana no puedo ingresar a la aplicación. Se queda en la pantalla de carga, nisiquiera abre. He intentado borrando y reinstalando la aplicación pero sigo con el mismo problema.",not_applicable,"Error técnico en pantalla de carga sin aspectos específicos de seguridad"
2353,"La última actualización es un desastre, no se abre la app y si se logra abrir no reconoce las cuentas, no se puede realizar pagos, etc, es necesario que la reparen ya que en este contexto es mas necesario realizar operaciones por la app.",authenticity,"Sistema no reconoce cuentas válidas post-actualización comprometiendo autenticación"
2354,"Buenos días Scotiabank Perú, la aplicación presenta fallos en reiteradas veces, ejemplo en mi caso quiero transferir mi CTS a mi cuenta de ahorros y me sale lo sentimos tu transacción no ha podido ser completada, tu cuenta CTS presenta problemas :( y no hay un medio de comunicación virtual para comunicarse por WhatsApp.",not_applicable,"Error específico en transferencia CTS sin aspectos de seguridad"
2355,"Mi app me obligo a actualizarlo, despues de hacerlo no me permite ingresar indicando ""hubo un error en el app"", necesitaba hacer un tramite por este medio pero me ha perjudicado su actualizacion Deberian primero confirmar el correcto funcionamiento de su app antes de lanzarla y obligar a sus usuarios a tenerla. Tendré que desinstalarla porque no sirve",not_applicable,"Error post-actualización obligatoria sin aspectos específicos de seguridad"
2356,"Me pidió actualizar y desde entonces no me deja ingresar, si van a realizar actualizaciones que sean funcionales ya me sucedió antes, tuve que ir a plataforma y pedir que habiliten mi cuenta , no puede ser posible.",authenticity,"Bloqueo de cuenta post-actualización requiere habilitación presencial"
2357,"Es pésima, ni siquiera se puede abrir el app xq el banco nunca te envía la clave. Ya llevo más de una semana intentándolo. Llame al banco y tampoco solucionaron nada a la fecha. Y hoy vuelve a fallar",authenticity,"Fallo sistemático en envío de claves de acceso compromete autenticación"
2358,"Estoy tratando de ingresar a mi banca móvil y no me deja, siempre sale el mensaje ""hubo un error en la aplicación, porfavor vuelve a intentar más tarde"" De verdad es molesto porque debo hacer un plineo urgente y no se puede. Pésimo servicio.",not_applicable,"Error técnico recurrente sin aspectos específicos de seguridad"
2359,"He estado llamando al número que aparece en esta página pero nadie contesta. Desde el viernes de la semana antepasada, no puedo acceder al app *Desafortunadamente Scotiabank se ha detenido* 'Vuelva a abrir la app' Abres y dice: *Scotiabank sigue fallando* 'Cierre la app' He Desinstalado e instalado 4 veces el aplicativo...y sigue sin abrir dando las mismas respuestas. He llamado a Att.cliente y me dijeron que fuera a plataforma:*cambie su celular* El app. dice que mi celular es apto! SOLUCION",not_applicable,"Error técnico persistente con soporte inadecuado sin aspectos de seguridad"
2360,"La aplicación siempre tiene fallas, y en el momento que más se necesita la app para realizar alguna operación falla, y las fallas son constantes y nunca hacen nada al respecto, pésimo servicio.",not_applicable,"Error técnico recurrente sin aspectos específicos de seguridad"
2361,"Pésimo funcionamiento, casi siempre sale ""vuelve a intentarlo más tarde"" cada vez que quier ingresar a la app. Solucionen y optimicen su aplicativo que genera mucha molestia a los usuarios.",not_applicable,"Error técnico sistemático sin aspectos específicos de seguridad"
2362,"esta apps es una total tonteria y perdida de tiempo. en si el banco por q sus agencias son operados por personas sin un poco de sentido común ni trato a sus clientes. ahora el app lo tengo bloqueado y por mas q asisto a las agencias y me dan solución, es solo eso palabras pq al final nunca se como van mis finanzas. cero de cero por su atención.",not_applicable,"Bloqueo de aplicación sin resolución presencial efectiva"
2363,"Quiero registrar una nueva cuenta para mi papá para q se le haga más fácil ver su dinero pero pide q tiene ir a una agencia y tanta cosa, yo creo q esto es innecesario, antes la wed de scotiabank era más fácil de entrar, vi la nueva actualización pero yo siempre entro a la antigua, ahora ya no está :( la hubieran dejado .",not_applicable,"Requerimiento de proceso presencial para registro sin aspectos de seguridad"
2364,"Hay muchas fallas constantes. No se puede hacer plin ni yapes o a veces sale que no se pudo enviar el dinero, pero sí se envió, provocando envíos dobles. Por favor, dar solución pronto.",integrity,"Envíos dobles de dinero por falsos mensajes de error comprometen integridad financiera"
2365,"Tengo días sin poder acceder porque aparece un mensaje ""la aplicación no se puede utilizar"". Borre todos los datos, caché, desinstalé, reinicié, etc. y continua el problema. Solución señores.",not_applicable,"Error técnico persistente después de múltiples intentos de solución"
2366,"Me pidieron que actualizara la app en la cual accedí, pero no me permite ingresar presentando un mensaje de error y que vuelva a intentarlo más tarde. Me encantaría que pudieran arreglar ese problema. Gracias",not_applicable,"Error post-actualización requerida sin aspectos específicos de seguridad"
2367,"** 02/10 ** he visto las opiniones de otros usuarios y resulta que este problema tiene más de dos semanas. Que asco de banco! ** 01/10 ** desde ayer estoy intentando utilizar la aplicación en mi teléfono Android y se cae... Pide la clave, me muestra durante un segundo mis cuentas y luego se cierra. La he desinstalado y vuelto instalar e igualmente sigue fallando. Qué pena Scotiabank, qué pena que no lo hayas detectado tú antes y qué pena que un par de días no seas capaz de resolverlo.",not_applicable,"Cierre abrupto después de mostrar cuentas sin aspectos específicos de seguridad"
2368,"Llevo varios días sin poder ingresar al app, siempre me sale el mensaje de hubo un problema con la aplicación inténtelo más tarde, pésimo servicio. Uno tiene que hacer pagos, consultas.",not_applicable,"Error técnico persistente sin aspectos específicos de seguridad"
