1488,"Se supone que las actualizaciones deben mejorar el app, sin embargo terminan estropeando el buen funcionamiento, deberían tomar acciones rápidas y cambiar al equipo de desarrollo por ineficientes.",not_applicable
1489,Que tontería de aplicación tiene errores de ingreso ....no reconoce dice que esta mal la información....y después de 3 intentos te bloquean 24 hrs que cólera enserio....deberían mejorar la aplicación tiene esos errores que nos atrasan,authenticity
1490,"Pésima... Actualicé la app, y me pide actualizar mis datos, pongo la opción y ahora me dice que en estos momentos no podemos atender su solicitud 😡😡 y no me deja hacer nada👎, pésima, deberían invertir en un buen programador o no sé, ya que hoy por hoy muchas personas utilizamos éstas aplicaciones para no estar yendo a los bancos🤷 pésima, pésima aplicación 😡😡",authenticity
1491,"Estoy insatisfecha, ingreso a la aplicación me pide actualizar mis datos ingreso el token y sale cargando y se cierra... Una y otra vez, y nunca puedo ver mis cuentas. Solicito apoyo en esto.",authenticity
1492,"Necesitan actualizarse inmediatamente, es una aplicación muy poco optimizada y demasiado básica para la cantidad de usuarios que tiene este banco. Contraten a un nuevo equipo de desarrolladores que sepan adaptarse a estas tecnologías, pues ahora todos usan las apps bancarias y la suya es, sin duda, la peor de todas.",not_applicable
1493,"Cada día peor, ya no puedo ingresar, ahora me piden que active clave dinámica, yo ya contaba con mi clave dinámica pero, nose porque me dicen que me vuelva a acercar a una agencia, claro como en sus agencias atiende de lo mejor, uno irá a perder el tiempo haciendo largas colas.",authenticity
1494,"Ahorita está siendo una pésima aplicación, pide actualizar tus datos, para ello tienes que introducir tu clave del token, se hizo eso y después nuevamente vuelve al mismo procedimiento, deberían de tomar en cuenta las opiniones de sus usuarios, llevo las de 5 días con ese problema y deberían de solucionarlo.",authenticity
1495,"El aplicativo no permite realizar ninguna operación, no se puede ingresar, se abre y automáticamente se cierra. Por favor solucionen este problema, muchos ciudadanos lo necesitamos.",not_applicable
1496,"La aplicación tiene como 3 meses fallando, no funciona la opción de trasferencia interbancaria, sigue saliendo que esta en mantenimiento, y nos hacen exponernos al tener que ir al banco.",not_applicable
1497,"Personal del banco no aceptan que su Appl. Tiene problemas, aducen que son lo teléfonos, cada ves somos más los que tenemos ese mismo problema que carga, se congela, no envía notificaciones etc.",not_applicable
1498,"Cada vez que quiero ingresar me sale este mensaje: ""En este momento no hemos podido procesar tu información,por favor intente más tarde"" ... Después de 30 a más intentos recién abre ... Pero como es el banco de la nación , el banco del estado , van a coger todos estos comentarios y lo van a tirar a la basura ,porque a uds no les interesa!!!",not_applicable
1499,"Desde hace una semana no puedo utilizar la app, desde que se pidió la actualización del la app... Sale la pantalla congelada que no permite digitar los datos .... Espero solución a este problema urgente",not_applicable
1500,"Desde la ultima actualizacion NO permite ingresar, no se puede completar los campos numericos, ya lo desinstale y volvi a instalar y nada , exijo que den solucion de una vez ya paso casi un mes con este problema",not_applicable
